chinese,english
次日，范進少不得拜拜鄉鄰。魏好古又約了一班同案的朋友，彼此來往。因是鄉試年，做了幾個文會。不覺到了六月盡間，這些同案的人約范進去鄉試。范進因沒有盤費，走去同丈人商議，被胡屠戶一口啐在臉上，罵了一個狗血噴頭道：「不要失了你的時了！你自己只覺得中了一個相公，就『癩蝦蟆想喫起天鵝肉』來！我聽見人說，就是中相公時，也不是你的文章，還是宗師看見你老，不過意，捨與你的。如今癡心就想中起老爺來！這些中老爺的都是天上的『文曲星』！你不看見城裏張府上那些老爺，都有萬貫家私，一個個方面大耳。像你這尖嘴猴腮，也該撒拋尿自己照照！不三不四，就想天鵝屁喫！趁早收了這心，明年在我們行事裏替你尋一個館，每年尋幾兩銀子，養活你那老不死的老娘和你老婆是正經！你問我借盤纏，我一天殺一個豬還賺不得錢把銀子，都把與你去丟在水裏，叫我一家老小嗑西北風！」一頓夾七夾八，罵的范進摸門不著。,"The next day Fan Jin had to call on relatives and friends. Wei Hao-Gu invited him to meet some other fellow candidates, and since it was the year for the provincial examination they held a number of literary meetings. Soon it was the end of the sixth month. Fan Jin's fellow candidates asked him to go with them to the provincial capital for the examination, but he had no money for the journey. He went to ask his father-inlaw to help.Butcher Hu spat in his face, and poured out a torrent of abuse. 「Don't be a fool!」 he roared. 「Just passing one examination has turned your head completely—you're like a toad trying to swallow a swan! And I hear that you scraped through not because of your essay, but because the examiner pitied you for being so old. Now, like a fool, you want to pass the higher examination and become an official. But do you know who those officials are? They are all stars in heaven! Look at the Zhang family in the city. All those officials have pots of money, dignified faces and big ears. But your mouth sticks out and you've a chin like an ape's. You should piss on the ground and look at your face in the puddle! You look like a monkey, yet you want to become an official. Come off it! Next year I shall find a teaching job for you with one of my friends so that you can make a few taels of silver to support that old, neverdying mother of yours and your wife — and it's high time you did! Yet you ask me for travelling expenses! I kill just one pig a day, and only make ten cents per pig. If I give you all my silver to play ducks and drakes with, my family will have to live on air.」 The butcher went on cursing at full blast, till Fan Jin's head spun."
辭了丈人回來，自心裏想：「宗師說我火候已到，自古無場外的舉人，如不進去考他一考，如何甘心？」因向幾個同案商議，瞞著丈人，到城裏鄉試。出了場，即便回家。家裏已是餓了兩三天。被胡屠戶知道，又罵了一頓。,"When he got home again, he thought to himself, 「Commissioner Zhou said that I showed maturity. And, from ancient times till now, who ever passed the first examination without going in for the second? I shan't rest easy till I've taken it.」 So he asked his fellow candidates to help him, and went to the city, without telling his father-in-law, to take the examination. When the examination was over he returned home, only to find that his family had had no food for two days. And Butcher Hu cursed him again."
到出榜那日，家裏沒有早飯米，母親吩咐范進道：「我有一隻生蛋的母雞，你快拿集上去賣了，買幾升米來煮餐粥喫。我已是餓的兩眼都看不見了！」范進慌忙抱了雞，走出門去。纔去不到兩個時候，只聽得一片聲的鑼響，三匹馬闖將來。那三個人下了馬，把馬栓在茅草棚上，一片聲叫道：「快請范老爺出來，恭喜高中了。」,"The day the results came out there was nothing to eat in the house, and Fan Jin's mother told him, 「Take that hen of mine to the market and sell it; then buy a few measures of rice to make gruel. I'm faint with hunger.」 Fan Jin tucked the hen under his arm and hurried out. He had only been gone an hour or so, when gongs sounded and three horsemen galloped up. They alighted, tethered their horses to the shed, and called out: 「Where is the honourable Mr. Fan? We have come to congratulate him on passing the provincial examination.」"
母親不知是甚事，嚇得躲在屋裏；聽見中了，方敢伸出頭來說道：「諸位請坐，小兒方纔出去了。」那些報錄人道：「原來是老太太。」大家簇擁著要喜錢。,"Not knowing what had happened, Fan Jin's mother had hidden herself in the house for fear. But when she heard that he had passed, she plucked up courage to poke her head out and say, 「Please come in and sit down. My son has gone out.」「So this is the old lady,」 said the heralds. And they pressed forward to demand a tip."
正在吵鬧，又是幾匹馬，二報、三報到了，擠了一屋的人，茅草棚地下都坐滿了。鄰居都來了，擠著看。老太太沒奈何，只得央及一個鄰居去尋他兒子。,"In the midst of this excitement two more batches of horsemen arrived. Some squeezed inside while the others packed. themselves into the shed, where they had to sit on the ground. Neighbours gathered round, too, to watch; and the flustered old lady asked one of them to go to look for her son."
那鄰居飛奔到集上，一地裏尋不見；直尋到集東頭，見范進抱著雞，手裏插個草標，一步一踱的，東張西望，在那裏尋人買。鄰居道：「范相公，快些回去。你恭喜中了舉人，報喜人擠了一屋裏。」范進道是哄他，只裝不聽見，低著頭，往前走。鄰居見他不理，走上來，就要奪他手裏的雞。范進道：「你奪我的雞怎的？你又不買。」鄰居道：「你中了舉了，叫你家去打發報子哩。」范進道：「高鄰，你曉得我今日沒有米，要賣這雞去救命，為甚麼拿這話來混我？我又不同你頑，你自回去罷，莫誤了我賣雞。」鄰居見他不信，劈手把雞奪了，摜在地下，一把拉了回來。,"The neighbour ran to the market-place, but Fan Jin was nowhere to be seen. Only when he reached the east end of the market did he discover the scholar, clutching the hen tightly against his chest and holding a sales sign in one hand. Fan Jin was pacing slowly along, looking right and left for a customer.「Go home quickly, Mr. Fan!」 cried the neighbour. 「Congratulations! You have passed the provincial examination. Your house is full of heralds.」Thinking this fellow was making fun of him, Fan Jin pretended not to hear, and walked forward with lowered head. Seeing that he paid no attention, the neighbour went up to him and tried to grab the hen.「Why are you taking my hen?」 protested Fan Jin. 「You don't want to buy it.」「You have passed,」 insisted the neighbour. 「They want you to go home to send off the heralds.」「Good neighbour,」 said Fan Jin, 「we have no rice left at home, so I have to sell this hen. It's a matter of life and death. This is no time for jokes! Do go away, so as not to spoil my chance of a sale.」When the neighbour saw that Fan Jin did not believe him, he seized the hen, threw it to the ground, and dragged the scholar back by main force to his home."
報錄人見了道：「好了，新貴人回來了！」正要擁著他說話。范進三兩步走進屋裏來，見中間報帖已經升掛起來，上寫道：「捷報貴府老爺范諱進高中廣東鄉試第七名亞元。京報連登黃甲。」,"The heralds cried, 「Good! The newly honoured one is back.」 They pressed forward to congratulate him. But Fan Jin brushed past them into the house to look at the official announcement, already hung up, which read: 「This is to announce that the master of your honourable mansion, Fan Jin, has passed the provincial examination in Guangdong, coming seventh in the list. May better news follow in rapid succession!」"
范進不看便罷，看了一遍，又念一遍，自己把兩手拍了一下，笑了一聲道：「噫！好了！我中了！」說著，往後一交跌倒，牙關咬緊，不醒人事。老太太慌了，慌將幾口開水灌了過來。他爬將起來，又怕著手大笑道：「噫！好！我中了！」笑著，不由分說，就往門外飛跑，把報錄人和鄰居都嚇了一跳。走出大門不多路，一腳踹在塘裏，掙起來，頭髮都跌散了，兩手黃泥，淋淋漓漓一身的水，眾人拉他不住。拍著笑著，一直走到集上去了。,"Fan Jin feasted his eyes on this announcement; and, after reading it through once to himself, read it once more aloud. Clapping his hands, he laughed and exclaimed, 「Ha! Good! I have passed.」 Then, stepping back, he fell down in a dead faint. His mother hastily poured some boiled water between his lips, whereupon he recovered consciousness and struggled to his feet. Clapping his hands again, he let out a peal of laughter and shouted, 「Aha! I've passed! I've passed!」 Laughing wildly he ran outside, giving the heralds and the neighbours the fright of their lives. Not far from the front door he slipped and fell into a pond. When he clambered out, his hair was dishevelled, his hands muddied and his whole body dripping with slime. But nobody could stop him. Still clapping his hands and laughing, he headed straight for the market."
眾人大眼望小眼，一齊道：「原來新貴人歡喜瘋了。」老太太哭道：「怎生這樣苦命的事！中了一個甚麼舉人，就得了這個拙病！這一瘋了，幾時纔得好？」娘子胡氏道：「早上好好出去，怎的就得了這樣的病！卻是如何是好？」眾鄰居勸道：「老太太不要心慌。我們而今且派兩個人跟定了范老爺。這裏眾人家裏拿些雞、蛋、酒、米，且管待了報子上的老爹們，再為商酌。」,"They all looked at each other in consternation, and said, 「The new honour has sent him off his head!」His mother wailed, 「Aren't we out of luck! Why should passing an examination do this to him? Now he's mad, goodness knows when he'll get better.」「He was all right this morning when he went out,」 said his wife. 「What could have brought on this attack? What shall we do?」The neighbours consoled them. 「Don't be upset,」 they said. 「We will send a couple of men to keep an eye on Mr. Fan. And we'll all bring wine and eggs and rice for these heralds. Then we can discuss what's to be done.」"
當下眾鄰居有拿雞蛋來的，有拿白酒來的，也有背了斗米來的，也有捉兩隻雞來的。娘子哭哭啼啼，在廚下收拾齊了，拿在草棚下。鄰居又搬些桌凳，請報錄的坐著喫酒，商議：「他這瘋了，如何是好？」報錄的內中有一個人道：「在下倒有一個主意，不知可以行得行不得？」眾人問：「如何主意？」那人道：「范老爺平日可有最怕的人？他只因歡喜狠了，痰涌上來，迷了心竅。如今只消他怕的這個人來打他一個嘴巴，說：『這報錄的話都是哄你，你並不曾中。』他喫這一嚇，把痰吐了出來，就明白了。」,"The neighbours brought eggs or wine, lugged along sacks of rice or carried over chickens. Fan Jin's wife wailed as she prepared the food in the kitchen. Then she took it to the shed, neighbours brought tables and stools, and they asked the heralds to sit down to a meal while they discussed what to do.「I have an idea,」 said one of the heralds. 「But I don't know whether it will work or not.」「What idea?」 they asked.「There must be someone the honourable Mr. Fan usually stands in awe of,」 said the herald. 「He's only been thrown off his balance because sudden joy made him choke on his phlegm. If you can get someone he's afraid of to slap him in the face and say, 'It's all a joke. You haven't passed any examination!'—then the fright will make him cough up his phlegm, and he'll come to his senses again.」"
眾人都拍手道：「這個主意好得緊，妙得緊！范老爺怕的，莫過於肉案上子胡老爹。好了！快尋胡老爹來。他想是還不知道，在集上賣肉哩。」又一個人道：「在集上賣肉，他倒好知道了；他從五更鼓就往東頭集上迎豬，還不曾回來。快些迎著去尋他。」,"They all clapped their hands and said, 「That's a fine idea. Mr. Fan is more afraid of Butcher Hu than of anyone else. Let's hurry up and fetch him. He's probably still in the market, and hasn't yet heard the news.」「If he were selling meat in the market, he would have heard the news by now,」 said a neighbour. 「He went out at dawn to the east market to fetch pigs, and he can't have come back yet. Someone had better go quickly to find him.」"
一個人飛奔去迎，走到半路，遇著胡屠戶來，後面跟著一個燒湯的二漢，提著七八斤肉，四五千錢，正來賀喜。進門見了老太太，老太太哭著告訴了一番。胡屠戶詫異道：「難道這等沒福！」外邊人一片聲請胡老爹說話。胡屠戶把肉和錢交與女兒，走了出來。眾人如此這般，同他商議。胡屠戶作難道：「雖然是我女婿，如今卻做了老爺，就是天上的星宿。天上的星宿是打不得的！我聽得齋公們說：打了天上的星宿，閻王就要拿去打一百鐵棍，發在十八層地獄，永不得翻身。我卻是不敢做這樣的事！」,"One of the neighbours hurried off in search of the butcher, and presently met him on the road, followed by an assistant who was carrying seven or eight catties of meat and four or five strings of cash. Butcher Hu was coming to offer his congratulations. Fan Jin's mother, crying bitterly, told him what had happened.「How could he be so unlucky!」 exclaimed the butcher. They were calling for him outside, so he gave the meat and the money to his daughter, and went out. The heralds put their plan before him, but Butcher Hu demurred.「He may be my son-in-law,」 he said, 「but he's an official now — one of the stars in heaven. How can you hit one of the stars in heaven? I've heard that whoever hits the stars in heaven will be carried away by the King of Hell, given a hundred strokes with an iron rod, and shut up in the eighteenth hell, never to become a human being again. I daren't do a thing like that.」"
鄰居內一個尖酸人說道：「罷麼！胡老爹！你每日殺豬的營生，白刀子進去，紅刀子出來，閻王也不知叫判官在簿子上記了你幾千條鐵棍。就是添上這一百棍，也打甚麼要緊？只恐把鐵棍子打完了，也算不到這筆帳上來。或者你救好了女婿的病，閻王敘功，從地獄裏把你提上第十七層來，也不可知。」,"「Mr. Hu!」 cried a sarcastic neighbour. 「You make your living by killing pigs. Every day the blade goes in white and comes out red. After all the blood you've shed, the King of Hell must have marked you down for several thousand strokes by iron rods, so what does it matter if he adds a hundred more? Quite likely he will have used up all his iron rods before getting round to beating you for this, anyway. Or maybe, if you cure your son-in-law, the King of Hell may consider that as a good deed, and promote you from the eighteenth hell to the seventeenth.」"
報錄的人道：「不要只管講笑話。胡老爹，這個事須是這般。你沒奈何，權變一權變。」屠戶被眾人局不過，只得連斟兩碗酒喝了，壯一壯膽，把方纔這些小心收起，將平日的兇惡樣子拿出來，捲一捲那油晃晃的衣袖，走上集去。眾鄰居五六個都跟著走。,"「This is no time for joking,」 protested one of the heralds. 「This is the only way to handle it, Mr. Hu. There's nothing else for it, so please don't make difficulties.」Butcher Hu had to give in. Two bowls of wine bolstered up his courage, making him lose his scruples and start his usual rampaging. Rolling up his greasy sleeves, he strode off toward the market, followed by small groups of neighbours."
老太太趕出來叫道：「親家，你這可嚇他一嚇，卻不要把他打傷了！」眾鄰居道：「這自然，何消吩咐！」說著，一直去了。,"Fan Jin's mother ran out and called after him, 「Just frighten him a little! Mind you don't hurt him!」「Of course,」 the neighbours reassured her. 「That goes without saying.」"
來到集上，見范進正在一個廟門口站著，散著頭髮，滿臉污泥，鞋都跑掉了一隻，兀自拍著掌，口裏叫道：「中了！中了！」胡屠戶凶神走到跟前，說道：「該死的畜生！你中了甚麼？」一個嘴巴打將去。眾人和鄰居見這模樣，忍不住的笑。不想胡屠戶雖然大著膽子打了一下，心裏到底還是怕的，那手早顫起來，不敢打到第二下。范進因這一個嘴巴，卻也打暈了，昏倒於地。,"When they reached the market, they found Fan Jin standing in the doorway of a temple. His hair was tousled, his face streaked with mud, and one of his shoes had come off. But he was still clapping his hands and crowing, 「Aha! I've passed! I've passed!」Butcher Hu bore down on him like an avenging fury, roaring, 「You blasted idiot! What have you passed?」 and fetched him a blow. The bystanders and neighbours could hardly suppress their laughter. But although Butcher Hu had screwed up his courage to strike once, he was still afraid at heart, and his hand was trembling too much to strike a second time. The one blow, however, had been enough to knock Fan Jin out."
眾鄰居一齊上前，替他抹胸口，捶背心，舞了半日，漸漸喘息過來，眼睛明亮，不瘋了。眾人扶起，借廟門口一個外科郎中「跳駝子」板凳上坐著，胡屠戶站在一邊，不覺那隻手隱隱的疼將起來；自己看時，把個巴掌仰著，再也灣不過來。自己心裏懊惱道：「果然天上『文曲星』是打不得的，而今菩薩計較起來了。」想一想，更疼得狠了，連忙問郎中討了個膏藥貼著。,"The neighbours pressed round to rub Fan Jin's chest and massage his back, until presently he gave a sigh and came to. His eyes were clear and his madness had passed! They helped him up and borrowed a bench from Apothecary Chen, a hunchback who lived hard by the temple, so that Fan Jin might sit down.Butcher Hu, who was standing a little way off, felt his hand begin to ache; when he raised his palm, he found to his dismay that he could not bend it. 「It's true, then, that you mustn't strike the stars in heaven,」 he thought. 「Now Buddha is punishing me!」 The more he thought about it, the worse his hand hurt, and he asked the apothecary to give him some ointment for it."
范進看了眾人，說道：「我怎麼坐在這裏？」又道：「我這半日，昏昏沉沉，如在夢裏一般。」眾鄰居道：「老爺，恭喜高中了！適纔歡喜的有些引動了痰，方纔吐出幾口痰來，好了。快請回家去打發報錄人。」范進說道：「是了。我也記得是中的第七名。」范進一面自綰了頭髮，一面問郎中借了一盆水洗洗臉。一個鄰居早把那一隻鞋尋了來，替他穿上。見丈人在跟前，恐怕又要來罵。胡屠戶上前道：「賢婿老爺，方纔不是我敢大膽，是你老太太的主意，央我來勸你的。」,"Meanwhile Fan Jin was looking round and asking, 「How do I come to be sitting here? My mind has been in a whirl, as if in a dream.」The neighbours said, 「Congratulations, sir, on having passed the examination! A short time ago, in your happiness, you brought up some phlegm; but just now you spat out several mouthfuls and recovered. Please go home quickly to send away the heralds.」「That's right,」 said Fan Jin. 「And I seem to remember coming seventh in the list.」 As he was speaking, he fastened up his hair and asked the apothecary for a basin of water to wash his face, while one of the neighbours found his shoe and helped him put it on.The sight of his father-in-law made Fan Jin afraid that he was in for another cursing. But Butcher Hu stepped forward and said, 「Worthy son-in-law, I would never have presumed to slap you just now if not for your mother. She sent me to help you.」"
鄰居內一個人道：「胡老爹方纔這個嘴巴打的親切，少頃范老爺洗臉，還要洗下半盆豬油來！」又一個道：「老爹，你這手明日殺不得豬了。」胡屠戶道：「我那裏還殺豬，有我這賢婿，還怕後半世靠不著他怎的？我每常說，我的這個賢婿，才學又高，品貌又好，就是城裏頭那張府、周府這些老爺，也沒有我女婿這樣一個體面的相貌！你們不知道，得罪你們說，我小老這一雙眼睛，卻是認得人的！想著先年，我小女在家裏長到三十多歲，多少有錢的富戶要和我結親，我自己覺得女兒像有些福氣的，畢竟要嫁與個老爺，今日果然不錯！」說罷，哈哈大笑。眾人都笑起來。,"「That was what I call a friendly slap,」 said one of the neighbours. 「Wait till Mr. Fan finishes washing his face. I bet he can easily wash off half a basin of lard!」「Mr. Hu!」 said another. 「This hand of yours will be too good to kill pigs any more.」「No indeed,」 replied the butcher. 「Why should I go on killing pigs? My worthy son-in-law will be able to support me in style for the rest of my life. I always said that this worthy son-in-law of mine was very learned and handsome, and that not one of those Chang and Zhou family officials in the city looked so much the fine gentleman. I have always been a good judge of character, I don't mind telling you. My daughter stayed at home till she was more than thirty, although many rich families wanted to marry her to their sons; but I saw signs of good fortune in her face, and knew that she would end up by marrying an official. You see today how right I was.」 He gave a great guffaw, and they all started to laugh."
看著范進洗了臉。郎中又拿茶來喫了，一同回家。范舉人先走，屠戶和鄰居跟在後面。屠戶見女婿衣裳後襟滾皺了許多，一路低著頭替他扯了幾十回。到了家門，屠戶高聲叫道：「老爺回府了！」老太太迎著出來，見兒子不瘋，喜從天降。眾人問報錄的，已是家裏把屠戶送來的幾千錢打發他們去了。范進拜了母親，復拜謝丈人。胡屠戶再三不安道：「些須幾個錢，不彀你賞人！」范進又謝了鄰居。正待坐下，早看見一個體面的管家，手裏拿著一個大紅全帖，飛跑了進來：「張老爺來拜新中的范老爺。」說畢，轎子已是到了門口。胡屠戶忙躲進女兒房裏，不敢出來，鄰居各自散了。,"When Fan Jin had washed and drunk the tea brought him by the apothecary, they all started back, Fan Jin in front, Butcher Hu and the neighbours behind. The butcher, noticing that the seat of his son-in-law's gown was crumpled, kept bending forward all the way home to tug out the creases for him.When they reached Fan Jin's house, Butcher Hu shouted: 「The master is back!」 The old lady came out to greet them, and was overjoyed to find her son no longer mad. The heralds, she told them, had already been sent off with the money that Butcher Hu had brought. Fan Jin bowed to his mother and thanked his father-in-law, making Butcher Hu so embarrassed that he muttered, 「That bit of money was nothing.」After thanking the neighbours too, Fan Jin was just going to sit down when a smart-looking retainer hurried in, holding a big red card, and announced, 「Mr. Zhang has come to pay his respects to the newly successful Mr. Fan.」 By this time the sedan-chair was already at the door. Butcher Hu dived into his daughter's room and dared not come out, while the neighbours scattered in all directions."
