Sanskrit,english
"AVŚ_16 pāñcavārṣikam* | (ed. Speyer, vol. I)

     buddho bhagavān satkṛto gurukṛto mānitaḥ pūjito rājabhī rājamātrair dhanibhiḥ pauraiḥ śreṣṭhibhiḥ sārthavāhair devair nāgair yakṣair asurair garuḍaiḥ kinnarair mahoragair iti devanāgayakṣāsuragaruḍakinnaramahoragābhyarcito buddho bhagavān jñāto mahāpuṇyo lābhī cīvarapiṇḍapātaśayanāsanaglānapratyayabhaiṣajyapariṣkārāṇāṃ saśrāvakasaṃgho rājagṛham upaniśritya viharati sma veṇuvane kalandakanivāpe | yadā devadattena mohapuruṣeṇa bhagavacchāsane 'narthasahasrāṇi kṛtāni, na ca śakitaṃ bhagavato romeñjanam api kartum*, tadā rājānam ajātaśatrum āmantritavān*: kriyatāṃ rājagṛhe kriyākāro na kenacic chramaṇasya gautamasyopasaṃkramitavyam*, piṇḍakena vā pratipādayitavyaḥ | evam ayam alabdhalābho 'labdhasaṃmāno niyatam anyadeśaṃ saṃkrāntiṃ kariṣyatīti | rajñā tathā kāritam* | tatra ye upāsakā dṛṣṭasatyās te rodituṃ pravṛttāḥ: hā kaṣṭam anāthībhūtaṃ rājagṛhanagaraṃ yatra hi nābhodumbarapuṣpadurlabhaprādurbhāvaṃ (Speyer: nāmodumbarapuṣpadurlabhaprādurbhāvaṃ) buddhaṃ bhagavantam āsādya tasya na śakyate saṃgrahaḥ kartum iti | eṣa śabdaḥ śrutiparaṃparayā bhikṣubhiḥ śrutaḥ | tata āyuṣmatānandena yathāśrutaṃ bhagavato niveditaḥ | bhagavān āha: alpotsukas tvam ānanda bhava, tathāgatā evātra kālajñāḥ | api tu yāvac chāsanaṃ me tāvac chrāvakāṇām upakaraṇavaikalyaṃ na bhaviṣyati prāg evedānīm iti ||
     atrāntare śakrasya devānām indrasyādhastāj jñānadarśanaṃ pravartate | sa paśyati bhagavacchāsanasyaivaṃvidhāṃ vikṛtim* | sahadarśanād eva dāyakadānapatīnāṃ utsāhasaṃjananārthaṃ buddhotpādasya māhātmyasaṃjananārtham ajātaśatror devadattasya ca madadarpacchittyartham ātmanaś ca prasādasaṃjananārthaṃ sakalaṃ rājagṛham udāreṇāvabhāsenāvabhāsyoccaiḥśabdham udāritavān: eṣo 'ham adyāgreṇa bhagavantaṃ saśrāvakasaṃghaṃ divyaiś cīvarapiṇḍapātaśayanāsanaglānapratyayabhaiṣajyapariṣkārair upasthāsyāmi | ity uktvā yena

-------------------- Vaidya, p. 41 --------------------

bhagavāṃs tenopasaṃkrāntaḥ | upasaṃkramya bhagavataḥ pādau śirasā vanditvaikānte sthitaḥ | atha śakro devendro bhagavantam idam avocat: adhivāsayatu me bhagavān asminn eva rājagṛhe nagare | ahaṃ bhagavantam upasthāsyāmi cīvarapiṇḍapātaśayanāsanaglānapratyayabhaiṣajyapariṣkārair iti | bhagavān āha: alaṃ kauśika kṛtam etad yāvad eva cittam abhiprasannam* | bahavo hi loke puṇyakāmā iti | śakraḥ prāha: adhivāsayatu me bhagavān pañca varṣāṇi | tathāgatasyārthe pañcavārṣikaṃ kariṣyāmīti | bhagavān āha: alaṃ kauśika kṛtam etad yāvac cittam abhiprasannam* | bahavo hi loke puṇyakāmā iti | śakraḥ prāha: adhivāsayatu me bhagavān pañca divasān iti | tato bhagavān svapuṇyabalapratyakṣīkaraṇārthaṃ śakrasya ca devendrasyānugrahārtham anāgatapañcavārṣikaprabandhahetoś cādhivāsitavāṃs tūṣṇībhāvena ||
     atha śakro devendro bhagavas tūṣṇībhāvenādhivāsanāṃ viditvā tad veṇuvanaṃ vaijayantaṃ prāsādaṃ pradarśitavān*, divyāni cāsanāni, divyāḥ puṣkaraṇīr divyaṃ ca bhojanam* | atha bhagavān prajñapta eva āsane niṣaṇṇaḥ | tataḥ śakro devendraḥ sukhopaniṣaṇṇaṃ buddhapramukhaṃ bhikṣusaṃghaṃ viditvā anekadevatāsahasraparivṛtaḥ svahastaṃ saṃtarpayati saṃpravārayati | anekaparyāyeṇa svahastaṃ saṃtarpya saṃpravārya bhagavantaṃ bhuktavantaṃ viditvā dhautahastam apanītapātraṃ nīcataram āsanaṃ gṛhītvā bhagavataḥ purastān niṣaṇṇo dharmaśravaṇāya | tato bhagavān śakraṃ devendraṃ saparivāraṃ dharmyayā kathayā saṃdarśayati samādāpayati samuttejayati saṃpraharṣayati | paśyati ca rājā ajātaśatrur upariprāsādatalagataḥ san bhagavato veṇuvane evaṃvidhāṃ pūjāṃ* | dṛṣṭvā ca punar vipratisārajāto mahāntaṃ prasādaṃ praveditavān* | rājagṛhanivāsinaś ca paurā dharmavegapṛaptā rājānam upasaṃkramyaivam ūcuḥ: muṣyante deva mahārāja rājagṛhanivāsinaḥ paurāḥ, yatra nāma devāḥ pramattāḥ santaḥ pramādavihāriṇo divyān viṣayān apahāya bhagavantaṃ pūjayanti | sādhu deva ughāṭyatāṃ kriyākāra iti ||
     tato rājñā ajātaśatruṇā kriyākāram udghāṭya rājagṛhe nagare ghaṇṭāvaghoṣaṇaṃ kāritam*: kriyatāṃ bhagavataḥ satkāro yathāsukham iti | tato rājagṛhanivāsinaḥ paurāḥ saparivārā hṛṣṭatuṣṭapramuditā udagraprītisaumanasyajātāḥ puṣpagandhamālyāny ādāya bhagavantaṃ darśanāyopasaṃkrāntāḥ | tato devair manuṣyaiś ca bhagavato mahān satkāraḥ kṛtaḥ, bhagavatā ca tad adhiṣṭhānaṃ devamanuṣyāṇāṃ tādṛśī caturāryasatyasaṃprativedhikī dharmadeśanā kṛtā, yāṃ śrutvā anekair devamanuṣyaiḥ satyadarśanaṃ kṛtam* ||
     bhikṣavo bhagavataḥ pūjāṃ dṛṣṭvā saṃśayajātā buddhaṃ bhagavantaṃ papracchuḥ: āścaryaṃ bhadanta yad bhagavataḥ śāsane evaṃvidha utsava iti | bhagavān āha: tathāgatenaivaitāni bhikṣavaḥ pūrvam anyāsu jātiṣu karmāṇi kṛtāny upacitāni labdhasaṃbhārāṇi pariṇatapratyayāni oghavat pratyupasthitāny avaśyaṃbhāvīni | mayaitāni karmāṇi kṛtāny upacitāni | ko 'nyaḥ pratyanubhaviṣyati? na bhikṣavaḥ karmāṇi kṛtāny upacitāni bāhye pṛthivīdhātau vipacyante, nābdhātau, na tejodhātau,

-------------------- Vaidya, p. 42 --------------------

na vāyudhātau, api tūpātteṣv eva skandhadhātvāyataneṣu karmāṇi kṛtāni vipacyante śubhāny aśubhāni ca;

     na praṇaśyanti karmāṇi kalpakoṭiśatair api | *{auch: karmāṇy api kalpaśatair api |}*
     sāmagrīṃ prāpya kālaṃ ca phalanti khalu dehinām* || AVŚ_16.1 ||

     bhūtapūrvaṃ bhikṣavo 'tīte 'dhvani ratnaśailo nāma samyaksaṃbuddho loka udapādi tathāgato 'rhan samyaksaṃbuddho vidyācaraṇasaṃpannaḥ sugato lokavid anuttaraḥ puruṣadamyasārathiḥ śāstā devamanuṣyāṇāṃ buddho bhagavān* | sa janapadacārikāṃ carann anyatamāṃ rājadhānīm anuprāptaḥ | tasyāṃ ca rājadhānyāṃ dharmabuddhir nāma rājā rājyaṃ kārayati tasyāṃ ca rājadhānyāṃ mahatī ītiḥ | tatas tena rājñā ītipraśamanahetor bhagavān śrāvakasaṃghatraimāsye bhaktenopanimantritaḥ |trāyāṇāṃ māsānām atyayena sā ītiḥ praśāntā | tato rājño nāgaraiś cāvarjitamānasais tathāgatasya saśrāvakasaṃghasya pañcavārṣikaṃ kṛtam* | āha ca:

     rājabhūtena ānanda ratnaśailo mahādyutiḥ |
     avīṣṭaḥ śāntikāmena akārṣīt pañcavārṣikam* || AVŚ_16.2 || iti ||

     kiṃ manyadhve bhikṣavo yo 'sau tena kālena tena samayena rājā babhūva, ahaṃ saḥ | yan mayā ratnaśailasya tathāgatasya pañcavārṣikaṃ kṛtam*, tena me saṃsāre mahatsukham anubhūtam* | taddhaitukaś cedānīṃ tathāgatasyaivaṃvidhaḥ satkāraḥ | parinirvṛtasya ca me śāsane anekāni pañcavārṣikaśatāni bhaviṣyati | tasmāt tarhi bhikṣava evaṃ śikṣitavyam: yac chāstāraṃ satkariṣyāmo gurukariṣyāmo mānayiṣyāmaḥ pūjayiṣyāmaḥ | śāstāraṃ satkṛtya gurukṛtya mānayitvā pūjayitvopaniśritya vihariṣyāmaḥ | ity evaṃ vo bhikṣavaḥ śikṣitavyam* ||
     idam avocad bhagavān | āttamanasas te ca bhikṣavo bhagavato bhāṣitam abhyanandan* ||","16. Five Yearly Festival
The Buddha, the Exalted One, honoured by gods, nāgas, yakṣas, gandharvas, asuras, garuḍas, kinnaras and mahoragas – that is to say honoured, praised, respected and worshipped by kings, regents, the wealthy, the city-dwellers, bankers, caravan leaders, gods, nāgas, yakṣas, asuras, garuḍas, kinnaras and mahoragas – and who was knowing and of great merit, with his community of disciples, provided with the requisite robes, almsbowls, beds, seats, and medicines for the sick, approached Rājagṛha and took residence in Kalandakanivāpa in the Veṇu Grove. When that deluded person Devadatta had done a thousand evils with regard to the Exalted One’s teaching, but was unable even to move a hair of the Exalted One, he addressed King Ajātaśatru: “One should make a resolution that nobody in Rājagṛha is to approach the śramaṇa Gautama, or give him alms. Then, getting no goods and no honour, surely he will move on to another country.” The king did this. Then those laypeople who had seen the truth began to lament: “Oh it is dreadful that the city of Rājagṛha has no protector! For it is not possible to approach the Exalted One, the Buddha whose appearance is as rare as the flower of the udumbara tree, and make provision for him.” Word of this passed on from person to person and was heard by the monks. Venerable Ānanda heard it and announced it to the Exalted One. The Exalted One said, “Be little anxious Ānanda. In this matter the Tathāgatas know the seasons. But as long as there is my teaching, as before and now, there will be no insufficiency in the service of the disciples.”
Now it happened that Śakra, the king of the gods, came to know about this matter, and saw the alteration with regard to the Exalted One’s religion. For the sake of strengthening the generous givers, highlighting the greatness of the arising of a Buddha, breaking the pride and arrogance of Ajātaśatru and Devadatta, and increasing his own faith, he manifested with splendour and nobility and made a loud announcement to the whole of Rājagṛha: “Today I will serve the Exalted One together with his community of disciples with divine requisite robes, almsbowls, beds, seats, and medicines for the sick.” Having announced this he approached the Exalted One. Having approached he honoured the Exalted One’s feet with his head and stood to one side. Then Śakra the king of the gods said this to the Exalted One: “May the Exalted One consent that in this city of Rājagṛha I will serve the Exalted One with divine requisite robes, almsbowls, beds, seats, and medicines for the sick.” The Exalted One said, “Enough, Kauśika. It is sufficient to make your mind fully faithful, for there are many in the world who desire merit.” Śakra said, “May the Exalted One consent to stay for five years. I will make the five year festival for the sake of the Tathāgata.” The Exalted One said, “Enough, Kauśika. It is sufficient to make your mind fully faithful, for there are many in the world who desire merit.” Śakra said, “May the Exalted One consent to five days.” Then the Exalted One, for the sake of displaying the strength of his own virtue, and in order to benefit Śakra the king of the gods, and to ensure the continuity of the future five year festival, consented through his silence.
Then Śakra the king of the gods, understanding that the Exalted One had consented through his silence, made that Veṇu Grove look like Vaijayanta Palace with divine seats, heavenly lotus pools and divine food. The Exalted One sat on the seat that had been prepared. Śakra the king of the gods, seeing that the Buddha first of all and also the community of monks were happily seated, served and waited on them with his own hands, surrounded by several thousand deities. Having served and waited on him in several ways with his own hands, understanding that the Exalted One had eaten, his hands washed and the bowl removed, he took a lower seat and sat before the Exalted One in order to hear the dharma. Then the Exalted One taught, inspired, incited and delighted Śakra the king of the gods and his retinue with a dharma discourse. And King Ajātaśatru, who had gone on the palace roof-terrace, saw this type of worship of the Exalted One in the Veṇu Grove, and having seen it he was remorseful and experienced great faith. The citizens who lived in Rājagṛha became agitated for the dharma and having approached the king they spoke thus: “Great king, your majesty, the citizens who live in Rājagṛha have been robbed, for the gods, despite being heedless and delighting in intoxication, have abandoned their divine realm and worship the Exalted One. It would be good, your majesty, to undo the resolution.”
Then King Ajātaśatru undid the resolution and proclaimed with a gong: “Honour should be paid to the Exalted One as desired.” The citizens who lived in Rājagṛha and their followers were thrilled, pleased and delighted, became intensely joyful and happy, and approached in order to see the Exalted One, bringing perfumes, garlands and flowers. Then the gods and humans paid great honour to the Exalted One, and the Exalted One gave a dharma talk of the kind that penetrates the four noble truths for the gods and humans standing there. Hearing this, many of the gods and men saw the truth.
Seeing the honour paid to the Exalted One, the monks became doubtful and asked the Exalted One, “It is a marvel, sir, that there be a festival of this kind in the Exalted One’s dispensation.” The Exalted One said, “O monks, actions that the Tathāgata performed and together and their conditions have matured. Being inevitable they have approached like a river. These actions have been done and accumulated by me. Who else will experience their results? O monks, deeds done do not mature in the earth element, nor in the water element, nor in the fire element, nor in the wind element. Rather, deeds done, whether pure or impure, ripen in what is enumerated as the aggregates, the physical elements and the elements of sense experience.”
“Actions do not disappear even after a hundred aeons.
When they have reached completion and it is time, they fruit for living beings.”
“Formerly, monks, in a past time, a fully and perfectly awakened one named Ratnaśaila arose in the world – a tathāgata, arhat, fully and perfectly awakened, perfect in wisdom and conduct, well-farer, unsurpassed knower of the world, trainer of those ready to be trained, teacher of gods and men, awakened and exalted. He wandered on a journey through the countryside and reached a certain royal city. In that royal city a king called Dharmaśuddhi ruled the kingdom. And in that royal city there was a great epidemic, so that king offered the Exalted One and his community of disciples food for three months, in order to cure the epidemic. With the passing of three months the epidemic was pacified, and so the king and the citizens, their minds converted, made the five year festival for the Tathāgata and his community of disciples.”
And he said:
“Ānanda, Ratnaśaila of great splendour, entreated by the king
who desired peace, carried out the five year festival.”
“What do you think, monks? He who at that time, on that occasion, was the
king, that was me. I carried out the five year festival for the Tathāgata Ratnaśaila, and because of that I experienced great happiness in saṃsāra, and for that reason now I am honoured in this manner as a Tathāgata. And when I am fully liberated there will be many hundreds of five year festivals in my dispensation. In this way, monks, one should train: ‘We will revere, pay respects to, honour and worship the teacher. And having revered, paid respects to, honoured and worshipped the teacher, we will live in reliance on him.’ In this way, monks, you should train.”
Thus spoke the Exalted One, and the monks were delighted and praised the Exalted One’s speech."
