Sanskrit,english
"AVŚ_11 nāvikāḥ | (ed. Speyer, vol. I)

     buddho bhagavān satkṛto gurukṛto mānitaḥ pūjito rājabhī rājamātrair dhanibhiḥ pauraiḥ śreṣṭhibhiḥ sārthavāhair devair nāgair yakṣair asurair garuḍaiḥ kinnarair mahoragair iti devanāgayakṣāsuragaruḍakinnaramahoragābhyarcito buddho bhagavān jñāto mahāpuṇyo lābhī cīvarapiṇḍapātaśayanāsanaglānapratyayabhaiṣajyapariṣkārāṇāṃ saśrāvakasaṃghaḥ śrāvastyāṃ viharati nadyā ajiravatyā adhastān nāvikagrāme | atha te nāvikā yena bhagavāṃs tenopasaṃkrāntāḥ | upasaṃkramya bhagavataḥ pādau śirasā vanditvaikānte nyaṣīdan* | ekāntaniṣaṇṇāṃs tān nāvikān bhagavān dharmyayā kathayā saṃdarśayati samādāpayati samuttejayati saṃpraharṣayati | anekaparyāyeṇa dharmyayā kathayā saṃdarśya samādāpya samuttejya saṃpraharṣya tūṣṇīm* | atha te nāvikā utthāyāsanād ekāṃsam uttarāsaṅgaṃ kṛtvā yena bhagavāṃs tenāñjaliṃ praṇamya bhagavantam ūcuḥ: adhivāsayatu bhagavān asmākaṃ nadyā ajiravatyās tīre śvo bhaktena sārdhaṃ bhikṣusaṃghena | nausaṃkrameṇottārayiṣyāma iti | adhivāsayati bhagavān nāvikānāṃ tūṣṇībhāvena ||
     atha nāvikā nadyā ajiravatyās tīram apagatapāṣāṇaśarkarakaṭhallaṃ vyavasthāpayāmāsur ucchritacchatradhvajapatākaṃ nānāpuṣpāvakīrṇaṃ gandhaghaṭikāvadhūpitam* | praṇītam āhāraṃ kṛtavantaḥ | prabhūtaṃ ca puṣpasaṃgrahaṃ kṛtvā nausaṃkramaṃ puṣpamaṇḍapair alaṃkārayāmāsuḥ | bhagavataś ca dūtena kālam ārocayāmāsuḥ: samayo bhadanta sajjaṃ bhaktam*, yasyedānīṃ bhagavān kālaṃ manyata iti | atha bhagavān bhikṣugaṇaparivṛto bhikṣusaṃghapuraskṛto yena nāvikagrāmakas tenopasaṃkrāntaḥ | upasaṃkramya purastād bhikṣusaṃghasya prajñapta evāsane nyaṣīdat* | atha te nāvikāḥ sukhopaniṣaṇṇaṃ buddhapramukhaṃ bhikṣusaṃghaṃ viditvā śucinā praṇītena khādanīyena bhojanīyena svahastaṃ saṃtarpayati saṃpravārayati | anekaparyāyeṇa śucinā praṇītena khādanīyena bhojanīyena svahastaṃ saṃtarpya saṃpravārya bhagavantaṃ bhuktavantaṃ viditvā dhautahastam apanītapātraṃ nīcatarāṇy āsanāni gṛhītvā bhagavataḥ purastān niṣaṇṇā dharmaśravaṇāya | atha bhagavāṃs teṣāṃ nāvikānām āśayānuśayaṃ dhātuṃ prakṛtiṃ ca jñātvā tādṛśīṃ caturāryasatyasaṃprativedhikīṃ dharmadeśanāṃ kṛtavān, yāṃ śrutvā anekair nāvikaiḥ srotaāpattiphalāni prāptāni, kaiścit sakṛdāgāmiphalāni kaiścid anāgāmiphalāni, kaiścit pravrajya sarvakleśaprahāṇād arhatvaṃ sākṣātkṛtam*, kaiścic chrāvakabodhau cittāny utpāditāni, kaiścit pratyekabodhau, kaiścid anuttarāyāṃ samyaksaṃbodhau | sarvā ca sā parṣad buddhanimnā dharmapravaṇā saṃghaprāgbhārā vyavasthitā | tatas tair nāvikair bhagavān mahatā satkāreṇa nausaṃkrameṇottāritaḥ sārdhaṃ bhikṣusaṃghena ||

-------------------- Vaidya, p. 31 --------------------


     bhikṣavo buddhapūjādarśanād āvarjitamanaso buddhaṃ bhagavantaṃ papracchuḥ: kutremāni bhagavataḥ kuśalamūlāni kṛtānīti | bhagavān āha: tathāgatenaiva bhikṣavaḥ pūrvam anyāsu jātiṣu karmāṇi kṛtāny upacitāni labdhasaṃbhārāṇi pariṇatapratyayāni oghavat pratyupasthitāny avaśyaṃbhāvīni, yena tathāgatasyaivaṃvidhā pūjā | icchatha bhikṣavaḥ śrotum? evaṃ bhadanta | tena hi bhikṣavaḥ śṛṇuta, sādhu ca suṣṭhu ca manasi kuruta, bhāṣiṣye ||
     bhūtapūrvaṃ bhikṣavo 'tīte 'dhvani bhāgīratho nāma samyaksaṃbuddho loka udapādi tathāgato 'rhan samyaksaṃbuddho vidyācaraṇasaṃpannaḥ sugato lokavid anuttaraḥ puruṣadamyasārathiḥ śāstā devamanuṣyāṇāṃ buddho bhagavān* | sa dvāṣaṣṭyarhatsahasraparivṛto janapadacārikāṃ caran gaṅgātīram anuprāptaḥ | tasmin samaye 'nyataraḥ sārthavāho 'nekaśataparivāro nadyāṃ gaṅgāyāṃ sārtham uttārayati | tasmiṃś ca pradeśe mahattaskarabhayam* | atha dadarśa sārthavāho bhāgīrathaṃ samyaksaṃbuddhaṃ dvāṣaṣṭyarhatsahasraparivṛtam* | dṛṣṭvā ca punaḥ cittaṃ prasādayāmāsa | prasannacittaś ca bhagavantam āmantritavān: tatprathamataram eva bhagavantaṃ tārayiṣyāmīti | adhivāsayati bhāgīrathaḥ samyaksaṃbuddhaḥ sārthavāhasya tūṣṇībhāvena | tatas tena sārthavāhena bhāgīrathaḥ samyaksaṃbuddhaḥ dvāṣaṣṭyarhatsahasraparivṛto mahatyā vibhūtyā nausaṃkrameṇottāritaḥ | praṇītena cāhāreṇa saṃtarpyānuttarāyāṃ samyaksaṃbodhau praṇidhānaṃ kṛtam* ||
     bhagavān āha: kiṃ manyadhve bhikṣavo yo 'sau tena kālena tena samayena sārthavāho babhūva, ahaṃ saḥ | mayā sa bhāgīrathaḥ, samyaksaṃbuddho dvāṣaṣṭyarhatsahasraparivṛto nausaṃkrameṇottāritaḥ, praṇītenāhāreṇa saṃtarpitaḥ, praṇidhānaṃ ca kṛtam* | tasya me karmaṇo vipākenānantasaṃsāre mahatsukham anubhūtam* | idānīm apy anuttarāṃ samyaksaṃbodhim abhisaṃbuddhasyaivavidhā pūjā | tasmāt tarhi bhikṣava evaṃ śikṣitavyam: yac chāstāraṃ satkariṣyāmo gurukariṣyāmo mānayiṣyāmaḥ pūjayiṣyāmaḥ | śāstāraṃ satkṛtya gurukṛtya mānayitvā pūjayitvopaniśritya vihariṣyāmaḥ | ity evaṃ vo bhikṣavaḥ śikṣitavyam* ||
     idam avocad bhagavān | āttamanasas te bhikṣavo bhagavato bhāṣitam abhyanandan* ||","11. The Sailors
The Buddha, the Exalted One, honoured by gods, nāgas, yakṣas, asuras, garuḍas, kinnaras and mahoragas – that is to say honoured, praised, respected and worshipped by kings, regents, the wealthy, the city-dwellers, bankers, caravan leaders, gods, nāgas, yakṣas, asuras, garuḍas, kinnaras and mahoragas – and who was knowing and of great merit, dwelled in Śrāvastī with his community of disciples, provided with the requisite robes, almsbowls, beds, seats, and medicines for the sick, below a village of sailors on the river Ajiravatī. Those sailors approached the Exalted One, and having approached they honoured the Exalted One’s feet with their heads and sat to one side. The Exalted One taught, inspired, incited and delighted those sailors seated to one side with discourses on the dharma. Having taught, inspired, incited and delighted them with many kinds of dharma discourse he was silent. Then those sailors rose from their seats, placed their outer garments on one shoulder, saluted the Exalted One and said to him, “Let the Exalted One, along with his community of monks, consent to take tomorrow’s meal with us on the banks of the river Ajiravatī. We will transport you across by boat.” The Exalted One consented to the sailors through his silence.
Then the sailors prepared the bank of the river Ajiravatī by removing all the stones, pebbles and gravel. They raised up parasols, flags and banners, and scattered various flowers there, and perfumed it with incense sticks. They had excellent food prepared, and made lots of bouquets of flowers, and decorated the boat that was going with flower-pavilions. A messenger announced to the Exalted One that it was time: “It is the moment, sir. The food is prepared, so the Exalted One should know that it is time.” The Exalted One, surrounded by a group of monks and attended by the monastic community, approached the village of the sailors. Having approached, he sat on a seat that had been prepared, in front of the community of monks. When the sailors saw that the community of monks with the Buddha at their head were happily seated nearby, they served them with their own hands, entertaining them with pure and excellent hard and soft foods. Having served them with their own hands and entertained them in various ways with pure and excellent hard and soft foods, when they saw that the Exalted One had eaten, his hands were washed and the bowl removed, they took lower seats and sat in front of the Exalted One in order to hear the dharma. And the Exalted One, understanding the dispositions, propensities, character and nature of those sailors, furnished them with a dharma teaching of such a kind that penetrated the four noble truths. Having heard this some sailors attained the fruit of stream- entry, others the fruit of once-returning, others the fruit of non-returning, some renounced and by abandoning all defilements realised arhatship, others produced a resolve to attain śrāvaka-bodhi, others a resolve to pratyeka-bodhi and yet others a resolve to full and perfect buddhahood. And the whole assembly was established in commitment to the Buddha, inclination towards the dharma, and devotion to the saṅgha. And then with great reverence the sailors transported the Exalted One across by boat, along with his community of monks.
The monks, their minds overcome by seeing the honour paid to the Buddha, asked the Exalted Buddha, “Where were these skillful roots planted by the Exalted One?” The Exalted One said, “O monks, actions that the Tathāgata performed and accumulated in other previous births have come together and their conditions have matured. Being inevitable19 they have approached like a river. That is why the Tathāgata is honoured in this way. Would you like to hear about it, monks?” “Indeed, sir.” “Then listen, monks, concentrate the mind on the good and the right, and I will speak.”
“Formerly, monks, in a past time, a fully and perfectly awakened one called Bhāgīratha arose in the world – a tathāgata, arhat, fully and perfectly awakened, perfect in wisdom and conduct, well-farer (sugata), unsurpassed knower of the world, trainer of those ready to be trained, teacher of gods and men, awakened and exalted. Surrounded by 62 thousand arhats he wandered on a journey through the countryside, and reached the shore of the Ganges. At that time a caravan leader with a retinue of several hundred was transporting his goods across the river Ganges, and in that place there was a great danger from thieves. The caravan leader saw the perfect Buddha Bhāgīratha with his assembly of 62 thousand arhats, and having seen him his mind became full of faith. With mind full of faith he addressed the Exalted One: ‘I will carry the Exalted One across first of all.’ The perfect Buddha Bhāgīratha consented to the caravan leader through his silence, and then the caravan leader conveyed the perfect Buddha Bhāgīratha and his assembly of 62 thousand arhats across by boat, with great might. And having refreshed them with excellent food, he made an aspiration to attain unsurpassed and perfect full buddhahood.”
The Exalted One said, “What do you think, monks? The person who was the caravan leader at that time, on that occasion, that was me. I transported the perfect Buddha Bhāgīratha across by boat, in addition to his retinue of 62 thousand arhats, refreshed them with excellent food, and made the vow. Because of the ripening of that action of mine I have experienced great happiness in boundless saṃsāra, and now I have attained unsurpassed perfect and full awakening and receive great honour of this kind. In this way, monks, one should train: ‘We will revere, pay respects to, honour and worship the teacher. And having revered, paid respects to, honoured and worshipped the teacher, we will live in reliance on him.’ In this way, monks, you should train.”
Thus spoke the Exalted One, and the monks were delighted and praised the Exalted One’s speech."
"AVŚ_12 stambhaḥ | (ed. Speyer, vol. I)

     buddho bhagavān satkṛto gurukṛto mānitaḥ pūjito rājabhī rājamātrair dhanibhiḥ pauraiḥ śreṣṭhibhiḥ sārthavāhair devair nāgair yakṣair asurair garuḍaiḥ kinnarair mahoragair iti devanāgayakṣāsuragaruḍakinnaramahoragābhyarcito buddho bhagavān jñāto mahāpuṇyo lābhī cīvarapiṇḍapātaśayanāsanaglānapratyayabhaiṣajyapariṣkārāṇāṃ saśrāvakasaṃghaḥ kauravyeṣu janapadacārikāṃ caran kauravyaṃ nagaram anuprāptaḥ | sa ca kauravyo janakāyo buddhavaineya udāracitaḥ pradānaruciś ca | tato bhagavata etad abhavat*: yanv ahaṃ śakraṃ devendraṃ marudgaṇaparivṛtam āhveyeyam, yaddarśanād eṣāṃ kuśalamūlavivṛddhiḥ

-------------------- Vaidya, p. 32 --------------------

syād iti | tato bhagavāṃl laukikaṃ cittam utpādayati: aho bata śakro devendro marudgaṇasahāyo gośīrṣacandanamayaṃ stambham ādāya gacched iti || sahacittotpādāc chakro devendro marudgaṇaparivṛto āgato yatra viśvakarmā catvāraś ca mahārājā anekadevanāgayakṣakumbhāṇḍaparivṛto gośīrṣacandanastambham ādāya | hāhākārakilakilāprakṣveḍoccair nādaṃ kurvāṇā bhagavato 'rthe gośīrṣacandanamayaṃ prāsādam abhisaṃskṛtavantaḥ | tatas tasmin prāsāde śakreṇa devendreṇa bhagavān saśrāvakasaṃgho divyenāhāreṇa divyena śayanāsanena divyair gandhamālyapuṣpaiḥ satkṛto gurukṛto mānitaḥ pūjitaḥ ||
     atha kauravyo janakāyas tāṃ divyāṃ vibhūṣikāṃ dṛṣṭvā paraṃ vismayam āpanna imāṃ cintām āpede: nūnaṃ buddho bhagavāṃl loke 'gryaḥ | yat tu nāma sendrair devaiḥ pūjyata iti āvarjitamanā bhagavantam upasaṃkrāntaḥ | bhagavataḥ pādābhivandanaṃ kṛtvaikānte nyaṣīdat* | ekāntaniṣaṇṇaḥ kauravyo janakāyas tasmin prāsāde 'tyarthaṃ prasādam utpādayati ||
     tena bhagavāṃs tat prāsādam antardhāpya anityatāpratisaṃyuktāṃ tādṛśīṃ dharmadeśanāṃ kṛtavān*, yāṃ śrutvā anekaiḥ kauravyanivāsibhir manuṣyaiḥ srotaāpattiphalāny anuprāptāni, kaiścit sakṛdāgāmiphalāni kaiścid anāgāmiphalāni, kaiścit pravrajya sarvakleśaprahāṇād arhatvaṃ sākṣātkṛtam*, kaiścic chrāvakabodhau cittāny utpāditāni, kaiścit pratyekāyāṃ bodhau, kaiścid anuttarāyāṃ samyaksaṃbodhau | sarvā ca sā parṣad buddhanimnā dharmapravaṇā saṃghaprāgbhārā vyavasthitā |
     tatas te bhikṣavo bhagavato divyapūjādarśanād āvarjitamanaso buddhaṃ bhagavantaṃ papracchuḥ: kutremāni bhagavatā kuśalamūlāni kṛtānīti | bhagavān āha: tathāgatenaiva bhikṣavaḥ pūrvam anyāsu jātiṣu karmāṇi kṛtāny upacitāni labdhasaṃbhārāṇi pariṇatapratyayāni oghavat pratyupasthitāny avaśyaṃbhāvīni, yena tathāgatasyaivaṃvidhā pūjā | icchatha bhikṣavaḥ śrotum? evaṃ bhadanta | tena hi bhikṣavaḥ śṛṇuta, sādhu ca suṣṭhu ca manasi kuruta, bhāṣiṣye ||
     bhūtapūrvaṃ bhikṣavo 'tīte 'dhvani brahmā nāma samyaksaṃbuddho loka udapādi tathāgato 'rhan samyaksaṃbuddho vidyācaraṇasaṃpannaḥ sugato lokavid anuttaraḥ puruṣadamyasārathiḥ śāstā devamanuṣyāṇāṃ buddho bhagavān* | atha brahmā samyaksaṃbuddho dvāṣaṣṭyarhatsahasraparivṛto janapadacārikāṃ carann anyatamāṃ rājadhānīm anuprāptaḥ | aśrauṣīd rājā kṣatriyo mūrdhābhiṣiktaḥ: brahmā samyaksaṃbuddho dvāṣaṣṭyarhatsahasraparivṛto janapadacārikāṃ carann asmākaṃ vijitam anuprāpta iti | śrutvā ca punar mahatyā rājarddhyā mahatā rājānubhāvena yena bhagavān brahmā samyaksaṃbuddhas tenopasaṃkrāntaḥ | upasaṃkramya brahmaṇaḥ samyaksaṃbuddhasya pādau śirasā vanditvaikānte nyaṣīdat* | ekāntaniṣaṇṇaṃ rājānaṃ kṣatriyaṃ mūrdhābhiṣiktaṃ bhagavān bodhikarakair dharmaiḥ samādāpayati | atha sa labdhaprasāda utthāyāsanād ekāṃsam uttarāsaṅgaṃ kṛtvā yena bhagavāṃs tenāñjaliṃ praṇamya bhagavantam idam avocat*: adhivāsayatu

-------------------- Vaidya, p. 33 --------------------
me bhagavān asyāṃ rājadhānyāṃ traimāsyavāsāya | ahaṃ bhagavantaṃ saśrāvakasaṃgham upasthāsyāmi cīvarapiṇḍapātaśayanāsanaglānapratyayabhaiṣajyapariṣkārair iti | adhivāsayati brahmā samyaksaṃbuddho rājñas tūṣṇībhāvena | atha sa rājā mūrdhābhiṣikto bhagavato 'rthe gośīrṣacandanamayaṃ prāsādaṃ kārayāmāsa | sa taṃ vicitrair vastrālaṃkārair alaṃkṛtaṃ nānāpuṣpāvakīrṇaṃ gandhaghaṭikādhūpitaṃ bhagavataḥ saśrāvakasaṃghasya niryātya traimāsyaṃ praṇītenāhāreṇa saṃtarpya vividhair vastraviśeṣair ācchādyānuttarāyāṃ samyaksaṃbodhau praṇidhiṃ cakāra ||
     bhagavān āha: kiṃ manyadhve bhikṣavo yo 'sau tena kālena tena samayena rājā kṣatriyo mūrdhābhiṣikto babhūva, ahaṃ saḥ | yan mayā brahmaṇaḥ samyaksaṃbuddhasyaivaṃvidhā pūjā kṛtā, tasya me karmaṇo vipākenānantasaṃsāre mahatsukham anubhūtam* | idānīm apy anuttarāṃ samyaksaṃbodhim abhisaṃbuddhasyaivavidhā pūjā | tasmāt tarhi bhikṣava evaṃ śikṣitavyam: yac chāstāraṃ satkariṣyāmo gurukariṣyāmo mānayiṣyāmaḥ pūjayiṣyāmaḥ | śāstāraṃ satkṛtya gurukṛtya mānayitvā pūjayitvopaniśritya vihariṣyāmaḥ | ity evaṃ vo bhikṣavaḥ śikṣitavyam* ||
     idam avocad bhagavān | āttamanasas te bhikṣavo bhagavato bhāṣitam abhyanandan* ||","12. The Post
The Buddha, the Exalted One, honoured by gods, nāgas, yakṣas, asuras, garuḍas, kinnaras and mahoragas – that is to say honoured, praised, respected and worshipped by kings, regents, the wealthy, the city-dwellers, bankers, caravan leaders, gods, nāgas, yakṣas, asuras, garuḍas, kinnaras and mahoragas – and who was knowing and of great merit, with his community of disciples, provided with the requisite robes, almsbowls, beds, seats, and medicines for the sick, wandered on a journey through the countryside amongst the Kauravyas and arrived at the city of Kauravya. But the multitude of Kauravya people needed converting by the Exalted One: “If I were to summon Śakra, king of the gods, surrounded by his retinue of maruts, as a result of seeing him they would increase their skillful roots.” So the Exalted One had a worldly thought: “Well now! If only Śakra the king of the gods, together with his retinue of maruts, would come bringing a post of gośīrṣa sandalwood!” With the arising of this thought Śakra the king of gods, surrounded by his retinue of maruts, came there, as did Viśvakarman and the great kings of the four directions, surrounded by many gods, nāgas, yakṣas and kumbhāṇdas, bringing a post of gośīrṣa sandalwood. They cried out loudly – “Ha! Ha! Kila! Kila!” – and according to the Exalted One’s intention they constructed a palace made of gośīrṣa sandalwood. Then in that palace Śakra the king of the gods honoured, praised, respected and worshipped the Exalted One, along with his community of disciples, with divine food, divine beds and seats, and celestial perfumes, garlands and flowers.
The multitude of Kauravya people saw that divine magnificence and then they were amazed and had this thought: “Surely the Exalted Buddha is supreme in the world, for he is honoured by gods with their kings!” Their minds were overcome and they turned to the Exalted One. Having honoured the Exalted One’s feet they sat to one side. Seated to one side in that palace, the group of Kauravya people became extremely faithful.
Then the Exalted One made that palace disappear and taught a dharma teaching about such things as attachment to transient objects, hearing which many people who were Kauravya inhabitants attained the fruit of stream entry. Others attained the fruit of once-returning, some the fruit of non-returning, and some renounced and by abandoning all defilements realised arhatship. Others produced a resolve to attain śrāvaka-bodhi, others a resolve to pratyeka-bodhi and yet others a resolve to full and perfect buddhahood. And the whole assembly was established in commitment to the Buddha, inclination towards the dharma, and devotion to the saṅgha.
The monks, their minds overcome by seeing the divine honour paid to the Exalted One, asked the Exalted Buddha, “Where were these skillful roots planted by the Exalted One?” The Exalted One said, “O monks, actions that the Tathāgata performed and accumulated in other previous births have come together and their conditions have matured. Being inevitable they have approached like a river. That is why the Tathāgata is honoured in this way. Would you like to hear about it, monks?” “Indeed, sir.” “Then listen, monks, concentrate the mind on the good and the right, and I will speak.”
“Formerly, monks, in a past time, a fully and perfectly awakened one called Brahmā arose in the world – a tathāgata, arhat, fully and perfectly awakened, perfect in wisdom and conduct, well-farer, unsurpassed knower of the world, trainer of those ready to be trained, teacher of gods and men, awakened and exalted. Surrounded by 62 thousand arhats the perfect Buddha Brahmā wandered on a journey through the countryside, and reached a certain royal city. The consecrated warrior king heard, ‘The perfect Buddha Brahmā along with his retinue of 62 thousand arhats, wandering on a journey through the countryside, has arrived in our realm.’ Hearing this, with great royal power and great regal pomp, he went to the place where the exalted and perfect Buddha Brahmā was. Having arrived he honoured the perfect Buddha Brahmā’s feet with his head and sat to one side. The Exalted One inspired that consecrated warrior king who was seated to one side with the dharmas that bring about awakening. That king became faithful, and getting up from his seat he put his upper robe over one shoulder, saluted the Exalted One and said to the Exalted One, ‘May the Exalted One consent to live in this royal residence for the three-month rainy season. I will attend upon the Exalted One and his community of disciples with the requisite robes, almsbowls, beds, seats, and medicines for the sick.’ The perfect Buddha Brahmā consented to the king through his silence. Then that consecrated king, according to the Exalted One’s intention, had a palace constructed out of gośīrṣa sandalwood. He presented this, decorated with a myriad of cloths and ornaments, covered with various flowers and perfumed with incense sticks, to the Exalted One along with his community of disciples. For three months he entertained them with excellent food and clothed them with diverse kinds of cloths, and then made an aspiration to full and perfect buddhahood.”
The Exalted One said, “What do you think, monks? The person who was the consecrated warrior king at that time, on that occasion, that was me. I honoured the perfect Buddha Brahmā, and because of the ripening of that action of mine I have experienced great happiness in boundless saṃsāra, and now I have attained unsurpassed perfect and full awakening and receive great honour of this kind. In this way, monks, one should train: ‘We will revere, pay respects to, honour and worship the teacher. And having revered, paid respects to, honoured and worshipped the teacher, we will live in reliance on him.’ In this way, monks, you should train.”
Thus spoke the Exalted One, and the monks were delighted and praised the Exalted One’s speech."
