chinese,english
方操送宮下樓時，布告玄德曰：「公為坐上客，布為階下囚，何不發一言而相寬乎？」玄德點頭。及操上樓來，布叫曰：「明公所患，不過於布。布今已服矣。公為大將，布副之，天下不難定也。」操回顧玄德曰：「何如？」玄德答曰：「公不見丁建陽、董卓之事乎？」布目視玄德曰：「是兒最無信者！」操令牽下樓縊之。布回顧玄德曰：「大耳兒！不記轅門射戟時耶？」忽一人大叫曰：「呂布匹夫！死則死耳，何懼之有！」眾視之，乃刀斧手擁張遼至。操令將呂布縊死，然後梟首。後人有詩歎曰：,"While Cao Cao sadly escorted Chen Gong on the way to death, Lu Bu appealed to Liu Bei, ""Noble Sir, you sit there an honored guest while poor I lie bound at your feet. Will you not utter one word to alleviate my lot?""Liu Bei nodded.As Cao Cao returned to his place, Lu Bu called out, ""Your only trouble, Illustrious Sir, is myself, and I am on your side now. You take the lead, I will help you, and together the world is at our feet.""""What do you think?"" said Cao Cao turning to Liu Bei.""You are willing to forget the episodes of Ding Yuan and Dong Zhuo?""""Truly the lout is not to be trusted!"" said Lu Bu, looking at Liu Bei.""Strangle and expose!"" ordered Cao Cao.As he was led away, Lu Bu turned once more to Liu Bei, ""You long-eared lout, you forget now the service I rendered you that day at my camp gate, when my arrow hit the mark!""Just then someone shouted, ""Lu Bu, O fool! Death is but death, and why are you scared at it?""Everyone turned to look: The guards were hustling Zhang Liao to the place of judgment. Cao Cao ordered Lu Bu's execution.A poet has written upon the death of Lu Bu:"
洪水滔滔淹下邳，當年呂布受擒時：空如赤免馬千里，漫有方天戟一枝。,"The flood spreads wide, the city drowns,Its lord is captive. Nought availsHis courser's speed or halberd's thrust."
縛虎望寬今太懦，養鷹休飽昔無疑。戀妻不納陳宮諫，枉罵無恩大耳兒。,"The tiger erstwhile fierce, now whinesFor mercy. Cao Cao had meted himFull well, a falcon flown at willAnd hungry kept. Poor fool! He letChen Gong's advice be overborneBy harem tattle; vainly nowHe rails against the Long-Ears' faith."
又有詩論玄德曰：傷人餓虎縛休寬，董卓，丁原血未乾。玄德既知能啖父，爭如留取害曹瞞？,"And another poem says:Round is the hungry tiger, eater of men, for whom is no pity,Since the blood of his victims is fresh and not yet dry.Liu Bei spoke no word in favor of Lu Bu,To whom even a father's life was not sacred."
卻說武士擁張遼至。操指遼曰：「這人好生面善。」遼曰：「濮陽城中曾相遇，如何忘卻？」操笑曰：「你原來也記得！」遼曰：「只是可惜！」操曰：「可惜甚的？」遼曰：「可惜當日火不大，不曾燒死你這國賊！」操大怒曰：「敗將安敢辱吾！」拔劍在手，親自來殺張遼。遼全無懼色，引頸待殺。曹操背後一人攀住臂膊，一人詭於面前，說道：「丞相且莫動手！」,"It was recorded earlier that the executioners were hustling Zhang Liao forward.Pointing to him from above, Cao Cao said, ""He has a familiar face.""""You were not likely to forget me: You saw me before in Puyang,"" said Zhang Liao.""O, so you remember me, eh?""""Yes. More is the pity.""""Pity for what?""""That the fire that day was not fierce enough to burn you up, rebel that you are!""Cao Cao began to get angry.""How dare you insult me?"" cried he and lifted his sword to kill the bold speaker.The undaunted Zhang Liao never changed color, but stretched out his neck for the blow. Then a man behind Cao Cao caught his arm, and in front of him another dropped on his knees, saying, ""O Prime Minister, I pray thee stay thy hand!"""
正是：乞哀呂布無人救，罵賊張遼反得生。畢竟救張遼的是誰，且看下文分解。,"Lu Bu whining was not spared,Railing Zhang Liao far better fared.Who was it that saved Zhang Liao? The next chapter will show."
