chinese,english
布聞言愁悶不決，入告貂蟬。貂蟬曰：「將軍與妾作主，勿輕騎自出。」布曰：「汝無憂慮。吾有畫戟，赤兔馬，誰敢近我？」乃出謂陳宮曰：「操軍糧至者，詐也。操多詭計，吾未敢動。」宮出歎曰：「吾等死無葬身之地矣！」,"Lu Bu very sadly went to take leave of Diao Chan who said, ""You are my lord and my life. You must not be careless and ride out alone.""""You need not fear. With my mighty trident halberd and Red Hare, who dare come near me?""He went out. But when he met Chen Gong, he said, ""That story about supplies for Cao Cao is all false, one of his many ruses. I am not going to stir.""Chen Gong sighed. He felt all was lost.""We shall die, and no one shall know our burial place,"" said he."
布於是終日不出，只同嚴氏，貂蟬飲酒解悶。謀士許汜，王楷入見布，進計曰：「今袁術在淮南，聲勢大振。將軍舊曾與彼約婚，今何不仍求之？彼兵若至，內外夾攻，操不難破也。」布從其計，即日修書，就著二人前去。許汜曰：「須得一軍引路衝出方好。」布令張遼，郝萌兩個引兵一千，送出隘口。,"Thereupon Lu Bu remained in his own quarters with his ladies, drinking freely to dissipate his sorrows.Two of his advisers, Xu Si and Wang Kai, went in and proposed, ""Yuan Shu in the South of River Huai is very powerful. Why not write to him to renew the marriage alliance? Yuan Shu can hardly refuse to rescue the affianced bride of his son.""So Lu Bu wrote and bade these two take the letter.Xu Si said, ""You ought to send a strong escort with us to force a way through.""So Lu Bu told off one thousand troops and two of his generals, Zhang Liao and He Meng, to conduct his messenger beyond the pass."
是夜二更，張遼在前，郝萌在後，保著許汜，王楷殺出城去。抹過玄德寨，眾將追趕不及，已出隘口。郝萌將五百人，跟許汜，王楷而去。張遼引一半軍回來，到隘口時，雲長攔住。未及交鋒，高順引兵出城救應，接入城中去了。,"They started that same night at the second watch, Zhang Liao leading and He Meng bringing up the rear. They got out of the city, crept past Liu Bei's camp, and got beyond the danger zone. Then half the escort went on, and Zhang Liao led the remainder back toward the city. At the pass he found Guan Yu waiting. However, at that moment Gao Shun came to his help, and they all returned and reentered the gates."
且說許汜，王楷至壽春，拜見袁術，呈上書信。術曰：「前者殺吾使命，賴我奼姻，今又來相問，何也？」汜曰：「此為曲奸計所誤：願明公詳之。」術曰：「汝主不因曹兵困急，豈肯以女許我？」楷曰：「明公今不相救，恐脣亡齒寒，亦非明公之福也。」術曰：「奉先反覆無信，可先送女，然後發兵。」許汜，王楷只得拜辭，和郝萌回來。到亡德寨邊，汜曰：「日間不可過。夜半吾二人先行，郝將軍斷後。」,"The two messengers presently reached Shouchun, saw Yuan Shu, and presented the letter.""How is this?"" said Yuan Shu. ""Formerly he slew my messenger and repudiated the marriage. Now he sends to ask for it.""""It is all due to the vile plans of that monster Cao Cao. If pray you, Illustrious Sir, consider it carefully,"" replied Xu Si.""But if your master was not hemmed in by his enemy and in imminent danger, he would never have thought of renewing this proposal of marriage.""The messengers said, ""You may decide not to help him, but the teeth are cold when the lips are gone. It will not make for your happiness and comfort.""Said Yuan Shu, ""Lu Bu is unreliable. Tell him that I will send soldiers after the girl has arrived here.""This was final, and the two messengers took leave and headed back to Xiapi.When the party reached Liu Bei's camp, Xu Si decided, ""We must wait the night falls, and Wang Kai and I will try to get through in the darkness. The escort of He Meng remaining behind to protect our rear."""
商量停當。夜過玄德寨，許汜，王楷先過去了。郝萌正行之次，張飛出寨攔路。郝萌交馬只一合，被張飛生擒過去，五百人馬盡被殺散。張飛解郝萌來見玄德，玄德押往大寨見曹操。郝萌備說求救許婚一事。操大怒，斬郝萌於軍門，使人傳諭各寨，小心防守，如有走透呂布及彼軍士者，依軍法處治。各寨悚然。,"They tried that very night, and the two messengers crept across without discovery. But the escort found themselves faced by Zhang Fei. He Meng tried to fight but was captured in the very first bout, and the five hundred troops of his half company were either killed or they fled.The prisoner was taken to Liu Bei, who forwarded him to the main camp. There he told the story of the marriage and the scheme to save the city. Cao Cao was angry and ordered the execution of He Meng at the main gate.Then Cao Cao sent orders to each camp to exercise the greatest diligence with threats of rigorous punishment of the officers of any corps that permitted any communication between the besieged and the outer world.Every soldier felt mightily afraid."
玄德回營，分付關、張曰：「我等正當淮南衝要之處。二弟切宜小心在意，勿犯曹公軍令。」飛曰：「捉了一員賊將，曹操不見有甚褒賞，卻反來諕嚇，何也？」玄德曰：「非也：曹操統領多軍，不以軍令，何能服人？弟勿犯之。」關，張應諾而退。,"Liu Bei returned to camp and cautioned his brothers, saying, ""We are in the most important place with regard to the South of River Huai, and you must be very careful not to allow any breach of this command.""Zhang Fei was inclined to grumble, saying, ""We have just captured one of the enemy's leaders, and there is no word of praise or reward for us: Nothing but new orders and threats. What do you make of that?""""You are wrong to complain,"" said Liu Bei. ""These are orders of the Commander-in-Chief, and what would happen were there no orders? Do not disobey them, brother.""They promised obedience and withdrew."
且說許汜，王楷，回見呂布，具言袁術先欲得婦，然後起兵救援。布曰：「如何送去？」汜曰：「今郝萌被獲，操必知我情，預作準備。若非將軍親自護送，誰能突出重圍？」布曰：「今日便送去，如何？」汜曰：「今日乃凶神值日，不可去。明日大利，宜用戌亥時。」布命張遼，高順引三千軍馬，安排小車一輛：「我親送至二百里外，卻使你兩個送去。」,"In the meantime Xu Si and Wang Kai had got back to Lu Bu and told him what Yuan Shu had said, that if the girl came the soldiers should go.""But how can she be sent?"" said Lu Bu.Xu Si said, ""That is the difficulty. He Meng's capture means that Cao Cao knows the whole plan of getting help from the South of River Huai. I do not see how anyone but you yourself could hope to get through the close siege.""""Suppose we tried, today?"" said Lu Bu.""This is an ill-omened day. You must not try today. Tomorrow is a very lucky day, especially in the evening, for any military action.""Then Lu Bu ordered Zhang Liao and Gao Shun, ""Get ready three thousand troops for the venture, and prepare a light carriage. I will lead the first seventy miles, thence you can escort the bride-elect the remainder of the way to her new home."""
次夜二更時分，呂布將女以綿纏身，用甲包裏，負於背上，提戟上馬。放開城門，布當先出城，張遼，高順跟著。將次到玄德寨前，一聲鼓響，關，張二人攔住去路，大叫：「休走！」布無心戀戰，只顧奪路而行。玄德自引一軍殺來，兩軍混戰。呂布雖勇，終是縛一女在身上，只恐有傷，不敢衝突重圍。後面徐晃、許褚皆殺來，眾軍皆大叫曰：「不要走了呂布！」,"Next evening toward the second watch, Lu Bu wrapped up his daughter in soft wadded garments, bound her about with a mailed coat, and took her on his back. Then with his mighty trident halberd in hand, he mounted Red Hare and rode at the head of the cavalcade out of the city gate. Zhang Liao and Gao Shun followed.In this order they approached Liu Bei's camp. The drums at once beat the alarm, and Guan Yu and Zhang Fei barred the way.""Stop!"" they shouted.Lu Bu had no desire to fight; all he wished was to get through, so he made for a side road. Liu Bei came in pursuit and the two parties engaged. Brave as he might be, Lu Bu was almost helpless now that he was hampered by a girl on his shoulders, whom he was desperately anxious to preserve from hurt. Beside other parties came up all shouting and attacking."
布見軍來太急，只得仍退入城。玄德收軍，徐晃等各歸寨，端的不曾走透一個。呂布回到城中，心中憂悶，只是飲酒。,Lu Bu had no alternative but to give up his project and return into the city of Xiapi. He reached his palace very sad at heart. The besiegers returned to camp well pleased that no one had got beyond their lines. Lu Bu found consolation in the wine cup.
卻說曹操攻城，兩月不下，忽報：「河內太守張揚出兵東市，欲救呂布；部將楊醜殺之，欲將頭獻丞相，欲被張揚心腹將眭固所殺，反投大城去了。」操聞報，即遣史渙追斬眭固。因聚眾將曰：「張揚雖幸自滅，然北有袁紹之憂，東有表、繡之患，下邳久圍不克。吾欲捨布還都，暫且息戰，何如？」荀攸急止曰：「不可，呂布屢敗，銳氣已墮。軍以將為主，將衰則軍無戰心。彼陳宮雖有謀而遲，今布之氣未復，宮之謀未定，作速政之，布可擒也。」郭嘉曰：「某有一計，下邳城可立破，勝於二十萬師。」荀彧曰：「莫非決沂、泗之水乎？」嘉笑曰：「正是此意。」,"The siege had gone on for two months, and still the city stood. Then they heard that Zhang Yang, Governor of Henei, had been inclined to come to the help of Lu Bu. But one of his subordinates, Yang Chou, had assassinated him and was bringing his head as an offering to Cao Cao, when Yang Chou had also been slain by Kui Gu, one of the Governor's adherents. Kui Gu had then led the force to Daicheng.In the camp of the besiegers, there now arose much murmuring. Cao Cao sent Shi Huan to intercept and kill Kui Gu.Then he called a counsel, saying, ""Though Zhang Yang, who meant to hurt us, is happily no more, yet we are threatened on the north by Yuan Shao, and on the west Liu Biao and Zhang Xiu are a menace. Here we meet with no success against the city of Xiapi. We are for leaving Lu Bu to his fate and returning home. What do you think?""Among them Xun You fought against the idea, saying, ""You must not act like this. Lu Bu has lost much, and his spirit is broken. The spirit of the leader expresses that of his army; and when the leader fails, his soldiers do not fight. Chen Gong is clever, but nothing is done. Lu Bu broken, Chen Gong without decision, it only needs a sharp attack, and we shall succeed.""""I have a plan to propose,"" said Guo Jia, ""a plan to overcome the city at once. It is better than two hundred thousand troops.""""I suppose you mean drowning the city by River Si and River Yi,"" said Xun Yu.""That is it,"" said Guo Jia, smiling."
操大喜。即令軍士決兩河之水。曹兵皆居高原，坐視水淹下邳。下邳一城，只剩得東門無水；其餘各門，都被水淹。眾軍飛報呂布。布曰：「吾有亦免馬，渡水如平地，又何懼哉！」乃日與妻妾痛飲美酒。因酒色過傷，形容銷減。一旦取鏡自照，驚曰：「吾被酒色傷矣！自今日始，當戒之。」遂下令城中，但有飲酒皆斬。,"Cao Cao accepted the suggestion with joy and set his troops to cut the banks of River Yi and River Si, and moved his army to the high ground whence they watched the drowning out of Xiapi. Only the east gate remained clear of water.The besieged soldiers hastened to their leader.Lu Bu said, ""Why should I fear? My good horse can go as well through the water as over the land.""And he again returned to the wine cup for consolation, drinking deeply with his wife and concubine.The continual drinking bouts told at last, and Lu Bu began to look dissipated. Seeing himself in a mirror one day, he was startled at the change and said to himself, ""I am injuring myself with wine. No more from this day forward!""He then issued an order that no one should drink wine under penalty of death."
卻說侯成有馬十五匹，被後槽人盜去，欲獻與玄德。侯成知覺，追殺後槽人，將馬奪回；諸將與侯成作賀。侯成釀得五六斛酒，欲與諸將會飲；恐呂布見罪，乃先以酒五瓶詣布府，稟曰：「托將軍虎威，追得失馬。眾將皆來作賀，釀得些酒，未敢擅飲，特先奉上微意。」,"Now one of his generals, Hou Cheng, lost fifteen horses, stolen by one of his subordinates, Hou Cao, who intended to resell them to Liu Bei. Hou Cheng found out where the horses were, went out after them, and recovered them after killing Hou Cao. And Hou Cheng's colleagues congratulated him on his success. To celebrate the occasion, Hou Cheng brewed a few barrels of wine to be drunk at the feast.But thinking his chief might find him in fault, Hou Cheng sent the bottles of wine to Lu Bu's palace with a petition explaining, ""By your virtue of warlike renown, I have recovered my horses; and as my comrades come with their congratulations, I brew some bottles of wine, first to offer Your Lordship and second to ask your permission to have a little wine at the feast."""
布大怒曰：「吾方禁酒，汝卻釀酒會飲，莫非同謀伐我乎？」命推出斬之。宋憲，魏續等諸將俱入告饒。布曰：「故犯吾令，理合斬首。今看眾將面，且打一百！」眾將又哀告，打了五十背花，然後放歸。眾將無不喪氣。,"Lu Bu took it very angrily, saying, ""When I have forbidden all wine, you brew some and begin to give feasts: You are simply defying me!""Whereupon he ordered the officer to instant execution. However, Song Xian, Wei Xu, and other officers came in and interceded, and after a time Lu Bu softened.""You ought to lose your head for this disobedience. But for the sake of your colleagues, the punishment shall be reduced to a hundred strokes.""They tried to beg him off this, but only succeeded in reducing the number of blows to one half.When the sentence had been carried out and Hou Cheng was permitted to return home, his colleagues came sadly to console him."
宋憲，魏續至侯成家探視，侯成泣曰：「非公等則吾死矣！」憲曰：「布只戀妻子，視吾等如草芥。」續曰：「軍圍城下，水遶壕邊，吾等死無日矣！」憲曰：「布無仁無義，我等棄之而走，何如？」續曰：「非丈夫也。不若擒布獻曹公。」侯成曰：「我因追馬受責，而布所倚恃者，赤免馬也。汝二人果能獻門擒布，吾當先盜馬去見曹公。」,"""Had it not been for you, I should have been put to death,"" said Hou Cheng.Song Xian replied, ""All Lu Bu cares for is his family. There is no pity for anyone else. We are no more than the weeds by the roadside.""Wei Xu said, ""The city is besieged; the water is drowning us out. There will not be much more of this, for we may die any day.""""He is a beast, with neither a sense of humanity nor of right. Let us leave him,"" said Song Xian.""He is not worth fighting for. The best we could do would be to seize him and hand him over to Cao Cao,"" said Wei Xu.""I was punished because I got my horses back again, yet all he trusts in is his own Red Hare. If you two will betray the gate and seize Lu Bu, I will steal the horse and go out to Cao Cao's camp."""
三人商議定了。是夜侯成暗至馬院，盜了那匹赤免馬，飛奔東門來。魏續便開門放出，卻佯作追趕之狀。侯成到曹操寨，獻上馬匹，備言宋憲、魏續插白旗為號，準備獻門。曹操聞此信，便押榜數十張射入城去。其榜曰：,"They settled how to carry out the plot, and that very night Hou Cheng sneaked into the stables and got Red Hare away. He hastened to the east gate which was opened to let him through. The guard made a pretense of pursuing him but only a pretense.Hou Cheng reached the besiegers' camp, presented the horse and told Cao Cao what had been arranged. They would show a white flag and open the gates to his army. Hearing this Cao Cao had a few notifications written out, which were attached to arrows and shot over the walls. This is one of them:"
大將軍曹，特奉明詔，征伐呂布。如有抗拒大軍者，破城之日，滿門誅戳。上至將校，下至庶民，有能擒呂布來獻，或獻其首級者，重加官賞。為此榜諭，各宜知悉。,"""Regent Marshal Cao Cao has received a command from the Emperor to destroy Lu Bu. Those who interfere with the operations of his grand army, whatever their rank, shall be put to death in the gate on the day that the city shall be captured. Should anyone capture Lu Bu or bring his head, he shall be well rewarded. Let all take note of this."""
次日平明，城外喊聲震地。呂布大驚，提戟上城，各門點視，責罵魏續走透侯成，失了戰馬，欲待治罪。城下曹兵望見城上白旗，竭力攻城，布只得親自抵敵。從平明直打到日中，曹兵稍退。布少憩門樓，不覺睡著在椅上。宋憲趕退左右，先盜其畫戟，便與魏續一齊動手，將呂布繩纏索綁，緊緊縛住。,"Next day at daylight a tremendous hubbub was heard without the city and Lu Bu, halberd in hand, hasted to the wall to see what it meant. As he went from gate to gate inspecting the defenses and guards, he censured Wei Xu for letting Hou Cheng escape and get away with his horse. Lu Bu threatened to punish Wei Xu. But just then the besiegers began a fierce attack as the white flag had just appeared, and Lu Bu had to turn all his energies to defense. The assault lasted till noon, when the attacking force drew off for a time.Lu Bu was taking a rest in the tower and fell asleep in his chair. Song Xian sent away Lu Bu's attendants. When they had gone, he stole Lu Bu's weapon, the trident halberd in which he trusted. Then Song Xian and Wei Xu fell upon Lu Bu together and before he was well awake had bound him with cords, trussing him so that he could not move."
布從睡夢中驚醒，急喚左右，卻都被二人殺散，把白旗一招，曹兵齊至城下。魏續大叫：「已生擒呂布矣！」夏侯淵尚未信。宋憲在擲下呂布畫戟來，大開城門，曹兵一擁而入。高順，張遼在西門，水圍難出。為曹兵所擒。陳宮奔至南門，為徐晃所獲。,"Lu Bu shouted for his guards, but they were driven off by the two traitor generals and could not come near. Then a white flag was shown, and the besiegers again approached the city.The traitors shouted out, ""Lu Bu has been captured alive!""But Xiahou Yuan could hardly believe it till they threw down the famous halberd. The gates were flung open, and the enemy entered the city. Gao Shun and Zhang Liao, who were at the opposite gate, were surrounded and cut off by the water and helpless. They were captured. Chen Gong made a dash to the south gate but was also taken by Xu Huang."
曹操入城，即傳令退了所決之水，出榜安民；一面與玄德同坐白門樓上，關，張侍立於側，提過擒獲一干人來。呂布雖然長大，卻被繩索綑作一團。布叫曰：「縛太急，乞緩之！」操曰：「縛虎不得不急。」布見侯成，魏續[陳怡妏1]，宋憲，皆立於側，乃謂之曰：「我待諸將不薄，汝等何忍背反？」憲曰：「聽妻妾言，不聽將計，何謂不薄？」,"Presently Cao Cao entered and at once gave orders to turn the streams back into their usual courses. He put out proclamations to sooth the people.Cao Cao and Liu Bei, with Guan Yu and Zhang Fei behind, seated themselves side by side in the White Gate Tower. The captives were brought before them. Lu Bu looked a pitiable object. Although a very tall man, he was tied up in a veritable ball.""The bonds are very tight,"" cried he, ""I beseech you to loosen them!""""Binding a tiger must bind tight, of course,"" replied Cao Cao.Seeing Hou Cheng, Song Xian, and Wei Xu standing there looking pleased at their success, Lu Bu said, ""I treated you all well enough: How could you turn against me?""Said Song Xian, ""You listened to the words of your women, but rejected the advice of your generals. Was not that mean?"""
布默然。須臾，眾擁高順至。操問曰：「汝有何言？」順不答。操怒命斬之。徐晃解陳宮至。操曰：「公臺別來無恙？」宮曰：「汝心術不正，吾故棄汝！」操曰：「吾心不正，公又奈何獨事呂布？」宮曰：「布雖無謀，不似你詭詐奸險。」操曰：「公自謂足智多謀，今竟何如？」宮顧呂布曰：「恨此人不從吾言！若從吾言，未必被擒也。」操曰：「今日之事當如何？」宮大聲曰：「今日有死而已！」操曰：「公如是，奈公之老母妻子何？」宮曰：「吾聞以孝治天下者，不害人之親；施仁政於天下者，不絕人之祀。老母妻子之存亡，亦在於明公耳。吾身既被擒，請即就戮，並無挂念。」,"Lu Bu was silent. Then Gao Shun was brought forward.""What have you to say?"" asked Cao Cao.Gao Shun sulkily held his tongue. He was ordered out to execution.Next Chen Gong was led in.""I hope you have been well since we last saw each other, Chen Gong?"" said Cao Cao.""Your ways were crooked, and so I left you,"" said Chen Gong.""You say I was crooked; and what of your serving Lu Bu?""""Though he was a fool, he did not resemble you in deceit and wickedness.""""You say you are able enough and clever, but what about your position today?""Turning toward Lu Bu, Chen Gong said, ""This man would not follow my advice. Had he done so, he would not now be a captive.""""What think you ought to be done about this day's work?"" said Cao Cao.""There is death for me today, and that is the end!"" said Chen Gong undauntedly.""Very well for you; but what of your mother and wife and children?""""It is said that one who rules with due regard to filial piety does not harm a person's family; one who would show benevolence does not cut off the sacrifices at a person's tomb. My mother and wife and children are in your hands. But since I am your prisoner, I pray you slay me quickly and not to try to harrow my feelings."""
操有留戀之意。宮徑步下樓，左右牽之不住。操起身泣而送之。宮並不回顧。操謂從者曰：「即送公臺老母妻子回許都養老。怠慢者斬。」宮聞言，亦不開口，伸頸就刑。眾皆下淚。操以棺槨盛其屍，葬於許都。後人有詩歎之曰：,"Cao Cao's heart still leaned toward mercy, but Chen Gong turned and walked away, repulsing the attendants who would stop him. Cao Cao rose from his place and walked with Chen Gong, the tears falling from his eyes. Chen Gong never looked at him.Turning to his guards Cao Cao said, ""Let his mother and family be taken to Xuchang and looked after immediately. Any postponement will be punished!""The condemned man heard him but uttered no word. He stretched out his neck for the blow. Tears sprang to the eyes of all present. His remains were honorably coffined and buried in Xuchang.A poem pitying Chen Gong's fate says:"
生死無二志，丈夫何壯哉！不從金石論，空負棟梁材。,"Neither hope of life nor fear of death moved him.How brave was he, a hero indeed!But his lord heeded not his words,Wherefore in vain possessed he great talents."
輔主真堪敬，辭親實可哀。白門身死日，誰肯似公臺！,"Nevertheless, in that he stood by his master.To parting with wife and mother,He merits our pity and profound respect.Who would resemble Chen GongThat day he died at the White Gate Tower?"
