chinese,english
卻說曹操正在軍中，與諸將議事，人報徐州有戰書到。操拆而觀之，乃劉備書也。書略曰：「備自關外得拜君顏，嗣後天各一方，不及趨侍。向者，尊父曹侯，實因張闓不仁，以致被害，非陶恭祖之罪也。目今黃巾遺孽，擾亂於外；董卓餘黨，盤踞於內。願明公先朝廷之急，而後私讎；撤徐州之兵，以救國難：則徐州幸甚，天下幸甚！」,"It happened that Cao Cao was holding a council when a messenger with a war letter was announced. The letter was brought in and handed to him and, when he had opened and looked at it, he found it was from Liu Bei.This is the letter, very nearly:""Since meeting you outside the pass, fate has assigned us to different quarters of the world, and I have not been able to pay my respects to you. Touching the death of your noble father, it was owing to the vicious nature of Zhang Kai and due to no fault of Tao Qian. Now while the remnant of the Yellow Scarves is disturbing the lands, and Dong Zhuo's partisans have the upper hand in the capital, I wish that you, Illustrious Sir, would regard the critical position of the court rather than your personal grievances, and so divert your forces from the attack on Xuzhou to the rescue of the state. Such would be for the happiness of this city and the whole empire."""
曹操看書，大罵：「劉備何人，敢以書來勸我！且中間有譏諷之意！」命斬來使，一面竭力攻城。郭嘉諫曰：「劉備遠來救援，先禮後兵，主公當用好言答之，以慢備心；然後進兵攻城，城可破也。」操從其言，款留來使，候發回書。,"Cao Cao gave vent to a torrent of abuse: ""Who is this Liu Bei that he dares write and exhort me? Beside, he means to be satirical.""Cao Cao issued orders to put the bearer of the letter to death and to press on the siege.But Guo Jia remonstrated, saying, ""Liu Bei has come from afar to help Tao Qian, and he is trying the effect of politeness before resorting to arms. I pray you, my lord, reply with fair words that his heart may be lulled with a feeling of safety. Then attack with vigor and the city will fall.""Cao Cao found this advice good, so he spared the messenger, telling him to wait to carry back his reply."
正商議間，忽流星馬飛報「禍事！」。操問其故，報說呂布已襲破兗州，進據濮陽。原來呂布自遭李、郭之亂，逃出武關，去投袁術；術怪呂布反覆不定，拒而不納。投袁紹，紹納之，與布共破張燕於常山；布自以為得志，傲慢袁紹手下將士。紹欲殺之，布乃去投張揚，揚納之。時龐舒在長安城中，私藏呂布妻小，送還呂布。李傕、郭汜知之，遂斬龐舒，寫書與張揚，教殺呂布；布因棄張揚去投張邈。恰好張邈弟張超引陳宮來見張邈。宮說邈曰：「今天下分崩，英雄並起，君以千里之眾，而反受制於人，不亦鄙乎！今曹操征東，兗州空虛，而呂布乃當世勇士，若與之共取兗州，伯業可圖也。」張邈大喜，便令呂布襲破兗州，隨據濮陽。止有鄄城，東阿，范縣三處，被荀彧、程昱設計死守得全，其餘俱破。曹仁屢戰，皆不能勝，特此告急。,"While this was going on, a horseman came with news of misfortune: ""Lu Bu has invaded Yanzhou, now holding Puyang. The three counties left —-Juancheng, Fanxia, and Dongjun —-are under severe attacks!""When Li Jue and Guo Si, the two partisans of Dong Zhuo, succeeded in their attack on the capital, Lu Bu had fled to Yuan Shu. However, Yuan Shu looked askance at him for his instability and refused to receive him. Then Lu Bu went to try Yuan Shao, who was a brother of Yuan Shu. Yuan Shao accepted the warrior and made use of him in an attack upon Zhang Yan in Changshan. But Lu Bu's success filled him with pride, and his arrogant demeanor so annoyed the other commanders that Yuan Shao was on the point of putting him to death. To escape this Lu Bu had gone away to Zhang Yang, Governor of Shangdang, who accepted his services.About this time Pang Shu, who had been hiding and protecting Lu Bu's family in Changan since his disappearance, restored them to him. This deed angered Li Jue and Guo Si so that they put Pang Shu to death and wrote to Lu Bu's protector to serve him the same. To escape this Lu Bu once again had to flee and this time joined himself to Zhang Miao, the Governor of Chenliu.Lu Bu arrived just as Zhang Miao's brother, Zhang Chao, was introducing Chen Gong.Chen Gong said to Zhang Miao, ""The rupture of the empire has begun, and warlords are seizing what they can. It is strange that you, with all the advantages of population and provisions you enjoy, do not strike for independence. Cao Cao has gone on an expedition against the east, leaving his own territory defenseless. Lu Bu is one of the warriors of the day. If you and he together attacked and got Yanzhou, you could then proceed to the dominion.""Zhang Miao was pleased and resolved to try. He ordered an attack, and soon Lu Bu was in possession of Yanzhou and its neighborhood, all but three small counties of Juancheng, Fanxia, and Dongjun, which were vigorously and desperately defended by Xun Yu and Cheng Yu in concert. Cao Cao's cousin, Cao Ren, had fought many battles but was repeatedly defeated, and the messenger with the evil tidings had come from him asking prompt help."
操聞報大驚曰：「兗州有失，使吾無家可歸矣，不可不亟圖之！」郭嘉曰：「主公正好賣個人情與劉備，退軍去復兗州。」操然之，即時答書與劉備，拔寨退兵。,"Cao Cao was greatly disturbed by this and said, ""If my own region be lost, I have no home to return to! I must do something at once.""""The best thing would be to become friends with Liu Bei at any cost and return to Yanzhou,"" said Guo Jia.Then Cao Cao wrote to Liu Bei, gave the letter to the waiting messenger and broke camp."
且說來使回徐州，入城見陶謙，呈上書札，言曹兵已退。謙大喜，差人請孔融，田楷，雲長，子龍等赴城大會。飲宴既畢，謙延玄德於上座，拱手對眾曰：「老夫年邁，二子不才，不堪國家重任。劉公乃帝室之胄，德廣才高，可領徐州。老夫情願乞閒養病。」玄德曰：「孔文舉令備來救徐州，為義也；今無端據而有之，天下將以備為無義人矣。」糜竺曰：「今漢室陵遲，海宇顛覆，樹功立業，正在此時。徐州殷富，戶口百萬，劉使君領此，不可辭也。」玄德曰：「此事決不敢應命。」陳登曰：「陶府君多病，不能視事，明公勿辭。」玄德曰：「袁公路四世三公，海內所歸，近在壽春，何不以州讓之？」孔融曰：「袁公路塚中枯骨，何足挂齒！今日之事，天與不取，悔不可追。」,"The news that the enemy had left was very gratifying to Tao Qian, who then invited his various defenders into Xuzhou City and prepared banquets and feasts in token of his gratitude.At one of these, when the feasting was over, he proceeded with his wish of retirement in favor of Liu Bei. Placing Liu Bei in the seat of highest honor, Tao Qian bowed before him and then addressed the assembly, ""I am old and feeble, and my two sons lack the ability to hold so important an office as this. The noble Liu Bei is a descendant of the imperial house. He is of lofty virtue and great talent. Let him then take over the rule of this region, and only too willingly I shall retire to have leisure to nurse my health.""Liu Bei replied, ""I came at the request of Governor Kong Rong, because it was the right thing to do. Xuzhou is saved; but if I take it, surely the world will say I am a wicked man.""Mi Zhu said, ""You may not refuse. The House of Han is falling, their realm is crumbling, and now is the time for doughty deeds and signal services. This is a fertile region, well populated and rich, and you are the man to rule over it.""""But I cannot accept,"" said Liu Bei.""Imperial Protector Tao Qian is a great sufferer,"" said Chen Deng, ""and cannot see to matters. You may not decline, Sir.""Said Liu Bei, ""Yuan Shu belongs to a family of rulers, who have held the highest offices of state four times in three generations. The multitude people respects him. Why not invite him to this task?""""Because Yuan Shu is a drying skeleton in a dark tomb: Not worth talking about. This opportunity is a gift from Heaven, and you will never cease to regret its loss,"" said Kong Rong."
玄德堅執不肯。陶謙泣下曰：「君若捨我而去，我死不瞑目矣！」雲長曰：「既承陶公相讓，兄且權領州事。」張飛曰：「又不是我強要他的州郡；他好意相讓，何必苦苦推辭？」玄德曰：「汝等欲陷我於不義耶？」陶謙推讓再三，玄德只是不受。陶謙曰：「如玄德必不肯從，此間近邑，名小沛，足可屯軍。請玄德暫駐軍此邑，以保徐州，何如？」眾皆勸玄德留小沛，玄德從之。陶謙勞軍已畢，趙雲辭去，玄德執手揮淚而別。孔融、田楷亦各相別，引軍自回。玄德與關、張引本部軍來至小沛，修葺城垣，撫諭居民。,"But still Liu Bei obstinately refused. Tao Qian besought him with tears, saying, ""I shall die if you leave me, and there will be none to close my eyes.""""Brother, you should accept the offer thus made,"" said Guan Yu.""Why so much fuss?"" said Zhang Fei. ""We have not taken the place. It is he who wishes to give it to you.""""You all persuade me to do what is wrong,"" said Liu Bei.Seeing he could not persuade Liu Bei, Tao Qian then said, ""As you are set in determination, perhaps you will consent to encamp at Xiaopei. It is only a little town, but thence you can keep watch and ward over the region.""They all with one voice prayed Liu Bei to consent, so he gave in. The feast of victory being now ended, the time came to say farewell. When Zhao Zilong took his leave, Liu Bei held his hands alternately while dashing away the falling tears. Kong Rong and Tian Kai went home to their own places.When Liu Bei and his brothers took up their abode in Xiaopei, they first repaired the defenses, and then they put out proclamations in order to calm the inhabitants."
卻說曹操回軍，曹仁接著，言呂布勢大，更有陳宮為輔，兗州、濮陽已失，其鄄城，東阿，范縣三處，賴荀彧、程昱二人設計相連，死守城郭。操曰：「吾料呂布有勇無謀，不足慮也。」教且安營下寨，再作商議。呂布知曹操回兵，已過滕縣，召副將薛蘭、李封曰：「吾欲用汝二人久矣。汝可引軍一萬，堅守兗州。吾親自率兵，前去破曹。」,"In the meantime Cao Cao had marched toward his own region (AD 194).Cao Ren met and told him, ""Lu Bu is very powerful, and he has Chen Gong as Adviser. Yanzhou is as good as lost, with the exception of three counties which Xun Yu and Cheng Yu are vigorously defending together.""Cao Cao said, ""I own that Lu Bu is a bold fighter but nothing more: He has no craft. So we need not fear him seriously.""Then he gave orders to make a strong camp till they could think out some victorious plan.Lu Bu, knowing of Cao Cao's return, called two of his subordinate generals, Xue Lan and Li Fang, to him and assigned to them the task of holding the city of Yanzhou, saying, ""I have long waited for opportunity to employ your skill. Now I give you ten thousand soldiers, and you are to hold the city while I go forth to attack Cao Cao."""
二人應諾。陳宮急入見曰：「將軍棄兗州，欲何往乎？」布曰：「吾欲屯兵濮陽，以成鼎足之勢。」宮曰：「差矣。薛蘭必守兗州不住。此去正南一百八十里，泰山路險，可伏精兵萬人在彼。曹兵聞失兗州，必然倍道而進，待其過半，一擊可擒也。」布曰：「吾屯濮陽，別有良謀，汝豈知之！」遂不用陳宮之言，而用薛蘭守兗州而行。,"The two accepted. But Chen Gong, the strategist, came in hastily, saying, ""General, you are going away. Whither?""""I am going to camp my troops at Puyang, to establish an ox-horn vantage.""""You are making a mistake,"" said Chen Gong. ""The two you have chosen to defend this city are unequal to the task. For this expedition remember that about sixty miles due south, on the treacherous road to the Taishan Mountains, is a very advantageous position where you should place your best men in ambush. Cao Cao will hasten homeward by double marches when he hears what has happened. If you strike when half his troops have gone past this point, you may seize him.""Said Lu Bu, ""I am going to occupy Puyang and see what develops. How can you guess my big plan?""So Lu Bu left Xue Lan in command at Yanzhou and went away."
曹操兵行至泰山險路，郭嘉曰：「且不可進：恐此處有伏兵。」曹操笑曰：「呂布無謀之輩，故教薛蘭守兗州，自往濮陽；安得此處有埋伏耶？」教曹仁領一軍圍兗州，吾進兵濮陽，速攻呂布。,"Now when Cao Cao approached the dangerous part of the road near the Taishan Mountains, Guo Jia warned him, saying, ""Do not advance hastily, my lord. There is doubtless an ambush.""But Cao Cao laughed, saying, ""We know all Lu Bu's dispositions. Xue Lan is keeping the city, while Lu Bu is massing his troops at Puyang. Do you think Lu Bu has laid an ambush? I shall tell Cao Ren to besiege Yanzhou, and I shall go to Puyang."""
陳宮聞曹兵至近，乃獻計曰：「今曹兵遠來疲困，利在速戰，不可養成氣力。」布曰：「吾匹馬縱橫天下，何愁曹操！待其下寨，吾自擒之。」,"In Puyang, when Chen Gong heard of the enemy's approach, he spoke, saying, ""The enemy will be fatigued with long marches, so attack quickly before they have time to recover.""Lu Bu replied, ""I, a single horseman, am afraid of none. I come and go as I will. Think you I fear this Cao Cao? Let him settle his camp; I will take him after that."""
卻說曹操兵近濮陽，下住寨腳。次日引眾將出，陳兵於野。操立馬於門旗下，遙望呂布兵到。陣圓處，呂布當先出馬，兩邊排開八員健將：第一個雁門馬邑人：張，名遼，字文遠；第二個泰山華陰人：姓臧，名霸，字宣高；兩將又各引六員健將：郝萌，曹性，成廉，魏續，宋憲，侯成。布軍五萬，鼓聲大震。,"Now Cao Cao neared Puyang, and he made a camp. The next day he led out his commanders, and they arrayed their armies in open country. Cao Cao took up his station on horseback between the two standards, watching while his opponents arrived and formed up in a circular area.Lu Bu was in front, followed by eight of his generals, all strong men: Zhang Liao of Mayi, backed by Hao Meng, Cao Xing, and Cheng Lian; Zang Ba of Huaying, backed by Wei Xu, Song Xian, and Hou Cheng. They led an army of fifty thousand in total. The drums began their thunderous roll."
操指呂布而言曰：「吾與汝自來無讎，何得奪吾州郡？」布曰：「漢家城池，諸人有分，偏爾合得？」便叫臧霸出馬搦戰。曹軍內樂進出迎。兩馬相交，雙鎗齊舉。戰到三十餘合，勝負不分。夏侯惇拍馬便出助戰，呂布陣上，張遼截住廝殺。惱得呂布性起，挺戟驟馬，衝出陣來，夏侯惇、樂進皆走。呂布掩殺，曹軍大敗，退三四十里。布自收軍。,"Cao Cao, pointing to his opponent, said, ""You and I had no quarrel, why then did you invade my land?""""The cities of Han are the possession of all. What is your special claim?"" said Lu Bu.So saying, Lu Bu ordered Zang Ba to ride forth and challenge. From Cao Cao's side the challenge was accepted by Yue Jing. The two steeds approached each other; two spears were lifted both together, and they exchanged near thirty blows with no advantage to either. Then Xiahou Dun rode out to help his colleague and, in reply, out went Zhang Liao from Lu Bu's side. And they four fought.Then fierce anger seized upon Lu Bu. Setting his trident halberd, he urged his Red Hare forward to where the fight was waging. Seeing him approach, Xiahou Dun and Yue Jing both fled, but Lu Bu pressed on after them, and Cao Cao's army lost the day. Retiring ten miles, they made a new camp. Lu Bu called in and mustered his troops."
曹操輸了一陣，回寨與諸將商議。于禁曰：「某今日上山觀望，濮陽之西，呂布有一寨，約無多軍。今夜彼將謂我軍敗走，必不準備，可引兵擊之；若得寨，布軍必懼：此為上策。」操從其言，帶曹洪，李典，毛玠，呂虔，于禁，典韋六將，選馬步二萬人，連夜從小路進發。,"The day having gone against him, Cao Cao called a council, and Yu Jin said, ""From the hill tops today I saw a camp of our enemies on the west of Puyang. They were but few men therein, and tonight after today's victory, it will not be defended. Let us attack; and if we can take the camp, we shall strike fear into the heart of Lu Bu. This is our best plan.""Cao Cao thought so too. He and six of his generals —-Cao Hong, Li Dian, Mao Jie, Lu Qian, Yu Jin, and Dian Wei —-and twenty thousand horse and foot left that night by a secret road for the camp."
卻說呂布於寨中勞軍。陳宮曰：「西寨是個要緊去處，倘或曹操襲之，奈何？」布曰：「他今日輸了一陣，如何敢來？」宮曰：「曹操是極能用兵之人，須防他攻我不備。」布乃撥高順并魏續、侯成引兵往守西寨。卻說曹操於黃昏時分，引軍至西寨，四面突入。寨兵不能抵擋，四散奔走，曹操奪了寨。將及四更，高順方引軍到，殺將入來。曹操自引軍馬來迎，正逢高順，三軍混戰。將及天明，正西鼓聲大震，人報呂布自引軍來了。操棄寨而走。背後高順，魏續，侯成趕來，當頭呂布親自引軍來到。于禁，樂進，雙戰呂布不住，操望北而行。山後一彪軍出：左有張遼，右有臧霸。操使呂虔、曹洪戰之，不利，操望西而走。忽又喊聲大震，一彪軍至：郝萌，曹性，成廉，宋憲四將攔住去路。眾將死戰，操當先衝陣。梆子響處，箭如驟雨射將來。操不能前進，無計可脫，大叫：「誰人救我！」,"In his camp Lu Bu was rejoicing for that day's victory, when Chen Gong reminded him, saying, ""The western camp is importance point, and it might be attacked.""But Lu Bu replied, ""The enemy will not dare approach after today's defeat.""""Cao Cao is a very able commander,"" replied Chen Gong. ""You must keep a good lookout for him lest he attack our weak spot.""So arrangements were made for defense. Generals Gao Shun, Wei Xu, and Hou Cheng were ordered to march there.At dusk Cao Cao reached the camp and began an immediate attack on all four sides. The defenders could not hold him off. They ran in all directions, and the camp was captured. Near the fourth watch, when the defending party came, Cao Cao sallied forth to meet them and met Gao Shun. Another battle then began and waged till dawn. About that time a rolling of drums was heard in the west, and they told Cao Cao that Lu Bu himself was at hand. Thereupon Cao Cao abandoned the attack and fled.Gao Shun, Wei Xu, and Hou Cheng pursued him, while Lu Bu blocked his escape route. Cao Cao's two generals, Yu Jin and Yue Jing, attacked Lu Bu's troops but could not break them. Cao Cao went away north. But from behind some hills came out Zhang Liao and Zang Ba to attack. Lu Qian and Cao Hong were sent to stop the attackers, but Lu Qian and Cao Hong were both defeated. Cao Cao sought safety in the west. Here again his retreat was met by Lu Bu's four generals, Hao Meng, Cao Xing, Cheng Lian, and Song Xian.The fight became desperate. Cao Cao dashed at the enemy's array. The din was terrible. Arrows fell like pelting rain upon them, and they could make no headway.Cao Cao was desperate and cried out in fear, ""Who can save me?"""
馬軍隊裏，一將踴出：乃典韋也。手挺雙鐵戟，大叫：「主公勿憂！」飛身下馬，插住雙戟，取短戟十數枝，挾在手中，顧從人曰：「賊來十步乃呼我！」遂放開腳步，冒箭前行。布軍數十騎追至，從人大叫：「十步矣！」韋曰：「五步乃呼我！」從人又曰：「五步矣！」韋乃飛戟刺之，一戟一人墜馬，並無虛發，立殺十數人。眾皆奔走。韋復飛身上馬，挺一雙大鐵戟，衝殺入去。郝、曹、成、宋四將不能抵擋，各自逃去。典韋殺散敵軍，救出曹操，眾將隨後也到，尋路歸寨。,"Then from the crush dashed out Dian Wei with his double spears, crying, ""Fear not, my lord!""Dian Wei leapt from his steed, put aside his double spears, and laid hold of a handful of battle-axes. Turning to his followers he said, ""When the ruffians are at ten paces, call out to me.""Then he set off with mighty strides, plunging forward, careless of the flying arrows. Lu Bu's horsemen followed, and when they got near, Dian Wei's followers shouted, ""Ten paces!""""Five, then call!"" shouted back Dian Wei, and went on.Presently, ""Five paces!""Then Dian Wei spun round and flung the battle-axes. With every fling a man fell from the saddle and never a battle-ax missed.Having thus slain ten or so the remainder fled, and Dian Wei quickly remounted his steed, set his twin spears and rushed again into the fight with a vigor that none could withstand. One by one his opponents yielded, and he was able to lead Cao Cao safely out of the press of battle. Cao Cao and his commanders went to their camp."
看看天色傍晚，背後喊聲起處，呂布驟馬提戟趕來，大叫：「操賊休走！」此時人困馬乏，大家面面相覷，各欲逃生。正是：,"But as evening fell, the noise of pursuit fell on their ears, and soon appeared Lu Bu himself.""Cao Cao, you rebel, do not flee!"" shouted Lu Bu as he approached with his halberd ready for a thrust.All stopped and looked in each others' faces: The soldiers were weary, their steeds spent. Fear smote them, and they looked around for some place of refuge."
雖能暫把重圍脫，只怕難當勁敵追。不知曹操性命如何，且聽下文分解。,"You may lead your lord safely out of the press,But what if the enemy follow?We cannot say here what Cao Cao's fate was, but the next chapter will relate."
