chinese,english
卻說玄德問孔明求拒曹兵之計。孔明曰：「新野小縣，不可久居。近聞劉景升病在危篤，可乘此機會，取彼荊州為安身之地，庶可拒曹操也。」玄德曰：「公言甚善。但備受景升之恩，安忍圖之？」孔明曰：「今若不取，後悔何及？」玄德曰：「吾寧死不忍作負義之事。」孔明曰：「且再作商議。」,"When Liu Bei asked how his adviser hoped to repel Cao Cao, Zhuge Liang replied, ""Xinye is a small city and unfitted for our lengthy occupation. Liu Biao is ill and failing fast, so this is the time to take his region as a base where we may be safe against Cao Cao.""""You speak well, but Liu Biao has shown me great kindness, and I could not bear to serve him an ill turn.""""If you do not take this opportunity, you will regret it ever after,"" said Zhuge Liang.""I would rather perish than do what is wrong.""""We will discuss it again,"" replied Zhuge Liang."
卻說夏侯惇敗回許昌，自縛見曹操，伏地請死。操釋之。惇曰：「惇遭諸葛亮詭計，用火攻破我軍。」操曰：「汝自幼用兵，豈不知狹處須防火攻？」惇曰：「李典、于禁曾言及此，悔之不及！」操乃賞二人。惇曰：「劉備如此猖獗，真腹心之患也，不可不急除。」操曰：「吾所慮者，劉備、孫權耳。餘皆不足介意。今當乘此時掃平江南。」便傳令起大兵五十萬，令曹仁、曹洪，為第一隊；張遼、張郃，為第二隊；夏侯淵、夏侯惇，為第三隊；于禁、李典，為第四隊；操自領諸將為第五隊。每隊各引兵十萬。又令許褚為折衝將軍，引兵三千為先鋒。選定建安十三年秋七月丙午日出師。,"When Xiahou Dun reached the capital, he presented himself to his master in bonds and craved death. But his master loosed him and let him tell his tale.And Xiahou Dun said, ""I was the victim of Zhuge Liang's evil machinations: He attacked with fire.""""As a soldier from your youth, you should have remembered that fire was a likely weapon in narrow roads.""""Li Dian and Yu Jin reminded me. I am sorry enough now.""Cao Cao rewarded Li Dian and Yu Jin who had warned their leader.""Liu Bei as strong as he is now certainly is a menace to our existence, and he must be quickly destroyed,"" said Xiahou Dun.""He is one of my anxieties,"" replied Cao Cao. ""Sun Quan is the other. The rest do not count. We must take this chance to sweep the south clean.""Then orders were issued to prepare an army of five hundred thousand troops, in five divisions of ten legions each. Each division had two leaders: Cao Ren and Cao Hong were in command of the first division; Zhang Liao and Zhang He, the second; Xiahou Dun and Xiahou Yuan, the third; Yu Jin and Li Dian, the fourth. The fifth body was led by Cao Cao himself. The van was commanded by Xu Chu. The ""horse"" day of the seventh moon of the thirteenth year of Rebuilt Tranquillity was fixed for the march (AD 208)."
大中大夫孔融諫曰：「劉備、劉表皆漢室宗親，不可輕伐。孫權虎踞六郡，且有大江之險，亦不易取。今丞相興此無義之師，恐失天下之望。」操怒曰：「劉備、劉表、孫權皆逆命之臣，豈容不討？」遂叱退孔融，下令如有再諫者必斬。孔融出府，仰天歎曰：「以至不仁伐至仁，安得不敗乎！」,"The High Minister, Kong Rong, offered a remonstrance.He said, ""Liu Bei and Liu Biao are both of the Imperial House and should not be attacked without grave reasons. Sun Quan in the six territories of the South Land is terrible as a crouching tiger and, with the Great River as his defense, he is very secure. If, Sir Prime Minister, you undertake this unjustifiable expedition, you will forfeit the respect of the world, I fear.""""All three of them are disobedient ministers and rebels, and how can I fail to punish them?"" replied Cao Cao.Cao Cao was angry, and bade the adviser go from his presence. Presently Cao Cao gave formal orders that he would put to death anyone who remonstrated on the subject of his expedition.Kong Rong went forth from the Palace sadly.Casting his eyes up to heaven, he cried, ""Where is the chance of success when the perfectly inhumane attacks the perfectly humane? He must be defeated!"""
時御史大夫郗慮家客聞此言，報知郗慮。慮常被孔融侮慢，心正恨之，乃以此言入告曹操；且曰：「融平日每每狎侮丞相，又與禰衡相善。衡贊融曰：「仲尼不死。」融贊衡曰：「顏回復生。」向者禰衡之辱丞相，乃融使之也。」操大怒，遂命廷尉捕捉孔融。融有二子，年尚少，時方在家，對坐奕棋。左右急報曰：「尊君被廷尉執去，將斬矣。二公子何不急避？」二子曰：「覆巢之下，安有完卵乎？」,"One of the clients of the Imperial Inspector Chi Lu, whom Kong Rong had always treated contemptuously and disdainfully, happened to hear this apostrophe and told his patron who carried the tale to Cao Cao.Chi Lu also added to it, saying, ""Kong Rong habitually speaks disrespectfully of the Chief Minister and has been very friendly with Mi Heng. In fact the insults that Mi Heng had hurled at you had been deliberately arranged and intrigued by Kong Rong. Kong Rong and Mi Heng seemed to admire each other hugely, and Mi Heng used to say, 'Confucius is not dead, because Kong Rong is he,' and the other used to reply, 'And his treasured disciple, Yan Hui, has risen again, because Mi Heng is he.'""Chi Lu's tale angered Cao Cao, who ordered the execution of the high minister.Now Kong Rong had two sons, both young, who were sitting at home playing chess, when one of their servants ran in and said, ""Your father has just been carried off for execution. Why do you not run away?""The youths replied, ""When the nest is pulled down, are the eggs left unbroken?"""
言未已，廷尉又至，盡收融家小并二子，皆斬之，號令融屍於市。京兆脂習伏屍而哭。操聞之，大怒，欲殺之。荀彧曰：「彧聞脂習常諫融曰：『公剛直太過，乃取禍之道。』今融死而來哭，乃義人也，不可殺。」操乃止。習收融父子屍首，皆葬之。後人有詩讚孔融曰：,"Even at that moment the same executors came and carried off the whole household. The two youths were beheaded. The father's corpse was exposed in the streets.Minister Zhi Xi wept over the corpse. This public exhibition of sympathy rekindled Cao Cao's anger, and he was going to punish it with death.However, this additional punishment was prevented by Adviser Xun Yu, who said, ""You should not slay a righteous man who came to mourn over his friend's corpse. Zhi Xi had often warned Kong Rong against the danger his severe rectitude might lead him into.""Zhi Xi took up the remains of father and sons and buried them."
孔融居北海，豪氣貫長虹。坐上客長滿，樽中酒不空。文章驚世俗，談笑侮王公。史筆褒忠直，存宜紀大中。,"Kong Rong, who dwelt on the north sea shore,A noble reputation bore;With him all guests warm welcome found,And ceaselessly the wine went round.For skill in letters he was famed,In speech, he dukes and princes shamed,Historians his merits tell,Recorders say that he did well."
曹操既殺孔融，傳令五隊軍馬次第起行，只留荀彧等守許昌。,"After wreaking his wrath on Kong Rong, Cao Cao issued the order to march. Xun Yu was left in command of the capital."
卻說荊州劉表病重，使人請玄德來託孤。玄德引關、張至荊州見劉表。表曰：「我病已入膏肓，不久便死矣；特託孤於賢弟。我子無才，恐不能承父業。我死之後，賢弟可自領荊州。」玄德泣拜曰：「備當竭力以輔賢姪，安敢有他意乎？」,"About this time the Imperial Protector of Jingzhou became seriously ill, and he summoned Liu Bei to his chamber. Liu Bei went accompanied by his two brothers, Guan Yu and Zhang Fei, and Directing Instructor Zhuge Liang.Liu Biao said, ""The disease has attacked my very vitals, and my time is short. I confide my orphans to your guardianship. My sons are unfit to succeed to my place, and I pray you, my brother, administer the region after my death.""Liu Bei wept, saying, ""I will do my utmost to help my nephews. What else could I do, indeed?"""
正說間，人報曹操自統大兵至。玄德急辭劉表，星夜回新野。劉表病中聞此信，吃驚不小，商議寫遺囑，令玄德輔佐長子劉琦為荊州之主。蔡夫人聞之大怒，關上內門，使蔡瑁、張允二人把住外門。時劉琦在江夏，知父病危，來至荊州探病。方到外門，蔡瑁當住曰：「公子奉父命鎮守江夏，其任至重。今擅難職守，倘東吳兵至，如之奈何？若入見主公，主公必生嗔怒，病將轉增，非孝也。宜速回。」,"Even at this moment came the news of the march of Cao Cao's armies, and Liu Bei, taking hasty leave of his kinsman, was forced to hurry to his station. The evil tidings aggravated the sick man's condition, and he began to make his last arrangements. In his testament he appointed Liu Bei the guardian of his son Liu Qi, who was to succeed in the lordship.This arrangement greatly angered his wife, Lady Cai. She closed the inner doors against all and confided to her own partisans, of whom Cai Mao and Zhang Yun were her confidants, the keeping of the outer gates.The heir was at Jiangxia, and he came to make filial inquiries as soon as his father's condition became serious.But Cai Mao refused him admittance and said, ""Your father sent you to guard Jiangxia. Such a very responsible post should by no means have been quitted without orders. Suppose it was attacked, what might not happen? If your father sees you, he will be very angry, and it will make him worse. That would be most undutiful, and you should return to your command at once."""
劉琦立於門外，大哭一場，上馬仍回江夏。劉表病勢危篤，望劉琦不來；至八月戊申日，大叫數聲而死。後人有詩歎劉表曰：,"Liu Qi stood out for some time, but admittance was denied him in spite of his tears. So he returned to his post. Meanwhile Liu Biao rapidly grew worse. He anxiously looked for his son, but Liu Qi came not. Suddenly Liu Biao uttered piercing shrieks and then passed away."
昔聞袁氏居河朔，又見劉君霸漢陽。總為牝晨致家累，可憐不久盡消亡。,"When the Yuans were lords of the north,And Liu Biao held the bank of the river,It seemed, so strong were they both,That they would endure forever.But the family affairs troubled their states,And, meddling, confusion made;It was mournful indeed to seeHow quickly the houses decayed."
劉表既死，蔡夫人與蔡瑁、張允，商議假寫遺囑，令次子劉琮為荊州之主，然後舉哀報喪。時劉琮年方十四歲，頗聰明，乃聚眾言曰：「吾父棄世，吾兄現在江夏，更有叔父玄德在新野。汝等立我為主，倘兄與叔父興兵問罪，如何解釋？」,"So Imperial Protector Liu Biao died. Then the widow and her partisans took counsel together and forged a testament conferring the lordship of Jingzhou on the second son Liu Zong before they published the news of the death.The wrongful heir was then fourteen years of age. But he was a cunning boy, so he assembled the officials and said, ""My father has passed away, and my elder brother is at Jiangxia. More than that, our uncle is at Xinye. You have made me lord, but if my brother and uncle come here with an army to punish me for usurping the lordship, what explanation can I offer?"""
眾官未及對，幕官李珪答曰：「公子之言甚善。今可急發哀書至江夏，請大公子為荊州之主；就命玄德一同理事。北可以敵曹操，南可以拒孫權，此萬全之策也。」蔡瑁叱曰：「汝何人，敢亂言以逆主公遺命！」李珪大罵曰：「汝內外朋謀，假稱遺命，廢長立幼，眼見荊襄九郡，送於蔡氏之手！故主有靈，必當殛汝！」,"At first no one replied.Then Adviser Li Gui rose and said, ""You speak well. Now hasten to send letters of mourning to your brother and ask him to come and take his inheritance. Also call upon Liu Bei to come and assist in the administration. Then shall we be safe against our enemies —-Cao Cao on the north and Sun Quan on the south. I consider this the most excellent plan.""But Cai Mao replied harshly, ""Who are you to speak thus wildly and oppose the testament of our late lord?""Li Gui began to abuse him, saying, ""You and your party have fabricated this testament, setting aside the rightful heir. Now the whole region is in the hands of the Cai family. If our dead lord knew your doings, he would slay you!"""
蔡瑁大怒，喝令左右推出斬之，李珪至死大罵不絕。於是蔡瑁遂立劉琮為主。蔡氏宗族，分領荊州之兵；命治中鄧義、別駕劉先守荊州。蔡夫人自與劉琮前赴襄陽駐紮，以防劉琦、劉備，就葬劉表之棺於襄陽城東漢陽之原，竟不訃告劉琦與玄德。,"Cai Mao ordered the lictors to take Li Gui away to execution. He was hurried out, but his tongue ceased not.So the younger son was placed in his father's seat, and the Cai clan shared among them the whole military authority of the region. The defense of Jingzhou was confided to Liu Xin and Deng Yi, while Lady Cai and her son took up their residence in Xiangyang so as to be out of the reach of the rightful heir and his uncle. They interred the remains of the late Imperial Protector on the east of Xiangyang, near the bank of the Han River. No notice of the death was sent to Liu Qi, the son, or to Liu Bei, his uncle."
劉琮至襄陽，方纔歇馬，忽報曹操引大軍逕望襄陽而來。琮大驚，遂請蒯越，蔡瑁，等商議。東曹掾傅巽進言曰：「不特曹操兵來為可憂；今大公子在江夏，玄德在新野，我皆未往報喪，若彼興兵問罪，荊、襄危矣。巽有一計，可使荊、襄之民，安如泰山，又可保全主公名爵。」琮曰：「計將安出？」巽曰：「不如將荊、襄九郡，獻與曹操。操必重待主公也。」,"Liu Zong arrived at Xiangyang, but, before he had had time to recover from the fatigue of the journey, the startling news of the approach of Cao Cao's great army came in.He summoned Kuai Yue and Cai Mao and others to ask counsel.One of the secretaries, Fu Xuan, offered his advice, saying, ""Not only are we threatened by a great army from the north, but the elder son, who is the real heir, at Jiangxia, and his uncle at Xinye, are to be reckoned with. These two have not been notified of the death, and they will resent that. We shall be in sad case if they also march against us. But if you will adopt my suggestion, then our people will be as steady as Taishan Mountains and our young lord's position and rank will be assured.""""What is your plan?"" asked the young lord.""To offer the whole region to Cao Cao, who will treat our young master most liberally."""
琮叱曰：「是何言也！孤受先君之基業，坐尚未穩，豈可便棄之他人？」蒯越曰：「傅公悌之言是也。夫逆順有大體，強弱有定勢。今曹操南征北討，以朝廷為名，主公拒之，其名不順。且主公新立，外患未寧，內憂將作。荊、襄之民，聞曹兵至，未戰而膽先寒，安能與之敵哉？」琮曰：「諸公之言，非我不從；但以先君之業，一旦棄與他人，恐貽笑於天下耳。」,"""What advice!"" said Liu Zong angrily. ""Am I to yield my heritage to another before I have even fairly succeeded to it?""""The advice is good,"" said Kuai Yue. ""Opportunism is a policy, and possibilities need consideration. In the name of government, Cao Cao is fighting against his neighbors. If our lord opposes him, he will be termed contumacious. Beside, any misfortune on our borders before our young lord is well established will react upon the internal administration, and our people will be panic-stricken at the mere news of the approach of a hostile army. How could we then offer any resistance?""Liu Zong replied, ""It is not that I disagree with you, but I should be a laughing stock to the whole world were I to abandon my heritage without an effort."""
言未已，一人昂然而進曰：「傅公悌、蒯異度之言甚善，何不從之？」眾視之，乃山陽高平人，姓王，名粲，字仲宣。粲容貌廋弱，身材短小；幼時往見中郎蔡邕。時邕高朋滿座，聞粲至，倒履迎之。賓客皆驚曰：「蔡中郎何獨敬此小子耶？」邕曰：「此子有異才，吾不如也。」粲博聞強記，人皆不及；嘗觀道旁碑文一過，便能記誦；觀人奕棋，棋局亂，粲復為擺出，不差一子。又善算術。其文詞妙絕一時。年十七，辟為黃門侍郎，不就。後因避亂至荊襄，劉表以為上賓。,"He was interrupted by a speaker who said, ""If their advice is good, why not follow it?""They turned toward the speaker who was a certain Wang Can of Shanyang, a lean, cadaverous individual much below the middle height of a man.However, his talents did not conform to his physical appearance. When he was yet a youth, he went to visit Minister Cai Yong, then a vice-chairman of the Secretariat; and although many guests of exalted rank were present, the host hastened to welcome the newcomer with the greatest deference. The others were astonished and asked why he was so respectful to a mere youth.""He is a young man with the highest gifts,"" said Cai Yong.Wang Can was widely read and had a most retentive memory, better than any of his contemporaries. If he glanced at a roadside monument as he passed, he remembered every word of the inscription. If he saw people playing chess and the board was suddenly overthrown, he could replace every pip in its proper place. He was a good mathematician and his poems were exquisite. At seventeen he was appointed a court official but did not take up the appointment. When the disturbance in the empire grew serious, he sought refuge in Jingzhou, where he was received with great honor as guest of the Imperial Protector."
當日謂劉琮曰：「將軍自料比曹公何如？」琮曰：「不如也。」粲曰：「曹公兵強將勇，足智多謀。擒呂布於下邳，摧袁紹於官渡，逐劉備於隴右，破烏桓於白狼：梟除蕩定者，不可勝計。今以大軍南下荊襄，勢難抵敵。傅、蒯二君之謀，乃長策也。將軍不可遲疑，致生後悔。」琮曰：「先生見教極是。但須稟告母親知道。」只見蔡夫人從屏後轉出，謂琮曰：「既是仲宣、公悌、異度三人所見相同，何必告我？」,"What he said was this, ""General, how do you compare with Cao Cao?""""Inferior,"" replied Liu Zong.Wang Can continued, ""Cao Cao has many soldiers and bold leaders. He is able and resourceful. He took Lu Bu at Xiapi and broke the power of Yuan Shao at Guandu. He pursued Liu Bei into Longyou and destroyed Mao Dun at White Wolf Hills. The destruction of such firmly established men shows his invincible character. Now he is on the way here, and it will be very difficult to withstand him. The plan proposed is the best you can expect, and you should not delay and hesitate till it is too late for ought but regret.""""Worthy Sir, you indeed speak to the point. I must inform my mother,"" said the young ruler.But just then they saw his mother appear from behind a screen. She had been listening to all that was said.""Why refer to me when three such gentlemen coincide in their opinions?"" said Lady Cai."
於是劉琮意決，便寫降書，令宋忠潛地往曹操軍前投獻。宋忠領命，直至宛城，接著曹操，獻上降書。操大喜，重賞宋忠，分付教劉琮出城迎接，便著他永為荊州之主。宋忠拜辭曹操，取路回荊襄。將欲渡江，忽見一枝人馬到來。視之，乃關雲長也。宋忠迴避不及，被雲長喚住，細問荊州之事。忠初時隱諱；後被雲長盤問不過，只得將前後事情，一一實告。雲長大驚，隨捉宋忠至新野見玄德，備言其事。,"So Liu Zong decided, and the letter of surrender was composed and entrusted to one Song Zhong to convey secretly to Cao Cao. Song Zhong went straight to Wancheng and presented the letter. It was received with joy, and the bearer well rewarded.The submission was accepted, and Cao Cao said, ""Tell Liu Zong to go out to meet me in the open country, and he will be in perpetual tenure of his land.""Song Zhong left the city and took the homeward way. He had nearly reached the ferry when he fell in with a party of horse. On a closer look he saw the leader was Guan Yu. The messenger tried to escape observation, but was presently captured and taken to the leader to be questioned. At first he prevaricated but on being closely questioned told the whole story. Then he was carried off to Xinye and made to retell his story to Liu Bei."
玄德聞之大哭。張飛曰：「事已如此，可先斬宋忠，隨起兵渡江，奪了襄陽，殺了蔡氏、劉琮，然後與曹操交戰。」玄德曰：「你且緘口，我自有斟酌。」乃叱宋忠曰：「你知眾人作事，何不早來報我？今雖斬汝，無益於事，可速去。」忠拜謝，抱頭鼠竄而去。,"Liu Bei who heard it with lamentations. Zhang Fei said, ""This being so, I propose that we put this fellow to death, then cross the river, attack Xiangyang, and make an end of the Cai tribe and Liu Zong as well. Then we can attack Cao Cao.""But Liu Bei replied, ""Hold on. I have something more to say.""Then turning to the prisoner, Liu Bei shouted, ""When they did all this, why did you not come to tell me? As things are now, there is nothing to be gained by killing you. You may go.""Song Zhong stammered his thanks, threw his arms over his head, and ran away."
玄德正憂悶間，忽報公子劉琦差伊籍到來。玄德感伊籍昔日相救之恩，降階迎之，再三稱謝。籍曰：「大公子在江夏，聞荊州已故，蔡夫人與蔡瑁等商議，不來報喪，竟立劉琮為主。公子差人往襄陽探聽，回說是實；恐使君不知，特差某齎哀書呈報，並求使君盡起麾下精兵，同往襄陽問罪。」,"Liu Bei was very sad.Presently Yi Ji from Jiangxia was announced. Liu Bei was very fond of this man and went down the steps to welcome him.Then said Yi Ji, ""The heir has heard that his father is dead, but his stepmother and her family are keeping back the news so that they may set up Liu Zong. He knows the news is true, as he sent a special messenger to find out. He thinks you, O Prince, may not know and has sent me to inform you, and his letter begs you to lead all the troops you can to Xiangyang to help him assert his claims."""
玄德看書畢，謂伊籍曰：「機伯只知劉琮僭立，更不知劉琮已將荊襄九郡，獻與曹操矣！」籍大驚曰：「使君何從知之？」玄德具言拿獲宋忠之事。籍曰：「若如此，使君不如以弔喪為名，前赴襄陽，誘劉琮出迎，就便擒下，誅其黨類，則荊州屬使君矣。」,"Liu Bei opened and read the letter.Then he said, ""Yes. You know that the younger son has usurped the lordship, but you have not heard that he has already sent to offer Jingzhou to Cao Cao.""This news shocked Yi Ji, who asked, ""How know you this?""Liu Bei told of the capture of Song Zhong.Yi Ji said, ""You can go to Xiangyang as if to attend the mourning ceremonies and so draw Liu Zong into coming out of the city to welcome you. Then you can seize him, slay his party, and take the region."""
孔明曰：「機伯之言是也，主公可從之。」玄德垂淚曰：「吾兄臨危託孤於我，今若執其子而奪其地，異日死於九泉之下，何面目復見吾兄乎？」孔明曰：「如不行此事，今曹兵已至宛城，何以拒敵？」玄德曰：「不如走樊城以避之。」,"""Your advice is good,"" said Zhuge Liang, ""and my lord ought to take it.""Liu Bei wept, saying, ""In his last interview, my brother confided his son and heir to my care. If I lay hands upon another son and seize upon the inheritance, how shall I be able to look my brother in the face when I meet him by and by beyond the grave?""""If you do not act in this way now, how will you repel Cao Cao, who has already reached Wancheng?"" said Zhuge Liang.""Our best plan is to take refuge in Fancheng,"" replied Liu Bei."
