chinese,english
卻說曹操於金光處，掘出一銅雀，問荀攸曰：「此何兆也？」攸曰：「昔舜母夢玉雀入懷而生舜。今得銅雀，亦吉祥之兆也。」操大喜，遂命作高臺以慶之。乃即日破土斷木，燒瓦磨磚，築銅雀臺於漳河上之上。約計一年而工畢。少子曹植進曰：「若建層臺，必立三座：中間高者，名為銅雀；左邊一座，名為玉龍；右邊一座，名為金鳳。更作兩條飛橋，橫空而上，乃為壯觀。」操曰：「吾兒所言甚善。他日臺成，足可娛吾老矣！」原來曹操有五子，惟植性敏慧，善文章，曹操平日最愛之。,"The diggers at the spot whence the golden light proceeded presently unearthed a bronze bird. Looking at it, Cao Cao turned to his companion, saying, ""What is the portent?""""You will remember that the mother of the praiseworthy King Shun dreamed of a jade bird before his birth, so certainly it is a felicitous omen,"" said Xun You.Cao Cao was very pleased, and he ordered forthwith the building of a lofty tower to celebrate the find, and they began to dig foundations and cut timber, to burn tiles and to smooth bricks for the Bronze Bird Tower on the banks of the River Zhang. Cao Cao set a year for the building.His younger son, Cao Zhi, said, ""If you build a terraced tower, you should add two others, one on each side. The center tower as the tallest should be called the Bronze Bird Tower. The side towers named Jade Dragon Tower and Golden Phoenix Tower. Then connect these by flying bridges and the effect will be noble.""""My son, your words are very good; and by and bye when the building is complete, I can solace my old age therein.""Cao Cao had five sons, but this one Cao Zhi was the most clever and his essays were particularly elegant. His father was very fond of him."
於是留曹植與曹丕在鄴郡造臺，使張燕守北寨。操將所得袁紹之兵，共五六十萬，班師回許都，大封功臣；又表贈郭嘉為貞侯，養其子奕於府中。復聚眾謀士商議，欲南征劉表。荀彧曰：「大軍方北征而回，未可復動。且待半年，養精蓄銳，劉表、孫權，可一鼓而下也。」操從之，遂分兵屯田，以候調用。,"Seeing that the young man took an interest in the building, Cao Cao left him with his elder brother Cao Pi at Yejun to superintend the work, while he led a half-a-million army that had recently been captured from the Yuans back to Capital Xuchang. When he arrived, he distributed rewards liberally and memorialized the Throne obtaining the title of the Pure Lord for the late Guo Jia. And he took Guo Jia's son, Guo Ye, to be brought up in his own family.Next Cao Cao began to consider the reduction of Liu Biao's power.Xun You said, ""The Grand Army has only just returned from the north and needs rest. Wait half a year that the soldiers may recover from the fatigue of the campaign, and both Liu Biao and Sun Quan will fall at the first roll of the drums.""Presently Cao Cao approved of this plan. To enrich his troops, he assigned certain lands to them to till while they rested."
卻說玄德自到荊州，劉表待之甚厚。一日，正相聚飲酒，忽報降將張武、陳孫在江夏掠人民，共謀造反。表驚曰：「二賊又反，為禍不小！」玄德曰：「不須兄長憂慮，備請往討之。」表大喜，即點三萬軍，與玄德前去。玄德領命即行，不一日，來到江夏。張武、陳孫引兵來迎。玄德與關、張、趙雲出馬在門旗下。望見張武所騎之馬，極其雄駿。玄德曰：「此必千里馬也。」,"In Jingzhou, Liu Biao had been very generous to Liu Bei ever since he had come as a fugitive seeking shelter. One day at a banquet there came news that two generals, Zhang Wu and Chen Sun, who had tendered their submission, had suddenly begun plundering the people in Jiangxia. They evidently meant rebellion.""If they really rebel, it will cause a lot of trouble,"" said Liu Biao, rather dismayed.""Do not let that trouble you. I will go and settle it,"" said Liu Bei.Pleased with this proposal, Liu Biao told off thirty thousand troops and placed them under his friend, and the army marched as soon as the orders were issued. In a short time it reached the scene, and the two malcontents came out to fight. Liu Bei, Guan Yu, Zhang Fei, and Zhao Zilong took their stand beneath the great banner and looked over at the enemy.Zhang Wu was riding a handsome prancing horse, and Liu Bei said, ""He certainly has a fine steed."""
言未畢，趙雲挺鎗出，徑衝彼陣。張武縱馬來迎，不三合，被趙雲一鎗刺落馬下，隨手扯住轡頭，牽馬回陣。陳孫見了，隨趕來奪。張飛大喝一聲，挺矛直出，將陳孫刺死。眾皆潰散。玄德招安餘黨，平復江夏諸縣，班師而回。表出郭迎接入城，設宴慶功。酒至半酣，表曰：「吾弟如此雄才，荊州有倚賴也。但憂南越不時來寇；張魯、孫權皆足為慮。」玄德曰：「弟有三將，足可委用：使張飛巡南越之境；雲長拒固子城，以鎮張魯；趙雲拒三江，以當孫權；何足慮哉？」,"As he spoke, Zhao Zilong galloped out with his spear set and dashed toward the enemy. Zhang Wu came out to meet him, but the combat was very brief for Zhang Wu was soon killed by a spear thrust. Thereupon Zhao Zilong laid a hand upon the bridle of the fallen man's horse to lead it back to his own side. The slain rebel's companion Chen Sun at once rode after Zhao Zilong, whereupon Zhang Fei uttered a loud shout and rode out to meet him. With one thrust Zhang Fei slew the rebel. Their followers now scattered, and Liu Bei speedily restored order in Jiangxia and returned to Jingzhou City.Liu Biao, grateful for this service, rode out to the boundary to welcome the victors. They reentered the city and grand banquets were instituted, at which they emptied great goblets in congratulations over the victory.At one of these banquets the Imperial Protector said, ""With such heroism as my brother has shown, Jingzhou has one upon whom to rely. But a source of sorrow is the borders with the lands of Yue, Wu, and Shu, from which a raid may come at any time. Zhang Lu of Shu and Sun Quan of Yue and Wu are to be feared.""""But I have three bold generals,"" said Liu Bei, ""quite equal to any task you can set them. Send Zhang Fei to keep ward on the southern border of Yue, Guan Yu to guard the city of Guzi against Zhang Lu in the west, and Zhao Zilong holding the Three Gorges will protect you from Sun Quan. Why need you grieve?"""
表喜，欲從其言。蔡瑁告其姊蔡夫人曰：「劉備遣三將居外，而自居荊州，久必為患。」蔡夫人乃夜對劉表曰：「我聞荊州人多與劉備往來，不可不防之。今容其居住城中，無益，不若遣使他往。」表曰：「玄德仁人也。」蔡氏曰：「只恐他人不似汝心。」,"The scheme appealed strongly to the Imperial Protector, but Cai Mao did not approve.So he spoke to his sister, Liu Biao's wife, saying, ""Liu Bei is putting his troops in such commanding positions all round the region. That is the danger.""Lady Cai, thus influenced by her brother, undertook to remonstrate, and that night began by saying to Liu Biao, ""Some in the Jingzhou army seem to have a great liking for Liu Bei. They are always coming and going. You ought to take precautions. I do not think you should let Liu Bei stay in the city. Why not send him on some mission?""""Liu Bei is a good man,"" replied the Imperial Protector.""I think others differ from you,"" said the lady."
表沈吟不答。次日出城，見玄德所乘之馬極駿，問之，知是張武之馬，表讚不已。玄德遂將此馬送與劉表。表大喜，騎回城中。蒯越見而問之。表曰：「此玄德所送也。」越曰：「昔先兄蒯良，最善相馬；越亦頗曉。此馬眼下有淚槽，額邊生白點，名為的盧，騎則妨主。張武為此馬而亡。主公不可乘之。」,"Liu Biao said nothing but muttered to himself. Soon after he went out of the city to see Liu Bei and noticed he was riding a very handsome horse. They told him it was a prize taken from the recently conquered rebels; and as he praised it very warmly, Liu Bei presented it to him. Liu Biao was delighted and rode it back to the city. Kuai Yue saw it and asked where it had come from. The Imperial Protector told him it was a gift from Liu Bei.Kuai Yue said, ""My passed-away brother, Kuai Liang, knew horses very well, and I am not a bad judge. This horse has tear-tracks running down from its eyes and a white blaze on its forehead. It is called a Dilu horse, and it is a danger to his master. That is why Zhang Wu was killed. I advise you not to ride it."""
表聽其言。次日請玄德飲宴，因言曰：「昨承惠良馬，深感厚意。但賢弟不時征進，可以用之。敬當送還。」玄德起謝。表又曰：「賢弟久居此間，恐廢武事。襄陽屬邑新野縣，頗有錢糧。弟可引本部軍馬於本縣屯紮，何如？」,"Liu Biao began to think.Soon after he asked Liu Bei to a banquet and in the course of it said, ""You kindly presented me with a horse lately, and I am most grateful. But you may need it on some of your expeditions and, if you do not mind, I would like to return it.""Liu Bei rose and thanked him.The Imperial Protector continued, ""You have been here a long time, and I fear I am spoiling your career as a warrior. Now Xinye in Xiangyang is no poverty-stricken town. How would you like to garrison it with your own troops?"""
玄德領諾。次日，謝別劉表，引本部軍馬逕往新野。方出城門，只見一人在馬前長揖曰：「公所騎馬，不可乘也。」玄德視之，乃荊州幕賓伊藉，字機伯，山陽人也。玄德忙下馬問之。籍曰：「昨聞蒯異度對劉荊州云：『此馬名的盧，乘則妨主。』因此還公，公豈可復乘之？」玄德曰：「深感先生見愛。但凡人死生有命，豈馬所能妨哉！」籍深服其高見，自此常與玄德往來。,"Liu Bei naturally took the offer as a command and set out as soon as he could, taking leave of the Imperial Protector the next day. And so he took up his quarters in Xinye.When he left Jingzhou City, he noticed in the gate a person making him emphatic salutations, and the man presently said, ""You should not ride that horse.""Liu Bei looked at the man and recognized in the speaker one of the secretaries of Liu Biao named Yi Ji, a native of Shanyang. So Liu Bei hastily dismounted and asked why.Yi Ji replied, ""Yesterday I heard that Kuai Yue told the Imperial Protector that that horse was a Dilu horse and brought disaster to its owner. That is why it was returned to you. How can you mount it again?""""I am deeply touched by your affection,"" replied Liu Bei, ""but a person's life is governed by fate, and what a horse can interfere with that?""Yi Ji admitted his superior view, and thereafter he kept in touch with Liu Bei wherever he went."
玄德自到新野，軍民皆喜，政治一新。建安十二年春，甘夫人生劉禪。是夜有白鶴一隻，飛來縣衙屋上，高鳴四十餘聲，望西飛去。臨分娩時，異香滿室。甘夫人嘗夜夢仰吞北斗，故乳名阿斗。,"The arrival of Liu Bei in Xinye was a matter of rejoicing to all the inhabitants, and the whole administration was reformed. In the spring of the twelfth year of Rebuilt Tranquillity (AD 207), Liu Bei's wife, Lady Gan, gave birth to a son who was named Liu Shan. The night of his birth a crane settled on the roof of the house, screeched some forty times and then flew away westward.Just at the time of birth a miraculous incense filled the chamber. Lady Gan one night had dreamed that she was looking up at the sky, and the constellation of the Great Bear had fallen down her throat. And she conceived soon after."
此時曹操正統兵北征。玄德乃往荊州，說劉表曰：「今曹操北征，許昌空虛，若以荊、襄之眾，乘間襲之，大事可就也。」表曰：「吾坐據荊州足矣，豈可別圖？」玄德默然。表邀入後堂飲酒。酒至半酣，表忽然長歎。玄德曰：「兄長何故長歎？」表曰：「吾有心事，未易明言。」玄德再欲問時，蔡夫人出立屏後。劉表乃垂頭不語。,"While Cao Cao was absent from the capital on his northern expedition, Liu Bei went to Liu Biao and said to him, ""Why do you not take this opportunity to march against the capital? An empire might follow from that.""""I am well placed here,"" was the reply. ""Why should I attempt other things?""Liu Bei said no more. Then the Imperial Protector invited him into the private apartments to drink. While they were so engaged, Liu Biao suddenly began to sigh despondently.""O brother, why do you sigh thus?"" asked Liu Bei.""I have a secret sorrow that is difficult to speak about,"" said Liu Biao.Liu Bei was on the point of asking what it was when Lady Cai came and stood behind the screen, whereat Liu Biao hung his head and became silent."
須臾席散，玄德自歸新野。至是年冬，聞曹操自柳城回，玄德甚歎表之不用其言。忽一日，劉表遣使至，請玄德赴荊州相會。玄德隨使而往，劉表接著，敘禮畢，請入後堂飲宴；因謂玄德曰：「近聞曹操提兵回許都，勢日強盛，必有吞併荊、襄之心，昔日悔不聽賢弟之言，失此好機會！」玄德曰：「今天下分裂，干戈日起，機會豈有盡乎？若能應之於後，未足為恨也。」表曰：「吾弟之言甚當。」相與對飲。,"Before long host and guest bade each other farewell, and Liu Bei went back to his own place at Xinye. That winter they heard that Cao Cao had returned from Liucheng, and Liu Bei sighed when he reflected that his friend had paid no heed to his advice.Unexpectedly a messenger came from the capital city with a request that Liu Bei would go thither to consult with the Imperial Protector. So he started at once with the messenger to Jingzhou City. He was received very kindly, and when the salutations were over, the two men went into the private quarters at the rear to dine.Presently Liu Biao said, ""Cao Cao has returned, and he is stronger than ever. I am afraid he means to absorb this region. I am sorry I did not follow your advice for I have missed an opportunity.""""In this period of disruption, with strife on every side, one cannot pretend that there will be no more opportunities. If you only take what that offers, there will be nothing to regret.""""What you say, brother, is quite to the point,"" replied Liu Biao.They drank on for a time."
酒酣，表忽潸然下淚。玄德問其故。表曰：「吾有心事，前者欲訴與賢弟，未得其便。」玄德曰：「兄長有何難決之事？倘有用弟之處，弟雖死不辭。」表曰：「前妻陳氏所生長子琦，為人雖賢，而柔懦不足立大事；後妻蔡氏所生少子琮，頗聰明。吾欲廢長立幼，恐礙於禮法；欲立長子，爭奈蔡氏族中，皆掌軍務，後必生亂：因此委決不下。」玄德曰：「自古廢長立幼，取亂之道。若憂蔡氏權重，可徐徐削之，不可溺愛而立少子也。」表默然。原來蔡夫人素疑玄德，凡遇玄德與表敘論，必來竊聽；是時正在屏風後，聞玄德此言，心甚恨之。,"Presently Liu Bei noticed that his host was weeping, and when he asked the cause of these tears, Liu Biao replied, ""It is that secret sorrow I spoke of to you before. I wished to tell you, but there was no opportunity that day.""""O brother, what difficulty have you, and can I assist you? I am entirely at your service.""""My first wife, of the Chen family, bore me a son Liu Qi, my eldest. He grew up virtuous but weakly and unfitted to succeed me in my office. Later I took a wife of the Cai family, who bore me a son named Liu Zong, fairly intelligent. If I pass over the elder in favor of the younger, there is the breach of the rule of primogeniture. But if I follow law and custom, there are the intrigues of the Cai family and clan to be reckoned with. Further, the army is in the hollow of their hands. There will be trouble, and I cannot decide what to do.""Liu Bei said, ""All experience proves that to set aside the elder for the younger is to take the way of confusion. If you fear the power of the Cai faction, then gradually reduce its power and influence, but do not let doting affection lead you into making the younger your heir.""Liu Biao pondered silent. But Lady Cai had had a suspicion why her lord had summoned Liu Bei and what was the subject of discussion, so she had determined to listen secretly. She was behind the screen when the matter was talked over, and she conceived deep resentment against Liu Bei for what he had said."
玄德自知語失，遂起身如廁。因見己身髀肉復生，亦不覺潸然流淚。少頃復入席。表見玄德有淚容，怪問之。玄德長歎曰：「備往常身不離鞍，髀肉皆散；今久不騎，髀裡肉生。日月蹉跎，老將至矣，而功業不建，是以悲耳！」表曰：「吾聞賢弟在許昌，與曹操青梅煮酒，共論英雄；賢弟盡舉當世名士，操皆不許，而獨曰：『天下英雄，惟使君與操耳。』以曹操之權力，猶不敢居吾弟之先，何慮功業不建乎？」玄德乘著酒興，失口答曰：「備若有基本，天下碌碌之輩，誠不足慮也。」表聞言默然。玄德自知失語，託醉而起，歸館舍安歇，後人有詩讚玄德曰：,"On his side, Liu Bei felt that his advice had fallen upon a forbidden subject, and he arose and walked across the room. As he did so he noticed that he was getting heavy and stiff, and a furtive tear stole down his cheek as he thought of the past. When he returned and sat down, his host noticed the traces of weeping and asked the cause of his sorrow.""In the past I was always in the saddle, and I was slender and lithe. Now it is so long since I rode that I am getting stout, and the days and months are slipping by —-wasted. I shall have old age on me in no time, and I have accomplished nothing. So I am sad.""""I have heard a story that when you were at Xuchang at the season of green plums, you and Cao Cao were discussing heroes. You mentioned this name and that to him as humans of parts, and he rejected everyone of them. Finally he said that you and he were the only two persons of real worth in the whole empire. If he with all his power and authority did not dare to place himself in front of you, I do not think you need grieve about having accomplished nothing.""At this flattering speech Liu Bei, as wine was getting the better of him and in a half maudlin manner, replied, ""If I only had a starting point, then I would not be afraid of anyone in a world full of fools.""His host said no more and the guest, feeling that he had slipped up in speech, rose as if drunk, took leave, and staggered out saying he must return to his lodging to recover.The episode has been celebrated in a poem:"
曹公屈指從頭數，天下英雄獨使君。髀肉復生猶感歎，爭教寰宇不三分？,"When with crooking fingers counting,Cao Cao reckoned up the forcefulHumans of real determination,Only two he found; and one wasLiu Bei. But by inactionHe had grown both fat and slothful;Yet the months and years in passingFretted him with nought accomplished."
卻說劉表聞玄德語，口雖不言，心懷不樂，別了玄德，退入內宅。蔡夫人曰：「適間我於屏後聽得劉備之言，甚輕覷人，足見其有吞併荊州之意。今若不除，必為後患。」表不答，但搖頭而已。蔡氏乃密召蔡瑁入，商議此事。瑁曰：「請先就館舍殺之，然後告知主公。」蔡氏然其言。瑁出，便連夜點軍。,"Though Liu Biao kept silence when he heard the words of Liu Bei, yet he felt the more uneasy. After the departure of his guest, he retired into the inner quarters where he met his wife.Lady Cai said, ""I happened to be behind the screen just now and so heard the words of Liu Bei. They betray scant regard for other people and mean that he would take your territory if he could. If you do not remove him, it will go ill with you.""Her husband made no reply, but only shook his head.Then Lady Cai took counsel with her kinsman Cai Mao, who said, ""Let me go to the guest-house and slay him forthwith, and we can report what we have done.""His sister consented and he went out, and that night told off a party of soldiers to do the foul deed."
卻說玄德在館舍中秉燭而坐，三更以後，方欲就寢。忽一人叩門而入，視之乃伊籍也。原來伊籍探知蔡瑁欲害玄德，特夤夜來報。當下伊籍將蔡瑁之謀，報知玄德，催促玄德速速起身。玄德曰：「未辭景升，如何便去？」籍曰：「公若辭，必遭蔡瑁之害矣。」,"Now Liu Bei sat in his lodging by the light of a single candle till about the third watch, when he prepared to retire to bed. He was startled by a knock at his door and in came Yi Ji, who had heard of the plot against his new master and had come in the darkness to warn him. He related the details of the plot and urged speedy departure.""I have not said farewell to my host. How can I go away?"" said Liu Bei.""If you go to bid him farewell, you will fall a victim to the Cai faction,"" said Yi Ji."
玄德乃謝別伊籍，急喚從者，一齊上馬。不待天明，星夜奔回新野。比及蔡瑁領軍到館舍時，玄德已去遠矣。瑁悔恨無及，乃寫詩一首於壁間，逕入見表曰：「劉備有反叛之意，題反詩於壁上，不辭而去矣。」表不信，親詣館舍觀之，果有詩四句。詩曰：,"So Liu Bei said a hasty good-bye to his friend, called up his escort, and they all mounted and rode away by the light of the stars toward Xinye. Soon after they had left the soldiers arrived at the guest-house, but their intended victim was already well on his way.Naturally the failure of the plot chagrined the treacherous Cai Mao, but he took the occasion to scribble some calumnious verses on one of the partitions.Then he went to see Liu Biao to whom he said, ""Liu Bei has treacherous intentions, as can be seen from some lines written on the wall. And his hurried departure is suspicious.""Liu Biao felt doubtful, but he went to the guest-house and there on the wall he read this poem:"
數年徒守困，空對舊山川。龍豈池中物，乘雷欲上天！,"Too long, far too long I have dreamed life away,Gazing at scenery day after day.A dragon can never be kept in a pond,He should ride on the thunder to heaven and beyond."
劉表見詩大怒，拔劍言曰：「誓殺此無義之徒！」行數步，猛省曰：「吾與玄德相處許多時，不曾見他作詩，此必外人離間之計也。」遂回步入館舍，用劍尖削去此詩，棄劍上馬。蔡瑁請曰：「軍士已點齊，可就往新野擒劉備。」表曰：「未可造次，容徐圖之。」,"Greatly angered by what he read, Liu Biao drew his sword and swore to slay the writer. But before he had gone many paces, his anger had already died down, and he said to himself, ""I have seen much of the man, but have never known him write verses. This is the handiwork of someone who wishes to sow discord between us.""So saying, he turned back and with the point of his sword scraped away the poem. Then, putting up his sword, he mounted and rode home.By and bye Cai Mao reminded him, saying, ""The soldiers are awaiting your orders to go to Xinye and arrest Liu Bei.""'There is no hurry,"" he replied."
蔡瑁見表遲疑不決，乃暗與蔡夫人商議，即日大會眾官於襄陽，就彼處謀之。次日，瑁稟表曰：「近年豐熟，合聚眾官於襄陽，以示撫慰之意。請主公一行。」表曰：「吾近日氣疾作，實不能行。可令二子為主待客。」瑁曰：「公子年幼，恐失於禮節。」表曰：「可往新野請玄德待客。」瑁暗喜正中其計，便差人請玄德赴襄陽。,"Cai Mao saw his brother-in-law's hesitation and again sought his sister.She said, ""Soon there is to be the great gathering at Xiangyang, and we can arrange something for that day.""Next day Cai Mao petitioned the Imperial Protector, saying, ""We have had several fruitful harvests recently. I pray you, Sir, attend the Full Harvest Festival at Xiangyang. It would be an encouragement to the people.""""I have been feeling my old trouble lately. I certainly cannot go,"" replied he, ""but my two sons can go to represent me and to receive the guests.""""They are full young,"" replied Cai Mao. ""They may make some mistakes.""""Then go to Xinye and request Liu Bei to receive the guests,"" said Liu Biao.Nothing could have pleased Cai Mao more, for this would bring Liu Bei within reach of his plot. Without loss of time he sent to Liu Bei requesting him to go to preside at the Festival."
