chinese,english
正商議間，探馬飛報曹兵已到博望了。玄德慌忙發付伊籍回江夏，整頓軍馬，一面與孔明商議拒敵之計。孔明曰：「主公且寬心，前番一把火，燒了夏侯惇大半人馬；今番曹軍又來，必教他中這條計。我等在新野住不得了，不如早到樊城去。」便差人四門張榜，曉諭居民：「無論老幼男女，願從者，即於今日皆跟我往樊城暫避，不可自誤。」差孫乾往河邊調撥船隻，救濟百姓；差糜竺護送各官家眷到樊城。一面聚諸將聽令，先教雲長引一千軍去白河上流頭埋伏：「各帶布袋，多裝沙土，遏住白河之水；至來日三更後，只聽下流頭人喊馬嘶，急取起布袋，放水淹之，卻順水殺將下來接應。」又喚張飛引一千軍去博陵渡口埋伏：「此處水勢最慢，曹軍被淹，必從此逃難，可便乘勢殺來接應。」又喚趙雲「引軍三千，分為四隊，自領一隊伏於東門外，其三隊分伏西、南、北三門，卻先於城內人家屋上，多藏硫黃燄硝引火之物。曹軍入城，必安歇民房。來日黃昏後，必有大風。但看風起，便令西、南、北三門伏軍盡將火箭射入城去。待城中火勢大作，卻於城外吶喊助威，只留東門放他出走，汝卻於東門外從後擊之。天明會合關、張二將，收軍回樊城。」再令糜芳、劉封二人，帶二千軍，一半紅旗，一半青旗，去新野城外三十里鵲尾坡前屯住：「一見曹軍到，紅旗軍走在左，青旗軍走在右。他心疑必不敢追，汝二人卻去分頭埋伏。只望城中火起，便可追殺敗兵，然後卻來白河上流頭接應。」,"Just about this time the spies came to say that Cao Cao's army had reached Bowang. So Yi Ji was sent off with instructions to take measures for the defense of Jiangxia, while Liu Bei and Zhuge Liang discussed plans for meeting the enemy.Zhuge Liang said, ""My lord should not worry. We have burned the army of Cao Cao at Bowang Slope, so we will see them fallen into another ruse in Xinye. This is no place to live in. We will move over to Fancheng.""Then notices were posted at all the gates that all the people, without any exception, were to follow their ruler at once to the new city to escape danger. Boats were prepared and the people sent away under the direction of Sun Qian. Mi Zhu saw to the safe conveyance of the families of the officials.Then the officers assembled for orders.Zhuge Liang gave directions, ""Guan Yu is to go to the upper of the White River with one thousand troops. His men are to carry bags to fill with sand and earth to dam the river till the enemy shall be heard, about the third watch next day. Then the waters are to be freed to drown one of the armies. He is then to march down river.""Zhang Fei is to go to the Boling Ferry, where the current is slow. After the waters of the White River have been let loose on Cao Cao's soldiers, they will try to get over the river at the ferry. They are to be attacked by Zhang Fei and his one thousand troops.""Zhao Zilong is to divide three thousand troops into four parties and take one to the east gate. The other three are for the other gates. The roofs of the houses within the city walls are piled with sulfur, saltpeter, and other combustibles. The intention is to set fire to the city when the army of the enemy has entered it for shelter. There will be a strong breeze next day in the evening which will fan the flames. When this wind begins to blow, fire arrows are to be shot into the city from all sides. When the flames are high, there is to be a great shouting outside to add to the general terror. The east gate is to be left free for escape, but the flying men are to be smitten after passing the gate.""Mi Fang and Liu Feng are to take command of two thousand troops, one half with red flags and the other half with blue. They are to go to Magpie Tail Slope, about ten miles from the city and camp. When they see Cao Cao's army coming along, the red flags are to move left and the blue right to confuse the enemy so that they shall be afraid to advance further. Then an ambush is to be laid to smite the enemy when the fire in Xinye starts. After that Mi Fang and Liu Feng are to go to the river to meet us.""After the battle, all generals shall gather at Fancheng."""
孔明分撥已定，乃與玄德登高瞭望，只候捷音。,"All the orders given, the various leaders went their way to take up their positions and await the burning of the city. Zhuge Liang and Liu Bei went away to an eminence whence they could watch what happened and where they would await the reports of victory."
卻說曹仁、曹洪引軍十萬為前隊，前面已有許褚引三千鐵甲軍開路，浩浩蕩蕩，殺奔新野來。是日午牌時分，來到鵲尾坡，望見坡前一簇人馬，盡打青紅旗號。許褚催軍向前，劉封、糜芳分為四隊，青、紅旗各歸左右。許褚勒馬，教：「且休進，前面必有伏兵，我兵只在此處住下。」許褚一騎馬飛報前隊曹仁。曹仁曰：「此是疑兵，必無埋伏。可速進兵。我當催軍繼至。」,"Cao Hong and Cao Ren, with their one hundred thousand troops, preceded by Xu Chu leading three thousand of mailed men, marched toward Xinye. They formed a mighty host and reached Magpie Tail Slope about noon. Looking ahead, they saw what seemed a goodly army with many blue and red flags. Xu Chu pressed forward. As he neared, the flags moved from side to side, and he hesitated.He began to think, ""It could be an ambush. It is unwise to advance.""Finally Xu Chu decided to go no farther and called a halt, and he rode back to the main body to see Cao Ren.""Those troops are only make-believe,"" said Cao Ren. ""Advance, there is no ambush. I will hasten up the supports."""
許褚復回坡前，提兵殺入。至林下追尋時，不見一人。時日已墜西，許褚方欲前進，只聽得山上大吹大擂。抬頭看時，只見山頂上一簇旗，旗叢中兩把傘蓋，左玄德，右孔明，二人對坐飲酒。許褚大怒，引軍尋路上山。山上擂木砲石打將下來，不能前進。又聞山後喊聲大震，欲尋路廝殺，天色已晚。,"So Xu Chu rode to his own command again and advanced. When he reached the wood where he had seen the flags, he saw no one at all. It was then late in the afternoon but he decided to move on. Then he heard from the hills the sound of musical instruments and, looking up, saw on the hill top two umbrellas surrounded by many banners. There sat Liu Bei and Zhuge Liang quietly drinking.Angry at their coolness, Xu Chu sought for a way up, but logs of wood and great stones were thrown down, and he was driven back. Further, from the rear of the hills came a confused roar. He could find no way to attack, and the sun began to set."
曹仁領兵到，教且奪新野城歇馬。軍士至城下時，只見四門大開。曹兵突入，並無阻當。城中亦不見一人，竟是一座空城了。,Then Cao Ren and Cao Hong arrived and ordered an attack on Xinye that he might have a place to rest in. They marched to the walls and found the gates wide open. They entered and found a deserted city. No one was visible.
曹洪曰：「此是勢孤計窮，故盡帶百姓逃竄去了。我軍權且在城安歇，來日平明進兵。」此時各軍走乏，都已饑餓，皆去尋房造飯。曹仁、曹洪，就在衙內安歇。初更已後，狂風大作。守門軍士飛報火起。曹仁曰：「此必軍士造飯不小心，遺漏之火，不可自驚。」,"""This shows they are done,"" said Cao Hong. ""They have all run away, people and all. We may as well occupy the city and rest our soldiers ready for tomorrow.""The soldiers were fatigued with marching and hungry as well, so they lost no time in scattering among the houses and setting about preparing food in the deserted kitchens. The leaders took up their quarters in the state residence to rest.After the first watch the wind began to blow. Soon after the gate guards reported that a fire had started.""The careless men have let sparks fly about,"" said Cao Ren."
說猶未了，接連幾次飛報，西、南、北三門皆火起。曹仁急令眾將上馬時，滿縣火起，上下通紅。是夜之火，更勝前日博望燒屯之火。後人有詩歎曰：,"He thought no more about it just then, but along came other reports of like nature, and soon he realized that fires breaking out in all quarters were not due to accident. So he gave orders to evacuate the city. Soon the whole city seemed on fire, and a red glow hung in the sky. The army was beset with fire fiercer than what Xiahou Dun had experienced at Bowang Slope."
奸雄曹操守中原，九月南征到漢川。風伯怒臨新野縣，祝融飛下燄摩天。,"Thrice wicked was Cao Cao, but he was bold;Though all in the capital he controlled,Yet with this he was not content,So southward his ravaging army went.But, the autumn wind aiding, the Spirit of FireWrought to his army destruction dire."
曹仁引眾將突煙冒火，尋路奔走，聞說東門無火，急急奔出東門。軍士自相踐踏，死者無數。曹仁等方纔脫得火厄，背後一聲喊起，趙雲引軍趕來混戰，敗軍各逃性命，誰肯回身廝殺。,"Officers and troops dashing through the smoke and fire in utter confusion sought some way of escape, and hearing that the east gate was free, they made for that quarter. Out they rushed pell-mell, many being trodden down and trampled to death. Those who got through took the road to the east.But presently there was a shouting behind them, and Zhao Zilong's company came up and attacked. Then Cao Cao's troops scattered, each fleeing for his life. No stand was made."
正奔走間，糜芳引一軍至。又衝殺一陣，曹仁大敗，奪路而走，劉封又引一軍截殺一陣。到四更時分，人困馬乏，軍士大半焦頭爛額。奔至白河邊，喜得河水不甚深，人馬都下河吃水。人相喧嚷，馬盡嘶鳴。,"A little later Mi Fang and Liu Feng came to take another toll. The fleeing Cao Ren then had very few followers, and those left him were scorched and burned.They directed their way to the White River, joyfully remembering that the river was shallow and fordable. And they went down into the stream and drank their fill, humans shouting and horses neighing."
卻說雲長在上流用布袋遏住河水。黃昏時分，望見新野火起，至四更，忽聽得下流頭人喊馬嘶，急令軍士一齊掣起布袋，水勢滔天，望下流衝去，曹軍人馬俱溺於水中，死者極多。曹仁引眾將望水勢慢處奪路而走。行到博陵渡口，只聽喊聲大起，一軍攔路，當先大將，乃張飛也，大叫：「曹賊快來納命！」曹軍大驚。正是：城內纔看紅燄吐，水邊又遇黑風來。未知曹仁性命如何，且看下文分解。,"Meantime Guan Yu, higher up its course, had dammed the river with sandbags so that its waters were collected in a lake. Toward evening he had seen the red glow of the burning city and began to look out for his signal. About the fourth watch, he heard down stream the sounds of soldiers and horse and at once ordered the breaking of the dam. The water rushed down in a torrent and overwhelmed the men just then in the bed of the river. Many were swept away and drowned. Those who escaped made their way to where the stream ran gently and got away.Presently Cao Ren and his troops reached the Boling Ferry. Here, where they thought there would be safety, they found the road barred.""You Cao Cao brigands!"" shouted Zhang Fei. ""Come and receive your fate!""Within the city the red flame leaps out;On the river bank burning anger is met.What happened will appear in later chapters."
