chinese,english
卻說玄德奔回新野，自知失言取禍，未對眾人言之。忽使者至，請赴襄陽。孫乾曰：「昨見主公匆匆而回，意甚不樂。愚意度之，在荊州必有事故。今忽請赴會，不可輕往。」玄德方將前項事訴與諸人。雲長曰：「兄自疑心語失。劉荊州並無嗔責之意。外人之言，未可輕信。襄陽離此不遠，若不去，則荊州反生疑矣。」玄德曰：「雲長之言是也。」張飛曰：「筵無好筵，會無好會，不如休去。」趙雲曰：「某將馬步軍三百人同往，可保主公無事。」玄德曰：「如此甚好。」,"It has been said that Liu Bei made the best of his way home to Xinye. He felt that he had offended by that slip in speech, but determined to keep silence about it and attempt no explanation. So he discussed it with nobody. Then came the message asking him to preside at the Festival, and he needed counsel.Sun Qian said, ""You have seemed worried and preoccupied lately, and I think something untoward happened at Jingzhou. You should consider well before you accept this invitation.""Thereupon Liu Bei told his confidants the whole story.Guan Yu said, ""You yourself think your speech offended the Imperial Protector, but he said nothing to show displeasure. You need pay no attention to the babble of outsiders like Yi Ji. Xiangyang is quite near and, if you do not go, Liu Biao will begin to suspect something really is wrong.""""You speak well,"" said Liu Bei."
遂與趙雲即日赴襄陽。蔡瑁出郭迎接，意甚謙謹。隨後劉琦、劉琮二子，引一班文武官僚出迎。玄德見二公子俱在，並不疑忌。是日請玄德於館舍暫歇。趙雲引三百軍圍繞保護。雲披甲挂劍，行坐不離左右。劉琦告玄德曰：「父親氣疾作，不能行動，特請叔父待客，撫勸各處守牧之官。」玄德曰：「吾本不敢當此，既有兄命，不敢不從。」,"Said Zhang Fei, ""Banquets are no good; gatherings are no better. It is best not to go.""""Let me take three hundred horse and foot as escort: There will be no trouble then,"" said Zhao Zilong.""That is the best course,"" said Liu Bei.They soon set out for the gathering place, and Cai Mao met them at the boundary and was most affable and courteous. Soon arrived the Imperial Protector's sons at the head of a great company of officers, civil and military. Their appearance put Liu Bei more at ease. He was conducted to the guest-house, and Zhao Zilong posted his men so as to guard it completely, while he himself, armed, remained close to his chief.Liu Qi said to Liu Bei, ""My father is feeling unwell and could not come, wherefore he begs you, Uncle Liu Bei, to preside at the various ceremonies and give encouragement to the officers who administer the region.""""Really I am unfit for such responsibilities,"" said Liu Bei. ""But my brother's command must be obeyed."""
次日，人報九郡四十二州官員，俱已到齊。蔡瑁預請蒯越計議曰：「劉備世之梟雄，久留於此，後必為害；可就今日除之。」越曰：「恐失士民之望。」瑁曰：「吾已密領劉荊州言語在此。」越曰：「既如此，可預作準備。」瑁曰：「東門峴山大路，已使吾弟蔡和引軍守把；南門外己使蔡中守把；北門外已使蔡勳守把。止有西門不必守把──前有檀溪阻隔，雖數萬之眾，不易過也。」越曰：「吾見趙雲行坐不離玄德，恐難下手。」瑁曰：「吾伏五百軍在城內準備。」越曰：「可使文聘、王威二人另設一席於外廳，以侍武將。先請住趙雲，然後可行事。」,"Next day it was reported that the officials from forty-two counties of nine territories of Jingzhou had all arrived.Then Cai Mao said to Kuai Yue, ""This Liu Bei is the villain of the age and if left alive will certainly work harm to us. He must be got rid of now.""""I fear you would forfeit everybody's favor if you harmed him,"" replied Kuai Yue.""I have already secretly spoken in these terms to the Imperial Protector,"" said Cai Mao, ""and I have his word here.""""So it may be regarded as settled. Then we can prepare.""Cai Mao added, ""My brothers are ready. Cai He is posted on the road to the Xian Hills from the east gate; Cai Zhong and Cai Xun are on the north and south roads. No guard is needed on the west as the Tan Torrent is quite safeguard enough. Even with legions, Liu Bei could not get over that.""Kuai Yue replied, ""I notice that Zhao Zilong never leaves him. I feel sure he expects some attack.""""I have placed five hundred men in ambush in the city.""""We will tell Wen Ping and Wang Wei to invite all the military officers to a banquet at one of the pavilions outside the city, and Zhao Zilong will be among them. Then will be our opportunity."""
瑁從其言。當日殺牛宰馬，大張筵席。玄德乘的盧馬至州衙，命牽入後園擐繫。眾官皆至堂中。玄德主席，二公子兩邊分坐，其餘各依次而坐。趙雲帶劍立於玄德之側。文聘、王威入請趙雲赴席。雲推辭不去。玄德令雲就席，雲勉強應命而出。蔡瑁在外收拾得鐵桶相似，將玄德帶來三百軍，都遣歸館舍，只待半酣，號起下手。,"Cai Mao thought this a good device for getting Zhao Zilong out of the way.Now oxen and horses had been slaughtered and a grand banquet prepared. Liu Bei rode to the residence on the horse of ill omen, and when he arrived, the steed was led into the back part of the enclosure and tethered there. Soon the guests arrived, and Liu Bei took his place as master of the feast, with the two sons of the Imperial Protector, one on each side. The guests were all arranged in order of rank. Zhao Zilong stood near his lord sword in hand as a faithful henchman should do.Then Wen Ping and Wang Wei came to invite Zhao Zilong to the banquet they had prepared for the military officers. But he declined. However, Liu Bei told him to go, and, after some demur, he went. Then Cai Mao perfected his final arrangements, placing his people surrounding the place like a ring of iron. The three hundred guards that formed the escort of Liu Bei were sent away to the guest-house.All were ready and awaiting the signal."
酒至三巡，伊籍起把盞，至玄德前，以目視玄德，低聲謂曰：「請更衣。」玄德會意，即起如廁。伊籍把盞畢，疾入後園，接著玄德，附耳報曰：「蔡瑁設計害君，城外東、南、北三處，皆有軍馬守把。惟西門可走，公宜急逃！」玄德大驚，急解的盧馬，開後園門牽出，飛身上馬，不顧從者，匹馬望西門而走。門吏問之，玄德不答，加鞭而出。門吏當之不住，飛報蔡瑁。瑁即上馬，引五百軍隨後追趕。,"At the third course, Yi Ji took a goblet of wine in his hands and approached Liu Bei, at the same time giving him a meaningful look. Then in a low voice he said, ""Make an excuse to get away.""Liu Bei understood and presently rose and went to the inner chamber, and then he went to the backyard. There he found Yi Ji, who had gone thither after presenting the cup of wine. Yi Ji then told him, saying, ""Cai Mao plots to kill you, and all the roads have been guarded except that to the west. My lord, you must lose no time to depart.""Liu Bei was quite taken aback. However, he got hold of the Dilu horse, opened the door of the garden, and led it out. Then he took a flying leap into the saddle and galloped off without waiting for the escort. He made for the west gate. At the gate the wardens wanted to question him, but he only whipped up his steed and rode through. The guards at the gate ran off to report to Cai Mao, who quickly went in pursuit with five hundred soldiers."
卻說玄德撞出西門，行無數里，前有大溪，攔住去路。那檀溪闊數丈，水通襄江，其波甚緊。玄德到溪邊，見不可渡，勒馬再回，遙望城西塵頭大起，追兵將至。玄德曰：「今番死矣！」遂回馬到溪邊。回頭看時，追兵已近。玄德著慌，縱馬下溪。行不數步，馬前蹄忽陷，浸濕衣袍。玄德乃加鞭大呼曰：「的盧！的盧！今日妨吾！」言畢，那馬忽從水中湧身而起，一躍三丈，飛上西岸。,"As has been said Liu Bei burst out at the west gate. Before he had gone far, there rolled before him a river barring the way. It was the Tan Torrent, many score spans in width, which pours its waters into the River Xiang. Its current was very swift.Liu Bei reached the bank and saw the river was unfordable. So he turned his horse and rode back. Then, not far off, he saw a cloud of dust and knew that his pursuers were therein. He thought that it was all over. However, he turned again toward the swift river, and seeing the soldiers now quite near, plunged into the stream. A few paces, and he felt the horse's fore legs floundering in front, while the water rose over the skirt of his robe.Then he plied the whip furiously, crying, ""Dilu, Dilu, why betray me?""Whereupon the good steed suddenly reared up out of the water and, with one tremendous leap, was on the western bank."
玄德如從雲霧中起。後來蘇學士有古風一篇，單詠劉玄德躍馬檀溪事。詩曰：,"Liu Bei felt as if he had come out of the clouds. In after years the famous court official, Su Dongpo, wrote a poem on this leap over the Tan Torrent:"
老去花殘春日暮，宦遊偶至檀溪路；停騶遙望獨徘徊，眼前零落飄紅絮。暗想咸陽火德衰，龍爭虎鬥交相持。襄陽會上王孫飲，坐中玄德身將危。逃生獨出西門道，背後追兵復將到。一川煙水漲檀溪，急叱征騎往前跳。馬蹄踏碎青玻璃，天風響處金鞭揮。耳畔但聞千騎走，波中忽見雙龍飛。西川獨霸真英主，坐下龍駒兩相遇。檀溪溪水自東流，龍駒英主今何處？臨流三歎心欲酸，斜陽寂寂照空山。三分鼎足渾如夢，蹤跡空留在世間。,"I'm growing old, the leaves are sere,My sun slopes westward, soon will sink,And I recall that yesteryearI wandered by Tan River brink.Irresolute, anon I paused,Anon advanced, and gazed around,I marked the autumn's reddened leaves,And watched them eddying to the ground.I thought of all the mighty deedsOf him who set the House of HanOn high, and all the struggles since,The battlefields, the blood that ran.I saw the nobles gathered roundThe board, set in the Banquet Hall;Amid them, one, above whose headThere hung a sword about to fall.I saw him quit that festive throngAnd westward ride, a lonely way;I saw a squadron follow swift,Intent the fugitive to slay.I saw him reach the River Tan,Whose swirling current rushes by;Adown the bank he galloped fast,""Now leap, my steed!"" I heard him cry.His steed's hoofs churn the swollen stream;What chills he that the waves run high?He hears the sound of clashing steel,Of thundering squadrons coming nigh.And upward from the foaming wavesI saw two peerless beings soar;One was a destined western king, And him another dragon bore.The Tan still rolls from east to west.Its roaring torrent never dry.Those dragons twain, ah! Where are they?Yes, where? But there is no reply.The setting sun, in dark reliefAgainst the glowing western sky.Throws out the everlasting hillsWhile, saddened, here I stand and sigh.Humans died to found the kingdoms three,Which now as misty dreams remain.Of greatest deeds the traces oftAre faint that fleeting years retain."
玄德躍過溪西，顧望東岸，蔡瑁已引軍趕到溪邊，大叫：「使君何故逃席而去？」玄德曰：「吾與汝無讎，何故欲相害？」瑁曰：「吾並無此心，使君休聽人言。」玄德見瑁手將拈弓取箭，乃急撥馬望西南而去。瑁謂左右曰：「是何神助也！」方欲收軍回城，只見西門內趙雲引三百軍趕來。正是：躍去龍駒能救主，追來虎將欲誅讎。未知蔡瑁性命如何，且看下文分解。,"Thus Liu Bei crossed the rolling river. Then he turned and looked back at the other bank which his pursuers had just gained.""Why did you run sway from the feast?"" called out Cai Mao.""Why did you wish to harm a person who has done you no injury?"" replied Liu Bei.""I have never thought of such a thing. Do not listen to what people say to you.""But Liu Bei saw that his enemy was fitting an arrow to his bowstring, so he whipped up his steed and rode away southwest.""What spirits aided him?"" said Cai Mao to his followers. Then Cai Mao turned to go back to the city, but in the gate he saw Zhao Zilong coming out at the head of his company of guards.By wondrous leap the dragon steed his rider's life could save,Now follows him, on vengeance bent, his master's henchman brave.The next chapters will tell what fate befell the traitor."
