chinese,english
易之為書也不可遠，為道也屢遷，變動不居，周流六虛，上下无常，剛柔相易，不可為典要，唯變所適，其出入以度，外內使知懼，又明於憂患與故，无有師保，如臨父母，初率其辭，而揆其方，既有典常，苟非其人，道不虛行。,"The Yi is a book which should not be let slip from the mind. Its method (of teaching) is marked by the frequent changing (of its lines). They change and move without staying (in one place), flowing about into any one of the six places of the hexagram. They ascend and descend, ever inconstant. The strong and the weak lines change places, so that an invariable and compendious rule cannot be derived from them; - it must vary as their changes indicate. The goings forth and comings in (of the lines) are according to rule and measure. (People) learn from them in external and internal affairs to stand in awe. (The book), moreover, makes plain the nature of anxieties and calamities, and the causes of them. Though (its students) have neither master nor guardian, it is as if their parents drew near to them. Beginning with taking note of its explanations, we reason out the principles to which they point. We thus find out that it does supply a constant and standard rule. But if there be not the Proper men (to carry this out), the course cannot be pursued without them."
易之為書也，原始要終，以為質也，六爻相雜，唯其時物也，其初難知，其上易知，本末也，初辭擬之，卒成之終，若夫雜物撰德，辨是與非，則非其中爻不備。,"The Yi is a book in which the form (of each diagram) is determined by the lines from the first to the last, which must be carefully observed. The six lines are mixed together, according to the time (when they enter the figure) and their substance (as whole and divided). There is difficulty in knowing (the significance of) the first line, while to know that of the topmost line is easy; - they form the beginning and the end (of the diagram). The explanation of the first line tasks the calculating (of the makers), but in the end they had (but) to complete this. As to the variously-disposed intermediate lines with their diverse formations, for determining their qualities, and discriminating the right and wrong in them, we should be unprovided but for the explanations of them."
噫，亦要存亡吉凶，則居可知矣，知者觀其彖辭，則思過半矣。,"Yea, moreover, if we wish to know what is likely to be preserved and what to perish, what will be lucky and what will be unlucky, this may easily be known (from the explanations of the different lines). But if the wise will look at the explanations of the entire diagrams, their thoughts will embrace more than half of this knowledge."
二與四同功，而異位，其善不同，二多譽，四多懼，近也，柔之為道，不利遠者，其要无咎，其用柔中也，三與五同功，而異位，三多凶，五多功，貴賤之等也，其柔危，其剛勝邪？,"The second and fourth lines are of the same quality (as being in even places), but their positions (with respect to the fifth line) are different, and their value is not the same; but the second is the object of much commendation, and the fourth the subject of many apprehensions, - from its nearness (to that line). But for a line in a place of weakness it is not good to be far (from the occupant of the place of strength), and what its subject should desire in such a case is (merely) to be without blame. The advantage (here) is in (the second line) being in the central place. The third and fifth lines are of the same quality, (as being in odd places), but their positions are different; and the (occupant of) the third meets with many misfortunes, while the occupant of the fifth achieves much merit: - this arises from one being in the noble position and the other in the mean. Are they occupied by the symbol of weakness? There will be peril. By that of strength? There will be victory."
易之為書也，廣大悉備，有天道焉，有人道焉，有地道焉。兼三材而兩之，故六六者，非它也，三材之道也，道有變動，故曰爻，爻有等，故曰物，物相雜，故曰文，文不當，故吉凶生焉。,"The Yi is a book of wide comprehension and great scope, embracing everything. There are in it the way of heaven, the way of man, and the way of earth. It then takes (the lines representing) those three Powers, and doubles them till they amount to six. What these six lines show is simply this, - the way of the three Powers. This way is marked by changes and movements, and hence we have the imitative lines. Those lines are of different grades (in the trigrams), and hence we designate them from their component elements. These are mixed together, and elegant forms arise. When such forms are not in their appropriate places, the ideas of good fortune and bad are thus produced."
易之興也，其當殷之末世，周之盛德邪，當文王與紂之事邪，是故其辭危，危者使平，易者使傾，其道甚大，百物不廢，懼以終始，其要无咎，此之謂易之道也。,"Was it not in the last age of Yin, when the virtue of Gou had reached its highest point, and during the troubles between king Wen and (the tyrant) Gou, that the (study of the Yi) began to flourish? On this account the explanations (in the book) express (a feeling of) anxious apprehension, (and teach) how peril may be turned into security, and easy carelessness is sure to meet with overthrow. The method in which these things come about is very comprehensive, and must be acknowledged in every sphere of things. If at the beginning there be a cautious apprehension as to the end, there will probably be no error or cause for blame. This is what is called the way of the Yi."
夫乾，天下之至健也，德行恆易以知險，夫坤，天下之至順也，德行恆簡以知阻。,"(The hexagram) Qian represents the strongest of all under the sky. Through this quality its operations are always manifested with ease, for it knows where there would be peril and embarrassment. (The hexagram) Kun represents the most docile of all under the sky. Through this quality its operations are always manifested with the promptest decision, for it knows where there would be obstruction."
能說諸心，能研諸侯之慮，定天下之吉凶，成天下之亹亹者，是故，變化云為，吉事有祥，象事知器，占事知來。天地設位，聖人成能。人謀鬼謀，百姓與能。,"(The sages, who are thus represented, and who made the Yi,) were able to rejoice in heart (in the absolute truth of things), and were able (also) to weigh carefully all matters that could occasion anxiety; (thus) they fixed the good and bad fortune (of all things) under the sky, and could accomplish the things requiring strenuous efforts. Therefore amid the changes and transformations (taking place in heaven and earth), and the words and deeds of men, events that are to be fortunate have their happy omens. (The sages) knew the definite principles underlying the prognostications of the former class, and the future of those of the latter, (now to be) ascertained by divination. The places of heaven and earth (in the diagrams) having been determined, the sages were able (by means of the Yi) to carry out and complete their ability. (In this way even) the common people were able to share with them in (deciding about) the counsels of men and the counsels of spiritual beings."
八卦以象告，爻彖以情言，剛柔雜居，而吉凶可見矣。,"The eight trigrams communicate their information by their emblematic figures. The explanations appended to the lines and the completed figures tell how the contemplation of them affected (the makers). The strong and the weak lines appear mixed in them, and (thus) the good and the evil (which they indicate) can be seen."
變動以利言，吉凶以情遷。是故愛惡相攻而吉凶生，遠近相取而悔吝生，情偽相感而利害生。凡易之情，近而不相得則凶，或害之，悔且吝。,"The changes and movements (which take place in the manipulation of the stalks and the formation of the diagrams) speak as from the standpoint of what is advantageous. The (intimations of) good and evil vary according to the place and nature (of the lines). Thus they may indicate a mutual influence (in any two of them) of love or hatred, and good or evil is the result; or that mutual influence may be affected by the nearness of the lines to, or their distance from, each other, and then repentance or regret is the result; or the influence may be that of truth or of hypocrisy, and then the result is what is advantageous, or what is injurious. In all these relations of the (lines in the) Yi, if two are near and do not blend harmoniously, there may be (all these results), - evil, or what is injurious, or occasion for repentance and regret."
將叛者其辭慚，中心疑者其辭枝，吉人之辭寡，躁人之辭多，誣善之人其辭游，失其守者其辭屈。,The language of him who is meditating a revolt (from the right) betrays his inward shame; that of him whose inward heart doubts about it diverges to other topics. The words of a good man are few; those of a coarse man are many. The words of one who slanders what is good are unsubstantial; those of him who is losing what he ought to keep are crooked.
