chinese,english
八卦成列，象在其中矣。因而重之，爻在其中矣。剛柔相推，變在其中矣。繫辭焉而命之，動在其中矣。,"The eight trigrams having been completed in their proper order, there were in each the (three) emblematic lines. They were then multiplied by a process of addition till the (six) component lines appeared. The strong line and the weak push themselves each into the place of the other, and hence the changes (of the diagrams) take place. The appended explanations attach to every form of them its character (of good or ill), and hence the movements (suggested by divination) are determined accordingly."
吉凶悔吝者，生乎動者也。剛柔者，立本者也。變通者，趣時者也。,"Good fortune and ill, occasion for repentance or regret, all arise from these movements. The strong and the weak (lines) have their fixed and proper places (in the diagrams); their changes, however varied, are according to the requirements of the time (when they take place)."
吉凶者，貞勝者也。天地之道，貞觀者也。日月之道，貞明者也，天下之動，貞夫一者也。,"Good fortune and ill are continually prevailing each against the other by an exact rule. By the same rule, heaven and earth, in their course, continually give forth (their lessons); the sun and moon continually emit their light; all the movements under the sky are constantly subject to this one and the same rule."
夫乾，確然示人易矣。夫坤，隤然示人簡矣。爻也者，效此者也。象也者，像此者也。,"Qian, (the symbol of heaven, and) conveying the idea of strength, shows to men its easy (and natural) action. Kun, (the symbol of earth, and) conveying the idea of docility, shows to men its compendious (receptivity and operation). The Yao (or lines) are imitative representations of this. The Xiang, or emblematic figures, are pictorial representations of the same."
爻象動乎內，吉凶見乎外，功業見乎變，聖人之情見乎辭。,"The movements of the lines and figures take place (at the hand of the operator), and are unseen; the good fortune or ill is seen openly and is beyond. The work to be done appears by the changes; the sympathies of the sages are seen in their explanations."
天地之大德曰生，聖人之大寶曰位。何以守位曰仁，何以聚人曰財。理財正辭，禁民為非曰義。,"The great attribute of heaven and earth is the giving and maintaining life. What is most precious for the sage is to get the (highest) place - (in which he can be the human representative of heaven and earth). What will guard this position for him? Men. How shall he collect a large population round him? By the power of his wealth. The right administration of that wealth, correct instructions to the people, and prohibitions against wrong-doing; - these constitute his righteousness."
古者包犧氏之王天下也，仰則觀象於天，俯則觀法於地，觀鳥獸之文，與地之宜，近取諸身，遠取諸物，於是始作八卦，以通神明之德，以類萬物之情。,"Anciently, when Bao-xi had come to the rule of all under heaven, looking up, he contemplated the brilliant forms exhibited in the sky, and looking down he surveyed the patterns shown on the earth. He contemplated the ornamental appearances of birds and beasts and the (different) suitabilities of the soil. Near at hand, in his own person, he found things for consideration, and the same at a distance, in things in general. On this he devised the eight trigrams, to show fully the attributes of the spirit-like and intelligent (operations working secretly), and to classify the qualities of the myriads of things."
作結繩而為罔罟，以佃以漁，蓋取諸離。,"He invented the making of nets of various kinds by knitting strings, both for hunting and fishing. The idea of this was taken, probably, from Lu (the third trigram, and thirtieth hexagram)."
包犧氏沒，神農氏作，斲木為耜，揉木為耒，耒耨之利，以教天下，蓋取諸益。,"On the death of Bao-xi, there arose Shen-nong (in his place). He fashioned wood to form the share, and bent wood to make the plough-handle. The advantages of ploughing and weeding were then taught to all under heaven. The idea of this was taken, probably, from Yi (the forty-second hexagram)."
日中為市，致天下之民，聚天下之貨，交易而退，各得其所，蓋取諸噬嗑。,"He caused markets to be held at midday, thus bringing together all the people, and assembling in one place all their wares. They made their exchanges and retired, every one having got what he wanted. The idea of this was taken, probably, from Shi He (the twenty-first hexagram)."
神農氏沒，黃帝、堯、舜氏作，通其變，使民不倦，神而化之，使民宜之。易窮則變，變則通，通則久。是以自天祐之，吉无不利，黃帝、堯、舜垂衣裳而天下治，蓋取諸乾坤。,"After the death of Shen-nong, there arose Huang Di, Yao, and Shun. They carried through the (necessarily occurring) changes, so that the people did (what was required of them) without being wearied; yea, they exerted such a spirit-like transformation, that the people felt constrained to approve their (ordinances) as right. When a series of changes has run all its course, another change ensues. When it obtains free course, it will continue long. Hence it was that 'these (sovereigns) were helped by Heaven; they had good fortune, and their every movement was advantageous.' Huang Di, Yao, and Shun (simply) wore their upper and lower garments (as patterns to the people), and good order was secured all under heaven. The idea of all this was taken, probably, from Qian and Kun (the first and eighth trigrams, or the first and second hexagrams)."
刳木為舟，剡木為楫，舟楫之利，以濟不通，致遠以利天下，蓋取諸渙。,"They hollowed out trees to form canoes; they cut others long and thin to make oars. Thus arose the benefit of canoes and oars for the help of those who had no means of intercourse with others. They could now reach the most distant parts, and all under heaven were benefited. The idea of this was taken, probably, from Huan (the fifty-ninth hexagram)."
服牛乘馬，引重致遠，以利天下，蓋取諸隨。,"They used oxen (in carts) and yoked horses (to chariots), thus providing for the carriage of what was heavy, and for distant journeys - thereby benefiting all under the sky. The idea of this was taken, probably, from Sui (the seventeenth hexagram)."
重門擊柝，以待暴客，蓋取諸豫。,"They made the (defence of the) double gates, and (the warning of) the clapper, as a preparation against the approach of marauding visitors. The idea of this was taken, probably, from Yu (the sixteenth hexagram)."
斷木為杵，掘地為臼，臼杵之利，萬民以濟，蓋取諸小過。,"They cut wood and fashioned it into pestles; they dug in the ground and formed mortar's. Thus the myriads of the people received the benefit arising from the use of the pestle and mortar. The idea of this was taken, probably, from Xiao Guo (the sixty-second hexagram)."
弦木為弧，剡木為矢，弧矢之利，以威天下，蓋取諸睽。,"They bent wood by means of string so as to form bows, and sharpened wood so as to make arrows. This gave the benefit of bows and arrows, and served to produce everywhere a feeling of awe. The idea of this was taken, probably, from Kui (the thirty-eighth hexagram)."
上古穴居而野處，後世聖人易之以宮室，上棟下宇，以待風雨，蓋取諸大壯。,"In the highest antiquity they made their homes (in winter) in caves, and (in summer) dwelt in the open country. In subsequent ages, for these the sages substituted houses, with the ridge-beam above and the projecting roof below, as a provision against wind and rain. The idea of this was taken, probably, from Da Zhuang (the thirty-fourth hexagram)."
古之葬者，厚衣之以薪，葬之中野，不封不樹，喪期无數。後世聖人易之以棺槨，蓋取諸大過。,"When the ancients buried their dead, they covered the body thickly with pieces of wood, having laid it in the open country. They raised no mound over it, nor planted trees around; nor had they any fixed period for mourning. In subsequent ages the sages substituted for these practices the inner and outer coffins. The idea of this was taken, probably, from Da Guo (the twenty-eighth hexagram)."
上古結繩而治，後世聖人易之以書契，百官以治，萬民以察，蓋取諸夬。,"In the highest antiquity, government was carried on successfully by the use of knotted cords (to preserve the memory of things). In subsequent ages the sages substituted for these written characters and bonds. By means of these (the doings of) all the officers could be regulated, and (the affairs of) all the people accurately examined. The idea of this was taken, probably, from Guai (the forty-third hexagram)."
是故，易者，象也，象也者像也。彖者，材也，爻也者，效天下之動者也。是故，吉凶生，而悔吝著也。,"Therefore what we call the Yi is (a collection of) emblematic lines. They are styled emblematic as being resemblances. What we call the Tuan (or king Wen's explanations) are based on the significance (of each hexagram as a whole). We call the lines (of the figures) Yao from their being according to the movements taking place all under the sky. In this way (we see) the rise of good fortune and evil, and the manifestation of repentance and regret."
陽卦多陰，陰卦多陽，其故何也？陽卦奇，陰卦偶。其德行何也？陽一君而二民，君子之道也。陰二君而一民，小人之道也。,"In the Yang trigrams (or those of the undivided line) there are more of the Yin lines, and in the Yin trigrams (or those of the divided line) there are more of the Yang lines. What is the cause of this? It is because the Yang lines are odd (or made by one stroke), and the Yin lines are even (or. made by two strokes). What (method of) virtuous conduct is thus intimated? In the Yang trigrams we have one ruler, and two subjects, - suggesting the way of the superior man. In the Yin trigrams we have two rulers, and one subject, - suggesting the way of the small man."
易曰：「憧憧往來，朋從爾思。」子曰：「天下何思何慮？天下同歸而殊塗，一致而百慮，天下何思何慮？」,"It is said in the Yi, 'Full of anxious thoughts you go and come; (only) friends will follow you and think with you.' The Master said: - 'In all (the processes taking place) under heaven, what is there of thinking? what is there of anxious scheming? They all come to the same (successful) issue, though by different paths; there is one result, though there might be a hundred anxious schemes. What is there of thinking? what is there of anxious scheming?'"
「日往則月來，月往則日來，日月相推而明生焉。寒往則暑來，暑往則寒來，寒暑相推而歲成焉。往者屈也，來者信也，屈信相感而利生焉。」,"The sun goes and the moon comes; the moon goes and the sun comes; - the sun and moon thus take the place each of the other, and their shining is the result. The cold goes and the heat comes; the heat goes and the cold comes; - it is by this mutual succession of the cold and heat that the year is completed. That which goes becomes less and less, and that which comes waxes more and more; - it is by the influence on each other of this contraction and expansion that the advantages (of the different conditions) are produced."
「尺蠖之屈，以求信也。龍蛇之蟄，以存身也。精義入神，以致用也。利用安身，以崇德也。過此以往，未之或知也。窮神知化，德之盛也。」,"When the looper coils itself up, it thereby straightens itself again; when worms and snakes go into the state of hybernation, they thereby keep themselves alive. (So), when we minutely investigate the nature and reasons (of things), till we have entered into the inscrutable and spirit-like in them, we attain to the largest practical application of them; when that application becomes the quickest and readiest, and all personal restfulness is secured, our virtue is thereby exalted. Going on beyond this, we reach a point which it is hardly possible to know. We have thoroughly comprehended the inscrutable and spirit-like, and know the processes of transformation; - this is the fulness of virtue."
易曰：「困于石，據于蒺蔾，入于其宮，不見其妻，凶。」子曰：「非所困而困焉，名必辱。非所據而據焉，身必危。既辱且危，死期將至，妻其可得見耶？」,"It is said in the Yi, '(The third line shows its subject) distressed before a rock, and trying to lay hold of thorns; entering into his palace and not seeing his wife: - there will be evil.' The Master said: - 'If one be distressed by what need not distress him, his name is sure to be disgraced; if he lay hold on what he should not touch, his life is sure to be imperilled. In disgrace and danger, his death will (soon) come; - is it possible for him in such circumstances to see his wife?'"
易曰：「公用射隼，于高墉之上，獲之无不利。」子曰：「隼者禽也，弓矢者器也，射之者人也。君子藏器於身，待時而動，何不利之有？動而不括，是以出而有獲，語成器而動者也。」,"It is said in the Yi, 'The duke with (his bow) shoots at the falcon on the top of the high wall; he hits it: - his every movement will be advantageous.' The Master said: - 'The falcon is a bird (of prey); the bow and arrow is a weapon (of war); the shooter is a man. The superior man keeps his weapon concealed about his person, and waits for the proper time to move; - doing this, how should his movement be other than successful? There is nothing to fetter or embarrass his movement; and hence, when he comes forth, he succeeds in his object. The language speaks of movement when the instrument necessary to it is ready and perfect.'"
子曰：「小人不恥不仁，不畏不義，不見利不勸，不威不懲，小懲而大誡，此小人之福也。易曰：『履校滅趾无咎，此之謂也』。」,"The Master said: - 'The small man is not ashamed of what is not benevolent, nor does he fear to do what is not righteous. Without the prospect of gain he does not stimulate himself to what is good, nor does he correct himself without being moved. Self-correction, however, in what is small will make him careful in what would be of greater consequence; - and this is the happiness of the small man. It is said in the Yi, ""His feet are in the stocks, and he is disabled in his toes: - there will be no (further) occasion for blame.""'"
「善不積，不足以成名；惡不積，不足以滅身。小人以小善為无益，而弗為也，以小惡為无傷，而弗去也，故惡積而不可掩，罪大而不可解。易曰：『何校滅耳凶』。」,"If acts of goodness be not accumulated, they are not sufficient to give its finish to one's name; if acts of evil be not accumulated, they are not sufficient to destroy one's life. The small man thinks that small acts of goodness are of no benefit, and does not do them; and that small deeds of evil do no harm, and does not abstain from them. Hence his wickedness becomes great till it cannot be covered, and his guilt becomes great till it cannot be pardoned. This is what the Yi says, 'He wears the cangue and his ears are destroyed: - there will be evil.'"
子曰：「危者，安其位者也；亡者，保其存者也；亂者，有其治者也。是故，君子安而不忘危，存而不忘亡，治而不忘亂；是以身安而國家可保也。易曰：『其亡其亡，繫于苞桑』。」,"The Master said: - 'He who keeps danger in mind is he who will rest safe in his seat; he who keeps ruin in mind is he who will preserve his interests secure; he who sets the danger of disorder before him is he who will maintain the state of order. Therefore the superior man, when resting in safety, does not forget that danger may come; when in a state of security, he does not forget the possibility of ruin; and when all is in a state of order, he does not forget that disorder may come. Thus his person is kept safe, and his states and all their clans can be preserved. This is according to what the Yi says, ""(Let him say), 'Shall I perish? shall I perish?' (so shall this state be firm, as if) bound to a clump of bushy mulberry trees.""'"
子曰：「德薄而位尊，知小而謀大，力小而任重，鮮不及矣，易曰：『鼎折足，覆公餗，其形渥，凶。』言不勝其任也。」,"The Master said: - 'Virtue small and office high; wisdom small and plans great; strength small and burden heavy: - where such conditions exist, it is seldom that they do not end (in evil). As is said in the Yi, ""The tripod's feet are overthrown, and the ruler's food is overturned. The body of him (who is thus indicated) is wet (with shame):there will be evil.""'"
子曰：「知幾其神乎？君子上交不諂，下交不瀆，其知幾乎，幾者動之微，吉之先見者也，君子見幾而作，不俟終日。易曰：『介于石，不終日，貞吉。』介如石焉，寧用終日，斷可識矣，君子知微知彰，知柔知剛，萬夫之望。」,"The Master said: - 'Does not he who knows the springs of things possess spirit-like wisdom? The superior man, in his intercourse with the high, uses no flattery, and, in his intercourse with the low, no coarse freedom: - does not this show that he knows the springs of things? Those springs are the slight beginnings of movement, and the earliest indications of good fortune (or ill). The superior man sees them, and acts accordingly without waiting for (the delay of) a single day. As is said in the Yi, ""He is firm as a rock, (and acts) without the delay of a single day. With firm goodness there will be good fortune."" Firm as a rock, how should he have to wait a single day to ensure his knowing (those springs and his course)? The superior man knows the minute and the manifested; he knows what is weak, and what is strong: - he is a model to ten thousand.'"
子曰：「顏氏之子，其殆庶幾乎？有不善未嘗不知，知之未嘗復行也。易曰：『不遠復，无祇悔，元吉。』」,"The Master said: - 'I may venture to say that the son of the Yan family had nearly attained (the standard of perfection). If anything that he did was not good, he was sure to become conscious of that; and when he knew it, he did not do the thing again. As is said in the Yi, ""(The first line shows its subject) returning from an error that has not led him far away. There is no occasion for repentance. There will be great good.""'"
天地絪縕，萬物化醇，男女構精，萬物化生，易曰：『三人行，則損一人；一人行，則得其友。』言致一也。,"There is an intermingling of the genial influences of heaven and earth, and transformation in its various forms abundantly proceeds. There is an intercommunication of seed between male and female, and transformation in its living types proceeds. What is said in the Yi, 'Three individuals are walking together and one is made to disappear; there is (but) one man walking, and he gets his mate,' tells us of the effort (in nature) at oneness (of operation)."
子曰：「君子安其身而後動，易其心而後語，定其交而後求，君子脩此三者，故全也，危以動，則民不與也，懼以語，則民不應也，无交而求，則民不與也，莫之與，則傷之者至矣。易曰：『莫益之，或擊之，立心勿恆，凶。』。」,"The Master said: - 'The superior man (in a high place) composes himself before he (tries to) move others; makes his mind restful and easy before he speaks; settles (the principles of) his intercourse with others before he seeks anything from them. The superior man cultivates these three things, and so is complete. If he try to move others while he is himself in unrest, the people will not (act) with him; if he speak while he is himself in a state of apprehension, the people will not respond to him; if without (certain principles of) intercommunication, he issue his requests, the people will not grant them. When there are none to accord with him, those who (work to) injure him will make their appearance. As is said in the Yi, ""(We see one) to whose advantage none will contribute, while some will seek to assail him. He observes no regular rule in the ordering of his heart: - there will be evil.""'"
子曰：「乾坤其易之門邪？乾，陽物也；坤，陰物也；陰陽合德，而剛柔有體，以體天地之撰，以通神明之德，其稱名也雜而不越，於稽其類，其衰世之意邪？」夫易，彰往而察來，而微顯闡幽，開而當名，辨物正言，斷辭則備矣，其稱名也小，其取類也大，其旨遠，其辭文，其言曲而中，其事肆而隱，因貳以濟民行，以明失得之報。,"The Master said: - '(The trigrams) Qian and Kun may be regarded as the gate of the Yi.' Qian represents what is of the yang nature (bright and active); Kun what is of the yin nature (shaded and inactive). These two unite according to their qualities, and there comes the embodiment of the result by the strong and weak (lines). In this way we have the phenomena of heaven and earth visibly exhibited, and can comprehend the operation of the spiritual intelligence. The appellations and names (of the diagrams and lines) are various, but do not go beyond (what is to be ascribed to the operation of these two conditions). When we examine the nature and style (of the appended explanations), they seem to express the ideas of a decaying age. The Yi exhibits the past, and (teaches us to) discriminate (the issues of) the future; it makes manifest what is minute, and brings to light what is obscure. (Then king Wen) opened (its symbols), and distinguished things in accordance with its names, so that all his words were correct and his explanations decisive; - (the book) was now complete. The appellations and names (of the diagrams and lines) are but small matters, but the classes of things comprehended under them are large. Their scope reaches far, and the explanations attached to them are elegant. The words are indirect, but to the point; the matters seem plainly set forth, but there is a secret principle in them. Their object is, in cases that are doubtful, to help the people in their conduct, and to make plain the recompenses of good and evil."
易之興也，其於中古乎，作易者，其有憂患乎。,Was it not in the middle period of antiquity that the Yi began to flourish? Was not he who made it familiar with anxiety and calamity?
是故，履，德之基也；謙，德之柄也；復，德之本也；恆，德之固也；損德之脩也；益，德之裕也；困，德之辨也；井，德之地也；巽，德之制也。,"Therefore (the 10th diagram), Lu, shows us the foundation of virtue; (the 15th), Xian, its handle; (the 24th), Fu, its root; (the 32nd), Heng, its solidity; (the 41st), Sun, its cultivation; (the 42nd), Yi, its abundance; (the 47th), Kun, its exercise of discrimination; (the 48th), Jing, its field and (the 57th), Xun, its regulation."
履，和而至；謙，尊而光；復，小而辨於物；恆，雜而不厭；損，先難而後易；益，長裕而不設；困，窮而通；井，居其所而遷，巽，稱而隱。,"In Lu we have the perfection of harmony; in Xian, we have the giving honour to others, and the distinction thence arising; in Fu we have what is small (at first), but there is in it a (nice) discrimination of (the qualities of) things; in Ming we have a mixed experience, but without any weariness; in Sun we have difficulty in the beginning and ease in the end; in Yi we have abundance of growth without any contrivance; in Kun we have the pressure of extreme difficulty, ending in a free course,; in Jing we have abiding in one's place and at the same time removal (to meet the movement of others); and in Xun we have the weighing of things (and action accordingly), but secretly and unobserved."
履以和行，謙以制禮，復以自知，恆以一德，損以遠害，益以興利，困以寡怨，井以辯義，巽以行權。,"(The use of) Lu appears in the harmony of the conduct; of Xian, in the regulation of ceremonies; of Fu, in self-knowledge; of Heng, in uniformity of virtue; of Sun, in keeping what is harmful at a distance; of Yi, in the promotion of what is advantageous; of Kun, in the diminution of resentments; of Jing, in the discrimination of what is righteous; and of Xun, in the doing of what is appropriate to time and to circumstances."
