chinese,english
甘寧領命而去。魯肅入見周瑜曰：「蔡中，蔡和之降，多應是詐，不可收用。」瑜叱曰：「彼因曹操殺其兄，欲報仇而來降，何詐之有？你若如此多疑，安能容天下之士乎？」,"Gan Ning went away.Then Lu Su came to tell Zhou Yu, saying, ""Everyone agrees in thinking the surrender of Cai Zhong and Cai He feigned and they should be rejected.""""But they wish to revenge the death of their brother,"" said the Fleet Admiral. ""Where is the pretense? If you are so suspicious, you will receive nobody at all."""
肅默然而退，乃往告孔明，孔明笑而不言。肅曰：「孔明何故哂笑？」孔明曰：「吾笑子敬不識公瑾用計耳。大江隔遠，細作極難往來。操使蔡中，蔡和詐降，竊探我軍中事，公瑾將計就計，正要他通報消息。兵不厭詐，公瑾之謀是也。」肅方纔省悟。,"Lu Su left much piqued and went to see Zhuge Liang to whom he told the story. Zhuge Liang only smiled.""Why do you smile?"" said Lu Su.""I smile at your simplicity. The General is playing a game. Spies cannot easily come and go, so these two have been sent to feign desertion that they may act as spies. The General is meeting one ruse with another. He wants them to give false information. Deceit is not to be despised in war, and his scheme is the correct one to employ.""Then Lu Su understood."
卻說周瑜夜坐帳中，忽見黃蓋潛入軍中來見周瑜。瑜問曰：「公覆夜至，必有良謀見教。」蓋曰：「彼眾我寡，不宜久持，何不用火攻之？」瑜曰：「誰教公獻此計？」蓋曰：「某出自己意，非他人之所教也。」瑜曰：「吾正欲如此，故留蔡中，蔡和詐降之人，以通消息；但恨無一人為我行詐降計耳。」蓋曰：「某願行此計。」瑜曰：「不受些苦，彼如何肯信？」蓋曰：「某受孫氏厚恩，雖肝腦塗地，亦無怨悔。」瑜拜而謝之曰：「君若肯行此苦肉計，則江東之萬幸也。」蓋曰：「某死亦無怨。」遂謝而出。,"That night as Zhou Yu was sitting in his tent, Huang Gai came to see him privately.Zhou Yu said, ""You have surely some wise plan to propose that you come at night like this.""Huang Gai replied, ""The enemy are more numerous than we, and it is wrong to delay. Why not burn them out?""""Who suggested that to you?""""I thought of it myself. Nobody suggested it,"" replied Huang Gai.""I just wanted something like this, and that is why I kept those two pretended deserters. I want them to give some false news. The pity is that I have no one to feign desertion to the other side and work my plan.""""But I will carry out your plan,"" said Huang Gai.""But if you cannot show some injury, you will not be believed,"" said Zhou Yu.""The Sun family have been very generous to me, and I would not resent being crushed to death to repay them,"" said Huang Gai.Zhou Yu bowed and thanked him, saying, ""If you would not object to some bodily suffering, then the South Land would indeed be happy.""""Kill me. I do not mind,"" repeated Huang Gai as he took his leave."
次日，周瑜鳴鼓大會諸將於帳下，孔明亦在座。周瑜曰：「操引百萬之眾，連絡三百餘里，非一日可破。今令諸將各領三個月糧草，準備禦敵。」,"Next day the drums called all the officers together to the Commander-in-Chief's tent, and Zhuge Liang came with the others.Zhou Yu said, ""The enemy's camps extend about one hundred miles so that the campaign will be a long one. Each leader is to prepare supplies for three months."""
言未訖，黃蓋進曰：「莫說三個月；便支三十個月糧草，也不濟事！若是這個月能破便破；若是這個月不能破，只可依張子布之言，棄甲倒戈，北面而降之耳！」,"Scarcely had he spoken when Huang Gai started up, crying, ""Say not three months. Be ready for thirty months, and even then it will not be ended. If you can destroy them this month, then all is well. If you cannot, then it were better to take Zhang Zhao's advice, throw down your weapons, turn to the north, and surrender."""
周瑜勃然變色大怒曰：「吾奉主公之命，督兵破曹，敢有再言降者必斬。今兩軍相敵之際，汝敢出此言，慢我軍心，不斬汝首，難以服眾！」喝左右將黃蓋斬訖報來。黃蓋亦怒曰：「吾自隨破虜將軍，縱橫東南，已歷三世，那有你來？」,"Zhou Yu's anger flared up, and he flushed, crying, ""Our lord's orders were to destroy Cao Cao, and whoever mentioned the word surrender should be put to death! Now, the very moment when the two armies are to engage, you dare talk of surrender and damp the ardor of my army! If I do not slay you, how can I support the others?""He ordered the lictors to remove Huang Gai and execute him without delay.Huang Gai then flamed up in turn, saying, ""This is the third generation since I went with General Sun Jian, and we overran the southeast. Whence have you sprung up?"""
瑜大怒，喝令速斬。甘寧進前告曰：「公覆乃東吳舊臣，望寬恕之。」瑜喝曰：「汝何敢多言，亂吾法度！」先叱左右將甘寧亂棒打出。眾官皆跪告曰：「黃蓋罪固當誅，但於軍不利。望都督寬恕，權且記罪。破曹之後，斬亦未遲。」,"This made Zhou Yu perfectly furious, and Huang Gai was ordered to instant death. But Gan Ning interfered.Said he, ""He is a veteran officer of the South Land. Pray pardon him!""""What are you prating about?"" cried Zhou Yu. ""Dare you come between me and my duty?""Turning to the lictors, Zhou Yu ordered them to drive Gan Ning forth with blows.The other officials fell on their knees entreating pity for Huang Gai.""He is indeed most worthy of death, but it would be a loss to the army. We pray you forgive him. Record his fault for the moment; and after the enemy shall have been defeated, then put him to death."""
瑜怒未息，眾官苦苦告求。瑜曰：「若不看眾官面皮，決須斬首！今且免死！」命左右拖翻，打一百脊杖，以正其罪。眾官又告免，瑜推翻案桌，叱退眾官，喝教行杖。將黃蓋剝了衣服，拖翻在地，打了五十脊杖。眾官又復苦苦求免，瑜躍起指蓋曰：「汝敢小覷我耶！且記下五十棍！再有怠慢，二罪俱罰！」恨聲不絕而入帳中。,"But Zhou Yu was implacable. The officers pleaded with tears.At length he seemed moved, saying, ""Had you not interceded, he should certainly have suffered death. But now I will mitigate the punishment to a beating. He shall not die.""Zhou Yu turned to the lictors and bade them deal the culprit one hundred blows. Again his colleagues prayed for remission, but Zhou Yu angrily pushed over the table in front of him and roared to the officers to get out of the way and let the sentence be executed.So Huang Gai was stripped, thrown to the ground, and fifty blows were given. At this point the officers again prayed that he be let off.Zhou Yu sprang from his chair and pointing his finger at Huang Gai said, ""If you dare flout me again, you shall have the other fifty. If you are guilty of any disrespect, you shall be punished for both faults!""With this he turned into the inner part of the tent, growling as he went."
眾官扶起黃蓋，打得皮開肉綻，鮮血迸流，扶歸本寨，昏絕幾次。動問之人，無不下淚。魯肅也往看問了，來至孔明船中，謂孔明曰：「今日公瑾怒責公覆，我等皆是他部下，不敢犯顏苦諫。先生是客，何故袖手旁觀，不發一語？」孔明笑曰：「子敬欺我。」肅曰：「肅與先生渡江以來，未嘗一事相欺。今何出此言？」孔明曰：「子敬豈不知公瑾今日毒打黃公覆，乃其計耶？如何要我勸他？」肅方悟。孔明曰：「不用苦肉計，何能瞞過曹操？今必令黃公覆去詐降，卻教蔡中，蔡和報知其事矣。子敬見公瑾時，切勿言亮先知其事，只說亮也埋怨都督便了。」,"The officers helped their beaten colleague to his feet. He was in a deplorable state. His back was cut in many places, and the blood was flowing in streams. They led him to his own quarters and on the way he swooned several times. His case seemed most pitiable.Lu Su went to see the suffering officer and then called on Zhuge Liang in his boat.Lu Su related the story of the beating and said, ""Though the other officers have been cowed into silence, I think thought you, Sir, might have interceded. You are a guest and not under Zhou Yu's orders. Why did you stand by with your hands up your sleeves and say never a word?""""You insult me,"" said Zhuge Liang smiling.""Why do you say that? I have never insulted you: Never since the day we came here together.""""Do you not know that terrible beating was but a ruse? How could I try to dissuade Zhou Yu?""Then Lu Su began to perceive, and Zhuge Liang continued, saying, ""Cao Cao would not be taken in unless there was some real bodily suffering. Zhou Yu is going to send Huang Gai over as a deserter, and Zhou Yu will see to it that the two Cao Cao's spies duly tell the tale. But when you see the General, you must not tell him that I saw through the ruse. You say that I am very angry like the others."""
肅辭去，入帳見周瑜，瑜邀入帳後。肅曰：「今日何故痛責黃公覆？」瑜曰：「諸將怨否？」肅曰：「多有心中不安者。」瑜曰：「孔明之意若何？」肅曰：「他也埋怨都督忒薄情。」瑜笑曰：「今番須瞞過他也。」肅曰：「何謂也？」瑜曰：「今日痛打黃蓋，乃計也。吾欲令他詐降，先須用苦肉計，瞞過曹操，就中用火攻之，可以取勝。」肅乃暗思孔明之高見，卻不敢明言。,"Lu Su went to see Zhou Yu and asked, ""Why have you so cruelly beaten a proved and trusty officer?""""Do the officers resent it?"" asked Zhou Yu.""They are all upset about it.""""And what does your friend think?""""Zhuge Liang also resents it in his heart, and he thinks you have made a mistake.""""Then I have deceived him for once,"" said Zhou Yu gleefully.""What mean you?"" cried Lu Su.""That beating that Huang Gai got is part of my ruse. I am sending him to Cao Cao as a deserter, and so I have supplied a reason for desertion. Then I am going to use fire against the enemy.""Lu Su kept silence, but he recognized that Zhuge Liang was again right."
且說黃蓋臥於帳中，眾將皆來動問。蓋不言語，但長吁而已。忽報參謀闞澤來問。蓋令請入臥內，叱退左右。闞澤曰：「將軍莫非與都督有讎？」蓋曰：「非也。」澤曰：「然則公之受責，莫非苦肉計乎？」蓋曰：「何以知之？」澤曰：「某觀公瑾舉動，已料著八九分。」蓋曰：「某受吳侯三世厚恩，無以為報，故獻此計，以破曹操。吾雖受苦，亦無所恨。吾遍觀軍中，無一人可為心腹者。惟公素有忠義之心，敢以心腹相告。」澤曰：「公之告我，無非要我獻詐降書耳。」蓋曰：「實有此意。未知肯否？」闞澤欣然領諾。正是：勇將輕身思報主，謀臣為國有同心。未知闞澤所言若何，且看下文分解。,"Meanwhile Huang Gai lay in his tent, whither all his colleague officers went to condole with him and inquire after his health. But Huang Gai would say never a word. He only lay sighing deeply from time to time.But when the Strategist Kan Ze came, Huang Gai told them to bring him to the room where he lay. Then he bade the servants go away.Kan Ze said, ""Surely you must have some serious quarrel with the General.""""I have none,"" said Huang Gai.""Then this beating is just part of a ruse?""""How did you guess?"" said Huang Gai.""Because I watched the General, and I guessed about nine tenths of the truth.""Huang Gai said, ""You see I have been very generously treated by the Sun family, all three of them, and have no means of showing my gratitude except by offering to help in this ruse. True I suffer, but I do not regret that. Among all those I know in the army, there is not one I am intimate with except yourself. You are true, and I can talk with you as a friend.""""I suppose you wish me to present your surrender letter to Cao Cao. Is that it?""""Just that; will you do it?"" said Huang Gai.Kan Ze consented joyfully.Even the warrior's body is but a stake in the game,The friend so ready to help him proves that their hearts are the same.Kan Ze's reply will be read in the next chapter."
