chinese,english
黃祖才非長者儔，禰衡喪首此江頭。今來鸚鵡洲邊過，惟有無情碧水流。,"Huang Zu could brook no rival; at his wordMi Heng met death, beneath the cruel sword.His grave on Parrot Isle may yet be seen,The river flowing past it, coldly green."
卻說曹操知禰衡受害，笑曰：「腐儒舌劍，反自殺矣！」因不見劉表來降，便欲興兵問罪。荀彧諫曰：「袁紹未平，劉備未滅，而欲用兵江漢，是猶舍心腹而顧手足也。可先滅袁紹，後滅劉備，江漢可一掃而平矣。」操從之。,"Cao Cao heard of the young man's death with pleasure.""The putrid bookworm has just cut himself up with his own sharp tongue,"" said he.As there was no sign of Liu Biao coming to join him, Cao Cao began to think of coercion. Xun Yu dissuaded him from this course.Said he, ""Yuan Shao is not subjugated; Liu Bei is not destroyed. To attack Liu Biao would be to neglect the vital to care for the immaterial. Destroy the two chief enemies first, and the Han River is yours at one blow.""And Cao Cao took the advice."
且說董承自劉玄德去後，日夜與王子服等商議，無計可施。建安五年，元旦朝賀，見曹操驕橫愈甚，感憤成疾。帝知國舅染病，令隨朝太醫前去醫治。此醫乃洛陽人：姓吉，名太，字稱平，人皆呼為吉平，當時名醫也。平到董承府用藥調治，旦夕不離；常見董承長吁短歎，不敢動問。,"After the departure of Liu Bei, Dong Cheng and his fellow conspirators did nothing else day or night but try to evolve plans for the destruction of Cao Cao. But they could see no chance to attack. At the new year audience Cao Cao was odiously arrogant and overweening, and the chief conspirator's disgust was so intense that he fell ill.Hearing of the State Uncle's indisposition, the Emperor sent the Court Physician to see him. The Court Physician at this time was a native of Luoyang, named Ji Ping. A very famous physician, Ji Ping devoted himself wholly to the treatment of his court patient. Living in Dong Cheng's palace and seeing Dong Cheng at all times, Ji Ping soon found that some secret grief was sorely troubling him. But Ji Ping dared not ask questions."
時值元宵，吉平辭去，承留住，二人共飲。飲至更餘，承覺困倦，就和衣而睡。忽報王子服等四人至，承出接入。服曰：「大事諧矣！」承曰：「願聞其說。」服曰：「劉表結連袁紹，起兵五十萬，共分十路殺來。馬騰結連韓遂，起西涼軍七十二萬，從北殺來。曹操盡起許昌兵馬，分頭迎敵，城中空虛。若聚五家僮僕，可得千餘人。乘今夜府中大宴，慶賞元宵，將府圍住，突入殺之。不可失此機會！」,"One evening of the full moon festival, when the physician was just taking his leave, Dong Cheng kept him, and the two men had supper together. They eat talking for some time, and Dong Cheng by and by dropped off to sleep dressed as he was.Presently Wang Zifu and the others were announced. As they were coming in, Wang Zifu cried, ""Our business is settled!""""I should be glad to hear how,"" said Dong Cheng.""Liu Biao has joined Yuan Shao, and five hundred thousand troops in fifty legions are on their way here by different routes. More than this, Ma Teng and Han Sui are coming from the northwest with seven hundred thousand Xiliang troops. Cao Cao has moved every soldier outside Xuchang to meet the combined armies. There is a great banquet in his palace tonight. If we get together our young men and servants, we can muster more than a thousand, and we can surround the palace, while Cao Cao is at the banquet, and finish him off. We must not miss this."""
承大喜，隨即喚家奴各人收拾兵器，自己披挂綽鎗上馬，約會都在內門前相會，同時進兵。夜至二鼓，眾兵皆到。董承手提寶劍，徒步直入，見操設宴後堂，大叫：「操賊休走！」一劍剁去，隨手而倒。霎時覺來，乃南柯一夢，口中猶罵操賊不止。吉平向前叫曰：「汝欲害曹公乎？」承驚懼不能答。吉平曰：「國舅休慌。某雖醫人，未嘗忘漢。某連日見國舅嗟歎，不敢動問。恰纔夢中之言，已見真情。幸勿相瞞。倘有用某之處，雖滅九族，亦無後悔。」承掩面而哭曰：「只恐汝非真心！」,"Dong Cheng was more than delighted. He called his servants and armed them, put on his own armor and mounted his horse. The conspirators met, as they had arranged, just at the inner gate of the Prime Minister's palace. It was the first watch. The small army marched straight in, Dong Cheng leading with his treasured sword drawn. His intended victim was at table in one of the private rooms. Dong Cheng rushed in, crying, ""Cao Cao, you rebel, stay!"" and dashed at Cao Cao who fell at the first blow.And just then he woke up and found it was all a dream, but his mouth was still full of curses.""Do you really wish to destroy Cao Cao?"" said Ji Ping, going forward to his half awakened patient.This brought Dong Cheng to his senses. He stopped, terror stricken, and made no reply.""Do not be frightened, O Uncle,"" said the doctor. ""Although I am a physician, I am also a man, and I never forget my emperor. You have seemed sad for many days, but I have never ventured to ask the reason. Now you have shown it in your dream, and I know your real feelings. If I can be of any use, I will help. Nothing can daunt me.""Dong Cheng covered his face and wept.""I fear you may not be true to me,"" cried he."
平遂咬下一指為誓。承乃取出衣帶詔，令平視之；且曰：「今之謀望不成者，乃劉玄德、馬騰各自去了，無計可施，因此感而成疾。」平曰：「不消諸公用心。操賊性命，只在某手中。」承問其故。平曰：「操常患頭風，痛入骨髓；纔一舉發，便召某醫治。如早晚有召，只用一服毒藥，必然死矣，何必舉刀兵乎？」承曰：「若得如此，救漢朝社稷者，皆賴君也！」,"Ji Ping at once bit off a finger as a pledge of his faith. And then his host and patient brought forth the decree he had received in the girdle.""I am afraid our schemes will come to nought,"" said Dong Cheng. ""Liu Bei and Ma Teng are gone, and there is nothing we can do. That was the real reason I fell ill.""""It is not worth troubling you gentlemen with, for Cao Cao's life lies in these hands of mine,"" said Ji Ping.""How can that be?""""Because he is often ill with deep-seated pain in his head. When this comes on, he sends for me. When next he calls me, I only have to give him one dose and he will certainly die. We do not want any weapons.""""If only you could do it! You would be the savior of the dynasty. It depends upon you."""
時吉平辭歸。承心中暗喜，步入後堂，忽見家奴秦慶童同侍妾雲英在暗處私語。承大怒，喚左右捉下，欲殺之。夫人勸免其死，各人仗四十，將慶童鎖於冷房。慶童懷恨，夤夜將鐵鎖扭斷，跳墻而出，逕入曹操府中，告有機密事。操喚入密室問之。慶童云：「王子服，吳子蘭，种輯，吳碩，馬騰五人在家主府中商議機密，必然是謀丞相。家主將出白絹一段，不知寫著甚的。近日吉平咬指為誓，我也曾見。」,"Then Ji Ping went away leaving his late patient a happy man. Dong Cheng strolled into the garden and there he saw one of his servants, Qin Qington, whispering with one of the concubines, Yun Ying, in a dark corner. This annoyed him, and he called his attendants to seize them. He would have put them to death but for the intervention of his wife. At her request he spared their lives, but both were beaten forty canes, and the lad was thrown into a dungeon. Sulky at this treatment, Qin Qington broke out of the cell in the night, climbed over the wall, and went straight to Cao Cao's palace, where he betrayed the conspiracy.Cao Cao at once had him taken into a secret chamber and questioned him.Qin Qington gave the names of the conspirators, saying, ""Wang Zifu, Wu Zilan, Chong Ji, Wu Shi, Ma Teng, and my master have been meeting secretly. My master has a roll of white silk, with writing on it, but I do not know what it means. Yesterday, Ji Ping bit off one of his fingers as a pledge of fidelity. I saw that."""
曹操藏匿慶童於府中，董承只道逃往他方向去了，也不追尋。次日，曹操詐患頭風，召吉平用藥。平自思曰：「此賊合休！」暗藏毒藥入府。操臥於床上，令平下藥。平曰：「此病可一服即愈。」教取藥罐，當面煎之。藥已半乾，平已暗下毒藥，親自送上。操知有毒，故意遲延不服。平曰：「乘熱服之，少汗即愈。」操起曰：「汝既讀儒書，必知禮義。『君有疾飲藥，臣先嘗之；父有疾飲藥，子先嘗之。』汝為我心腹之人，何不先嘗而後進？」平曰：「藥以治病，何用人嘗？」,"Qin Qington was kept in a secret part of the palace, while his late master, Dong Cheng, only knowing that he had run away, took no special means to find him.Soon after this Cao Cao feigned a headache and sent for Ji Ping as usual.""The rebel is done for,"" thought Ji Ping, and he made a secret package of poison which he took with him to the palace of the Prime Minister. He found Cao Cao in bed. The patient bade the doctor prepare a potion for him.""One draught will cure this disease,"" said Ji Ping.He bade them bring him a pot, and he prepared the potion in the room. When it had simmered for some time and was half finished, the poison was added, and soon after the physician presented the draught. Cao Cao, knowing it was poisoned, made excuses and would not swallow it.""You should take it hot,"" said the doctor. ""Then there will be a gentle perspiration, and you will be better.""""You are a scholar,"" said Cao Cao, sitting up, ""and know what is the correct thing to do. When the master is ill and takes drugs, the attendant first tastes them; when a man is ill, his son first tastes the medicine. You are my confidant and should drink first. Then I will swallow the remainder.""""Medicine is to treat disease. What is the use of anyone's tasting it?"" said Ji Ping."
平知事已泄，縱步向前，扯住操耳而灌之。操推藥潑地，磚皆迸裂。操未及言，左右已將吉平執下。操曰：「吾豈有疾，特試汝耳！汝果有害我之心！」遂喚二十個精壯獄卒，執平至後園拷問。操坐於亭上，將吉平縛倒於地。吉平面不改容，略無懼怯。操笑曰：「量汝是個醫人，安敢下毒害我？必有人唆使你來。你說出那人，我便饒你。」平叱之曰：「汝乃欺君罔上之賊，天下皆欲殺汝，豈獨我乎！」操再三磨問。平怒曰：「我自欲殺汝，安有人使我來？今事不成，惟死而已！」操怒，教獄卒痛打。打到兩個時辰，皮開肉裂，血流滿階。操恐打死，無可對證，今獄卒揪去靜處，權且將息。傳令次日設宴，請眾大臣飲酒。惟董承託病不來。王子服等皆恐操生疑，只得俱至。操於後堂設席。酒行數巡，曰：「筵中無可為樂，我有一人，可為眾官醒酒。」教二十個獄卒：「與吾牽來！」,"But he guessed now the conspiracy had been discovered, so he dashed forward, seized Cao Cao by the ear, and tried to pour the potion down his throat. Cao Cao pushed it away, and it spilt. The bricks upon which it fell were split asunder. Before Cao Cao could speak, his servants had already seized the assailant.Said Cao Cao, ""I am not ill. I only wanted to test you. So you really thought to poison me!""He sent for a score of sturdy gaolers who carried off the prisoner to the inner apartments to be interrogated. Cao Cao took his seat in a pavilion, and the hapless physician, tightly bound, was thrown to the ground before him. The prisoner maintained a bold front.Cao Cao said, ""I thought you were a physician. How dared you try to poison me? Someone incited you to this crime. If you tell me, I will pardon you.""""You are a rebel. You flout your Prince and injure your betters. The whole empire wishes to kill you. Do you think I am the only one?""Cao Cao again and again pressed the prisoner to tell what he knew, but he only replied that no one had sent him and it was his own desire.""I have failed, and I can but die,"" added Ji Ping.Cao Cao angrily bade the gaolers give him a severe beating, and they dogged him for two watches. His skin hung in tatters, the flesh was battered, and the blood from his wounds ran down the steps. Then fearing he might die and his evidence be lost, Cao Cao bade them cease and remove him. They took him off to a quiet place where he might recover somewhat.Having issued orders to prepare a banquet for next day, Cao Cao invited all the courtiers thereto. Dong Cheng was the only one who excused himself, saying he was unwell. The other conspirators dared not stay away as they felt they would be suspected.Tables were laid in the private apartments, and after several courses the host said, ""There is not much to amuse us today, but I have a man to show you that will sober you.""""Bring him in!"" Cao Cao said, turning to the gaolers."
須臾，只見一長枷釘著吉平，拖至階下。操曰：「眾官不知：此人連結惡黨，欲反背朝廷，謀害曹某；今日天敗，請聽口詞。」操教先打一頓，昏絕於地，以水噴面。吉平甦醒，睜目切齒而罵曰：「操賊！不殺我，更待何時？」操曰：「同謀者先有六人，與汝共七人耶？」平只是大罵。王子服等四人面面相覷，如坐鍼氈。操教一面打，一面噴。平並無求饒之意。操見不招，且教牽去。,"The hapless Ji Ping appeared, securely fastened in a wooden collar. He was placed where all could see him.""You officials do not know that this man is connected with a gang of evil doers who desire to overturn the government and even injure me. However, Heaven has defeated their plans, but I desire that you should hear his evidence.""Then Cao Cao ordered the gaolers to beat their prisoner. They did so till Ji Ping lay unconscious, when they revived him by spraying water over his face. As soon as he came to, he glared at his oppressor and ground his teeth.""Cao Cao, you rebel! What are you waiting for? Why not kill me?"" cried Ji Ping.Cao Cao replied, ""The conspirators were only six at first; you made the seventh. Is that true?""Here the prisoner broke in with more abuse, while Wang Zifu and the other three conspirators exchanged glances, looking as though they were sitting on a rug full of needles. Cao Cao continued his torture of the prisoner, beating him into unconsciousness and reviving him with cold water, the victim disdaining to ask mercy. Finally Cao Cao realized he would incriminate none of his accomplices, and so he told the gaolers to remove Ji Ping."
眾官席散，操只留王子服等四人夜宴。四人魂不附體，只得留待。操曰：「本不相留，爭奈有事相問。汝四人不知與董承商議何事？」子服曰：「並未商議甚事。」操曰：「白絹中寫著何事？」子服等皆隱諱，操喚出慶童對証。子服曰：「汝於何處見來？」慶童曰：「你迴避了眾人，六人在一處畫字，如何賴得？」子服曰：「此賊與國舅侍妾通姦，被責誣主，不可聽也。」操曰：「吉平下毒，非董承所使而誰？」子服等皆言不知。操曰：「今晚自首，尚猶可恕；若待事發，其實難容！」,"At the close of the banquet, when the guests were dispersing, four of them, the four conspirators, were invited to remain behind to supper. They were terrified so that their souls seemed no longer to inhabit their bodies, but there was no saying nay to the invitation.Presently Cao Cao said, ""Still there is something I want to speak about, so I have asked you to stay for a time longer. I do not know what you four have been arranging with Dong Cheng.""""Nothing at all,"" said Wang Zifu.""And what is written on the white silk?"" asked Cao Cao.They all said they knew nothing about it.Then Cao Cao ordered the runaway servant to be brought in. As soon as Qin Qington came, Wang Zifu said, ""Well, what have you seen and where?""Qin Qington replied, ""You five very carefully chose retired places to talk in, and you secretly signed a white roll. You cannot deny that.""Wang Zifu replied, ""This miserable creature was punished for misbehavior with one of Uncle Dong Cheng's maids, and now because of that he slanders his master. You must not listen to him.""""Ji Ping tried to pour poison down my throat. Who told him to do that if it was not Dong Cheng?"" said Cao Cao.They all said they knew nothing about who it was.""So far,"" said Cao Cao, ""matters are only beginning, and there is a chance of forgiveness. But if the thing grows, it will be difficult not to take notice of it."""
子服等皆言並無此事。操叱左右將四人拏住監禁。次日，帶領眾人逕投董承家探病。承只得出迎。操曰：「緣何夜來不赴宴？」承曰：「微疾未痊，不敢輕出。」操曰：「此是憂國家病耳。」承愕然。操曰：「國舅知吉平事乎？」承曰：「不知。」操冷笑曰：「國舅如何不知？」喚左右：「牽來與國舅起病。」承舉措無地。,"The whole four vigorously denied that any plot existed. However Cao Cao called up his henchmen, and the four men were put into confinement.Next day Cao Cao with a large following went to the State Uncle's palace to ask after his health.Dong Cheng came out to receive his visitor, who at once said, ""Why did you not come last night?""""I am not quite well yet and have to be very careful about going out,"" replied Dong Cheng.""One might say you were suffering from national sorrow, eh?"" said Cao Cao.Dong Cheng started. Cao Cao continued, ""Have you heard of the Ji Ping affair?""""No. What is it?""Cao Cao smiled coldly, saying, ""How can it be you do not know?""He turned to his attendants and told them to bring in the prisoner, while he went on talking to his host about national illness. Dong Cheng was much put about and knew not what to do."
須臾，二十獄卒推吉平至階下。吉平大罵：「曹操逆賊！」操指謂承曰：「此人曾攀下王子服等四人，吾已拏下廷尉。尚有一人，未曾捉獲。」因問平曰：「誰使汝來藥我？可速招出！」平曰：「天使我來殺逆賊！」操怒教打。身上無容刑之處。承在座觀之，心如刀割。操又問平曰：「你原有十指，今如何只有九指？」平曰：「嚼以為誓，誓殺國賊！」操教取刀來，就階下截去其九指，曰：「一發截了，教你為誓！」平曰：「尚有口可以吞賊，有舌可以罵賊！」操令割其舌。平曰：「且勿動手。吾今刑不過，只得供招。可釋吾縛。」操曰：「釋之何礙？」遂命解其縛。平起身望闕拜曰：「臣不能為國家除賊？乃天數也！」拜畢，撞階而死。操令分其肢體號令。時建安五年正月也。史官有詩曰：,"Soon the gaolers led in the physician to the steps of the hall. At once the bound man began to rail at Cao Cao as rebel and traitor.""This man,"" said Cao Cao, pointing to Ji Ping, ""has implicated Wang Zifu and three others, all of whom are now under arrest. There is one more whom I have not caught yet.""""Who sent you to poison me?"" continued Cao Cao, turning toward the physician. ""Quick, tell me!""""Heaven sent me to slay a traitor!""Cao Cao angrily ordered them to beat Ji Ping again, but there was no part of his body that could be beaten. Dong Cheng sat looking at him, his heart feeling as if transfixed with a dagger.""You were born with ten fingers. How is it you have now only nine?""Ji Ping replied, ""I bit off one as a pledge when I swore to slay a traitor.""Cao Cao told them to bring a knife, and they lopped off his other nine fingers.""Now they are all off. That will teach you to make pledges.""""Still I have a mouth that can swallow a traitor and a tongue that can curse him,"" said Ji Ping.Cao Cao told them to cut out his tongue.Ji Ping said, ""Do not. I cannot endure any more punishment, I shall have to speak out. Loosen my bonds.""""Loose them. There is no reason why not,"" said Cao Cao.They loosed him. As soon as he was free, Ji Ping stood up, turned his face toward the Emperor's palace and bowed, saying, ""It is Heaven's will that thy servant has been unable to remove the evil.""Then he turned and smashed his head into the steps and died.His body was quartered and exposed. This happened in the first month of the fifth year of Rebuilt Tranquillity (AD 200), and a certain historian wrote a poem:"
漢朝無起色，醫國有稱平。立誓除姦黨，捐軀報聖明。極刑詞愈烈，慘死氣如生。十指淋漓處，千秋仰異名。,"There lived in Han a simple physician.No warrior, yet braveEnough to risk his very lifeHis Emperor to save.Alas! He failed; but lasting fameIs his; he feared not death;He cursed the traitorous Prime MinisterUnto his latest breath."
操見吉平已死，教左右牽過秦慶童至面前。操曰：「國舅認得此人否？」承大怒曰：「逃奴在此！即當誅之！」操曰：「他首告謀反，今來對證，誰敢誅之？」承曰：「丞相何故聽逃奴一面之說？」操曰：「王子服等吾已擒下，皆招證明白，汝尚抵賴乎？」即喚左右拏下，命從人直入董承臥房內，搜出衣帶詔并義狀。操看了，笑曰：「鼠輩安敢如此！」遂命：「將董承全家良賤，盡皆監禁，休教走脫一個。」操回府以詔狀示眾謀士商議，要廢獻帝，更立新君。正是：數行丹詔成虛望，一紙盟書惹禍殃。未知獻帝性命如何，且看下文分解。,"Seeing his victim had passed beyond the realm of punishment, Cao Cao had Qin Qington led in.""Do you know this man, Uncle?""""Yes,"" cried Dong Cheng. ""So the runaway servant is here. He ought to be put to death!""""He just told me of your treachery. He is my witness,"" said Cao Cao. ""Who would dare kill him?""""How can you, the First Minister of State, heed the unsupported tale of an absconding servant?""""But I have Wang Zifu and the others in prison,"" said Cao Cao. ""And how can you rebut their evidence?""He then called in the remainder of his followers and ordered them to search Dong Cheng's bedroom. They did so and found the decree that had been given him in the girdle and the pledge signed by the conspirators.""You mean rat!"" cried Cao Cao. ""You dared do this?""He gave orders to arrest the whole household without exception. Then he returned to his palace with the incriminating documents and called all his advisers together to discuss the dethronement of the Emperor and the setting up of a successor.Many decrees, blood written, have issued, accomplishing nothing,One inscribed pledge was fraught with mountains of sorrow.The reader who wishes to know the fate of the Emperor must read the next chapter."
