chinese,english
孔明令曰：「博望之左有山，名曰豫山；右有林，名曰安林；可以埋伏軍馬。雲長可引一千軍往豫山之前，先且埋伏，等彼軍至，放過休敵。其輜重糧草，必在後面。但看南面火起，可縱兵出擊，就焚其糧草。翼德可引一千軍去安林背後山谷中埋伏，只看南面火起，便可出，向博望城舊屯糧草處縱火燒之。關平、劉封可引兵五百軍，預備引火之物，於博望坡後兩邊等候，至初更兵到，便可放火矣。」──又命於樊城取回趙雲，令為前部，不要贏，只要輸。──「主公自引一軍為後援。各須依計而行，勿使有失。」,"In the assembly Zhuge Liang spoke, saying, ""On the left of Bowang are Yushan Hills. On the right is Anlin Forest. There we will prepare an ambush. Guan Yu will go to Yushan Hills with one thousand soldiers. He is to remain there quiescent till the enemy has passed; but when he sees a flame in the south, that will be the signal to attack. He will first burn their baggage train. Zhang Fei will go to a valley behind Anlin Forest. When he sees the signal, he is to go to the old stores depot at Bowang and burn that. Liu Feng and Guan Ping will take five hundred soldiers each to the south, prepare combustibles and be ready with them beyond Bowang Slope. The enemy will arrive about dusk, and then the two generals can start the blare. Zhao Zilong, now recalled from Fancheng, is to lead the attack, but he is to lose and not win. And our lord is to command the reserve. See that each one obeys these orders and let there be no mistakes."""
雲長曰：「我等皆出迎敵，未審軍師卻作何事？」孔明曰：「我只坐守此城。」張飛大笑曰：「我們都去廝殺，你卻在家裡坐地，好自在！」孔明曰：「劍印在此，違令者斬！」玄德曰：「豈不聞『運籌帷幄之中，決勝千里之外』？二弟不可違令。」張飛冷笑而去。雲長曰：「我們且看他的計應也不應，那時卻來問他未遲。」,"Then said Guan Yu, ""All of us are to go out to meet the enemy, but I have not yet heard what you are going to do.""""I will just be sitting here guarding the city.""Zhang Fei burst into a laugh, ""We are to go out to bloody battle, and you are to stay quietly at home quite comfortable.""""Here is the sword and here the seal!"" replied the strategist, displaying the emblems of authority. ""Disobedience of orders will be death.""Liu Bei said, ""Do you not understand that the plans elaborated in a little chamber decide success over thousands of miles? Do not disobey the command, my brothers.""Zhang Fei went out smiling cynically.Guan Yu remarked, ""Let us await the result. If he fails, then we can look to it."""
二人去了。眾將皆未知孔明韜略，今雖聽令，卻都疑惑不定。孔明謂玄德曰：「主公今日可便引兵就博望山下屯住。來日黃昏，敵軍必到，主公便棄營而走。但見火起，即回軍掩殺。亮與糜竺、糜芳引五百軍守縣，命孫乾、簡雍準備慶喜筵席，安排『功勞簿』伺候。」派撥已畢，玄德亦疑惑不定。,"The brothers left. None of the officers understood anything of the general line of strategy and, though they obeyed orders, they were not without doubts and misgivings.Zhuge Liang said to Liu Bei, ""You may now lead your soldiers to the hills and camp till the enemy shall arrive tomorrow evening. Then you are to abandon the camp and move away retreating till the signal is seen. Then you will advance and attack with all force. Mi Zhu, Mi Fang, and I will guard the city.""In the city Zhuge Liang prepared banquets to celebrate the victory and also prepared the books to record exceptional services.Liu Bei noted all these things, but his heart was also troubled not a little."
卻說夏侯惇與于禁等引兵至博望，分一半精兵作前隊，其餘盡護糧車而行。時當秋月，商飆徐起。人馬趲行之間，望見前面塵頭忽起。惇便將人馬擺開，問鄉導官曰：「此間是何處？」答曰：「前面便是博望坡，後面是羅川口。」,"Cao Cao's army of one hundred thousand troops in due course reached Bowang. Then half of them, the veterans, were told off for the first attack, and the remainder were to guard the baggage train and supplies. Thus they marched in two divisions. The season was autumn and a chilly wind began to blow.They pressed forward. Presently they saw a cloud of dust ahead of them, and Xiahou Dun ordered the ranks to be reformed. He questioned the guides as to the name of the place.""The place in front is Bowang Slope, and behind us is the River Luo,"" was the reply."
惇令于禁、李典押住陣腳，親自出馬陣前。遙望軍馬來到，惇忽然大笑。眾問：「將軍為何而笑？」惇曰：「吾笑徐元直在丞相面前，誇諸葛亮為天人！今觀其用兵，乃以此等軍馬為前部，與吾對敵，正如驅犬羊與虎豹鬥耳！吾於丞相前誇口，要活捉劉備、諸葛亮，今必應吾言矣。」遂自縱馬向前。趙雲出馬。惇罵曰：「汝等隨劉備，如孤魂隨鬼耳！」,"Then Xiahou Dun rode to the front to reconnoiter, leaving Yu Jin and Li Dian to finish setting out the battle array.Presently Xiahou Dun began to laugh and, when they asked the cause of this merriment, he replied, ""Xu Shu praised Zhuge Liang to the very skies as something more than human. But now that I see how he has placed his soldiers and the stuff he has put into his vanguard, it seems to me that he is sending dogs or sheep against tigers and leopards. I bragged a little when I said I would take him prisoner, but I am going to make good my boast!""Then he rode forward at full speed.Zhao Zilong rode to meet him, and Xiahou Dun opened a volley of abuse, ""You lot, followers of Liu Bei, are only like wraiths following devils!"""
雲大怒，縱馬來戰。兩馬相交，不數合，雲詐敗而走。夏侯惇從後追趕。雲約走十餘里，回馬又戰，不數合又走。韓浩拍馬向前諫曰：「趙雲誘敵，恐有埋伏。」惇曰：「敵軍如此，雖十面埋伏，吾何懼哉！」遂不聽浩言，直趕至博望坡。一聲砲響，玄德自引軍衝將過來，接應交戰。夏侯惇笑謂韓浩曰：「此即埋伏之兵也！吾今晚不到新野，誓不罷兵！」乃催軍前進。玄德、趙雲退後便走。,"This angered Zhao Zilong and a combat began. In a little time Zhao Zilong turned and retreated as if he was worsted. Xiahou Dun pressed after him and kept up the chase for some three miles. Then Zhao Zilong suddenly turned again and offered fight, but only to retreat after a few passes.Seeing these tactics Han Hao, one of Xiahou Dun's generals, rode up to his chief and urged him to use caution, saying, ""I fear he is trying to lead us into an ambush.""""With such antagonists as these, I should not fear even Ten Ambushes!"" replied Xiahou Dun, pressing forward eagerly.Just as he reached the slope, he heard the roar of a bomb and out came Liu Bei to attack.""Here is your ambush!"" said Xiahou Dun, laughing. ""I will get to Xinye this evening before I have done.""Xiahou Dun urged his soldiers forward, and his opponents retired in measure as he advanced."
時天色己晚，濃雲密布，又無月色；晝風既起，夜風愈大。夏侯惇只顧催軍趕殺。于禁、李典趕到窄狹處，兩邊都是蘆葦。典謂禁曰：「欺敵者必敗。南道路狹，山川相逼，樹木叢雜，倘彼用火攻，奈何？」禁曰：「君言是也。吾當往前為都督言之。君可止住後軍。」李典便勒回馬，大叫：「後軍慢行！」人馬走發，那裡攔當得住。于禁驟馬大叫：「前軍都督且住！」,"As evening came on, thick clouds overcast the whole sky. The wind increased but the leader still urged his troops after the retreating foe.The two generals in the rear came to a narrow part of the road with reeds and rushes thick all round them.""Those who despise the enemy are beaten,"" said Li Dian to Yu Jin. ""Away south there the roads are narrow, and streams and mountains make the country difficult. The forests are dense, and if the enemy used fire we should be lost.""""You are right,"" replied Yu Jin. ""I will get on and warn the Commanding General. Perhaps he will stop. You can halt those who come up.""Yu Jin rode forward shouting at the top of his voice, ""Halt the train!"""
夏侯惇正走之間，見于禁從後軍奔來，便問何故。禁曰：「南道路狹，山川相逼，樹木叢雜，可防火攻。」夏侯惇猛省，即回馬令軍馬勿進。,"Xiahou Dun saw him coming up and asked what the matter was.Yu Jin said, ""The roads here are narrow and difficult. Around us are thick forests. What if they use fire?""Xiahou Dun's ferocity had then somewhat abated, and he turned his steed toward his main body."
言未已，只聽背後喊聲震起，早望見一派火光燒著；隨後兩邊蘆葦亦著。一霎時，四方八面，盡皆是火。又值風大，火勢愈猛。曹家人馬，自相踐踏，死者不計其數。趙雲回軍趕殺，夏侯惇冒煙突火而走。,"Then there arose a shout behind him. A rushing noise came from in the reeds and great tongues of flame shot up here and there. These spread and soon the fire was in ""the four quarters and the eight sides,"" and fanned by a strong wind.Xiahou Dun's troops were thrown into confusion and trampled each other down. Many perished. Zhao Zilong turned on them again to make a slaughter. Xiahou Dun dashed through the fire and smoke to escape."
且說李典見勢頭不好，急奔回博望城，時火光中一軍攔住。當先大將，乃關雲長也。李典縱馬混戰，奪路而走。于禁見糧草車輛，都被火燒，便投小路奔逃去了。夏侯蘭、韓浩來救糧草，正遇張飛。戰不數合，張飛一槍刺夏侯蘭於馬下。韓浩奪路走脫。直殺到天明，卻纔收軍。殺得屍橫遍野，血流成河。後人有詩曰：,"Now Li Dian saw that things were going very badly, so he turned to get back to Bowang but fell upon a body of troops in the way, led by Guan Yu. He desperately dashed into their midst and managed to get clear. Yu Jin saw the supplies were being destroyed and there was nothing left to guard, so he escaped along a bye-path. Two other generals, who came to try to save the baggage train, met Zhang Fei; and Xiahou Lan was slain forthwith, but Han Hao managed to flee. Next morning the countryside was strewn with corpses and drenched with blood."
博望相持用火攻，指揮如意笑談中。直須驚破曹公膽，初出茅廬第一功！,"The armies met on Bowang SlopeAnd Zhuge Liang fought with fire;A perfect strategist, he bentAll humans to his desire.But poor Cao Cao, his enemy,He trembled in his shoesBefore the man, who'd never foughtBut yet could armies use."
夏侯惇收拾殘軍，自回許昌。卻說孔明收軍，關、張二人相謂曰：「孔明真英傑也！」行不數里，見糜竺、糜芳引軍簇擁著一輛小軍，車中端坐一人，乃孔明也。關、張下馬拜伏於車前。須臾，玄德、趙雲、劉封、關平等皆至，收聚眾軍，把所獲糧草輜重，分賞將士，班師回新野。新野百姓望塵遮道而拜，曰：「吾屬生全，皆使君得賢人之力也！」,"Xiahou Dun drew up the battered remains of his army and led them back to Xuchang.Zhuge Liang ordered his armies to collect.As Guan Yu and Zhang Fei rode homeward, they confessed, saying, ""Zhuge Liang is really a fine strategist!""Before long they saw Mi Zhu and Mi Fang leading out a small body of soldiers. Among them was a light carriage in which the Directing Instructor Zhuge Liang was seating. Guan Yu and Zhang Fei dismounted and bowed before him. The remaining bodies came in. The spoil was distributed among the soldiers and all returned to Xinye, where the populace lined the roads to bid them welcome.""We owe our lives to the Prince!"" they cried to Liu Bei."
孔明回至縣中，謂玄德曰：「夏侯惇雖敗去，曹操必自引大軍來。」玄德曰：「似此如之奈何？」孔明曰：「亮有一計，可敵曹軍。」正是：破敵未堪息戰馬，避兵又必賴良謀。未知其計若何，且看下文分解。,"Said Zhuge Liang, ""Xiahou Dun has been driven off, but Cao Cao will come with a stronger force.""""And what shall we do?"" replied Liu Bei.""My plan is quite ready,"" said Zhuge Liang.Always battles, nowhere rest for horse or human;Must rely on ruses, dodging where one can.The plan prepared against Cao Cao will be unfolded in the next chapter."
