chinese,english
卻說孫權督眾攻打夏口，黃祖兵敗將亡，情知守把不住，遂棄江夏，望荊州而走。甘寧料得黃祖必走荊州，乃於東門外伏兵等候。祖帶數十騎突出東門，正走之間，一聲喊起，甘寧攔住。祖於馬上謂寧曰：「我向日不曾輕待汝，今何相逼耶？」寧叱曰：「吾昔在江夏，多立功績，汝乃以劫江賊待我，今日尚有何說？」,"Now Sun Quan fought against Xiakou. When Huang Zu recognized that he was beaten and could not maintain his position, he abandoned Jiangxia and took the road to Jingzhou. Gan Ning, foreseeing this, had laid an ambush outside the east gate of Jiangxia. Soon after the fugitive, with a small following, had burst out of the gate, he found his road blocked.From horseback, Huang Zu said, ""I treated you well in the past. Why do you now press me so hard?""Gan Ning angrily shouted, ""I did good service for you, and yet you treated me as a pirate. Now what have you to say?"""
黃祖自知難免，撥馬而走。甘寧衝開士卒，直趕將來，只聽得後面喊聲起處，又有數騎趕來。寧視之，乃程普也。寧恐普來爭功，慌忙拈弓搭箭，背射黃祖，祖中箭翻身落馬，寧梟其首級，回馬與程普合兵一處，回見孫權，獻黃祖首級。權命以木匣盛貯，待回江東祭獻於亡父靈前。重賞三軍，陞甘寧為都尉。商議欲分兵守江夏。張昭曰：「孤城不可守，不如且回江東。劉表知我破黃祖，必來報讎。我以逸待勞，必敗劉表。表敗而後乘勢攻之，荊襄可得也。」權從其言，遂棄江夏，班師回江東。,"There was nothing to be said, and Huang Zu turned his horse to escape. But Gan Ning thrust aside his troops and himself rode in pursuit. Then he heard a shouting in his rear and saw General Cheng Pu coming up. Fearing lest this other pursuer should overpass him and score the success he desired for himself, Gan Ning fitted an arrow to his bow and shot at the fugitive. Huang Zu was hit and fell from his steed. Then Gan Ning cut off his head. After this, joining himself to Cheng Pu, the two returned bearing the ghastly trophy to their lord. Sun Quan ordered them to place it in a box to be taken back home and offered as a sacrifice to the manes of his father. Having rewarded the soldiers for the victory and promoted Gan Ning, Sun Quan next discussed the advisability of sending a force to hold Jiangxia.But his adviser, Zhang Zhao, said, ""It is impossible to try to hold one distant city alone. It is better to return home and prepare for the expedition that Liu Biao will surely send in revenge. We will meet and defeat his worn army, push home the attack, and capture his whole region.""Sun Quan saw the advice was wise, so he left Jiangxia and led his army home to the South Land."
蘇飛在檻車內，密使人告甘寧求救。寧曰：「飛即不言，吾豈忘之？」大軍既至吳會，權命將蘇飛梟首，與黃祖首級一同祭獻。甘寧乃入見權，頓首哭告曰：「某向日若不得蘇飛，則骨填溝壑矣，安能效命將軍麾下哉？今飛罪當誅，某念其昔日之恩情，願納還官爵，以贖飛罪。」權曰：「彼既有恩於君，吾為君赦之；但彼若逃去，奈何？」寧曰：「飛得免誅戮，感恩無地，豈肯走乎？若飛去，寧願將首級獻於階下。」權乃赦蘇飛，止將黃祖首級祭獻。祭畢設宴，大會文武慶功。,"Now Su Fei was still confined, but he got someone to go to Gan Ning to beg him to plead for mercy. Gan Ning had expected this although the prisoner had said no word, and he was averse from leaving his friend and one-time protector to perish.""I should not have forgotten him even if he had said nothing,"" said Gan Ning.When the army had returned, Sun Quan gave orders for Su Fei's execution that his head might be offered with that of Huang Zu.Then Gan Ning went in to his lord and said, weeping, ""Long ago, if it had not been for Su Fei, my bones would have been rotting in some ditch and how then could I have rendered service under your banner? Now he deserves death, but I cannot forget his kindness to me, and I pray you take away the honors you have bestowed on me as a set-off to his crime.""Sun Quan replied, ""Since he once showed kindness to you, I will pardon him for your sake. But what can be done if he run away?""""If he be pardoned and escape death, he will be immeasurably grateful and will not go away. If he should, then will I offer my life in exchange.""So the condemned man escaped death, and only one head was offered in sacrifice. After the sacrificial ceremonies, a great banquet was spread in honor of the victories."
正飲酒間，忽見座上一人大哭而起，拔劍在手，直取甘寧。寧忙舉坐椅以迎之。權驚視其人，乃凌統也，因甘寧在江夏時，射死他父親凌操，今日相見，故欲報讎。權連忙勸住，謂統曰：「興霸射死卿父，彼時各為其主，不容不盡力。今既為一家人，豈可復理舊讎？萬事皆看吾面。」凌統叩頭大哭曰：「不共戴天之讎，豈容不報？」權與眾官再三勸之，凌統只是怒目而視甘寧。權即日命甘寧領兵五千，戰船一百隻，往夏口鎮守，以避凌統。寧拜謝，領兵自往夏口去了。權又加封凌統為承烈都尉，統只得含恨而止。,"As it was proceeding, suddenly one of the guests burst into loud lamentations, drew his sword, and rushed upon Gan Ning. Gan Ning hastily rose and defended himself with the chair on which he had been sitting. The host looked at the assailant and saw it was Ling Tong, whose father Ling Cao had fallen under an arrow shot by Gan Ning. The son was now burning to avenge his father's death.Hastily leaving his place, Sun Quan checked the angry officer, saying, ""If he slew your noble father, then remember each was fighting for his lord for whom he was bound to exert himself to the utmost. But now that you both are under one flag and are of one house, you may not recall an ancient injury. You must regard my interests continually.""Ling Tong beat his head upon the floor and cried, saying, ""But how can I not avenge this? It is a blood feud, and we may not both live under the same sky.""The guests interfered, beseeching the man to forgo his revenge, and at last he ceased from his murderous intention. But he sat glaring wrathfully at his enemy.So soon after Gan Ning was dispatched with five thousand troops and one hundred warships to guard Xiakou, where he was beyond the reach of Ling Tong's wrath. Then Sun Quan promoted Ling Tong, and so he was somewhat appeased."
東吳自此廣造戰船，分兵守把江岸；又命孫靜引一枝軍守吳會；孫權自領大軍，屯柴桑；周瑜日於鄱陽湖教練水軍，以備攻戰。,"From about this time the South Land enlarged her fleets, and soldiers were sent to various points to guard the river banks. The brother of the chieftain, Sun Kuang, was placed in command at Wujun, and Sun Quan himself, with a large army, camped at Chaisang. Zhou Yu, Commander-in-Chief of the army and Supreme Admiral of the navy, was on the Poyang Lake training the naval forces, and general preparations were made for defense and attack."
話分兩頭。卻說玄德差人打探江東消息，回報：「東吳已攻殺黃祖，現今屯兵柴桑。」玄德便請孔明計議。,"By his spies, Liu Bei had tidings of the doings in the lower portion of the Great River, and knew of the death of Huang Zu. So he consulted Zhuge Liang as to his action."
正話間，忽劉表差人來請玄德赴荊州議事。孔明曰：「此必因江東破了黃祖，故請主公商議報讎之策也。」某當與主公同往，相機而行，自有良策。」,"While they were discussing matters, there arrived a messenger from Liu Biao, begging Liu Bei to go to see him.Zhuge Liang advised him to go and said, ""This call is to consult you about avenging Huang Zu. You must take me with you and let me act as the circumstances direct. There are advantages to be got."""
玄德從之，留雲長守新野，令張飛引五百人馬跟隨往荊州來。玄德在馬上謂孔明曰：「今見景升，當若何對答？」孔明曰：「當先謝襄陽之事。他若令主公去征討江東，切不可應允。但說容歸新野，整頓軍馬。」,"Leaving Guan Yu in command at Xinye, Liu Bei set forth, taking Zhang Fei with five hundred soldiers as his escort.On the way he discussed the course of action with his adviser, who said, ""First you must thank Liu Biao for having saved you from the evil that Cai Mao planned against you at Xiangyang. However, you must not undertake any expedition against the South Land but say you must return to Xinye to put your army in good order."""
玄德依言，來到荊州，館驛安下，留張飛屯兵城外。玄德與孔明入城見劉表。禮畢，玄德請罪於階下。表曰：「吾已悉知賢弟被害之事。當時即欲斬蔡瑁之首，以獻賢弟。因眾人告免，故姑恕之。弟幸勿見罪。」玄德曰：「非干蔡將軍之事，想皆下人所為耳。」表曰：「今江夏失守，黃祖遇害，故請賢弟共議報復之策。」玄德曰：「黃祖性暴，不能用人，故致此禍。今若興兵南征，倘曹操北來，又將奈何？」表曰：「吾今年老多病，不能理事，賢弟可來助我。我死之後，弟便為荊州之主也。」玄德曰：「兄何出此言？量備安敢當此重任？」,"With this admonition Liu Bei came to Jingzhou and was lodged in the guest-house. Zhang Fei and the escort camped without the walls. In due course Liu Bei and Zhuge Liang were received, and after the customary salutations, Liu Bei apologized for his conduct at the banquet.The host said, ""Worthy brother, I know you were the victim of a vile plot; and I should have put the prime mover to death for it, had there not been so universal a prayer for mercy. However, I remitted that penalty. I hope you do not consider that I was wrong.""""Cai Mao had little to do with it. I think it was due to his subordinates,"" replied Liu Bei.Liu Biao said, ""Jiangxia is lost, as you know, and Huang Zu is dead. So I have asked you to come that we might take measures of vengeance.""""Huang Zu was harsh and cruel and never used his people in the proper way: That was the real cause of his fall. But have you reflected what Cao Cao may do on the north if we attack the south?""""I am getting old and weak, and I am unable to manage affairs properly. Will you aid me, brother? After I am gone you will have this region.""""Why do you say this, my brother? Think you that I am equal to such a task?"""
孔明以目視玄德。玄德曰：「容徐思良策。」遂辭出，回至館驛。孔明曰：「景升欲以荊州付主公，奈何卻之？」玄德曰：「景升待我，恩禮交至，安忍乘其危而奪之？」孔明嘆曰：「真仁慈之主也！」,"Here Zhuge Liang glanced at Liu Bei who continued, ""But give me a little time to think it over.""And at this point he took his leave.When they had reached their lodging, Zhuge Liang said, ""Why did you decline his offer of the region.""""He has always been most kind and courteous. I could not take advantage of his weakness.""""A perfectly kind and gracious lord,"" sighed Zhuge Liang."
正商論間，忽報公子劉琦來見。玄德接入。琦泣拜曰：「繼母不能相容，性命只在旦夕，望叔父憐而救之。」玄德曰：「此賢姪家事耳，奈何問我？」孔明微笑，玄德求計於孔明。孔明曰：「此家事，亮不敢與聞。」,"Soon after the son of the Imperial Protector, Liu Qi, was announced, and Liu Bei received him and led him in.The young man began to weep, saying, ""My mother cannot bear the sight of me. My very life is in danger. Can you not save me, Uncle?""""My worthy nephew, this is a family affair. You should not come to me.""Zhuge Liang who was present, smiled. Liu Bei turned to him to know what he should do.""This is a family affair. I cannot touch it!"" replied Zhuge Liang."
少時，玄德送琦出，附耳低言曰：「來日我使孔明回拜賢姪，可如此如此，彼定有妙計相告。」琦謝而去。,"The young man soon left, and when Liu Bei was saying good-bye, he whispered, ""I will get Zhuge Liang to return your call, and you can do so and so. He will advise you."" Liu Qi thanked him and left."
次日，玄德只推腹痛，乃挽孔明代往回拜劉琦。孔明允諾，來至公子宅前下馬，入見公子。公子邀入後堂。茶罷，琦曰：「琦不見容於繼母，幸先生一言相救。」孔明曰：「亮客寄於此，豈敢與人骨肉之事？倘有泄漏，為害不淺。」說罷，起身告辭。琦曰：「既承光顧，安敢慢待？」乃挽留孔明入密至共飲。,"Next day when the call was to be returned, Liu Bei pretended to be suffering from colic and made that an excuse to send Zhuge Liang to return the call.The adviser went, and when he had reached the palace, dismounted, and was led in, Liu Qi conducted him into one of the inner rooms.When the tea had been brought, Liu Qi said, ""I am an object of my stepmother's dislike. Can you advise me what to do?""""As a mere stranger guest, I can hardly have anything to do with your own 'bone and flesh' matters. If I did, and the story got abroad, much harm might ensue.""With this he rose to take leave. But Liu Qi was unwilling to say farewell, and he said, ""Your glory has turned in my direction. You cannot mean to go away so pointlessly.""Liu Qi led his visitor into a private chamber and had refreshments brought."
飲酒之間，琦又曰：「繼母不見容，乞先生一言救我。」孔明曰：「此非亮所敢謀也。」言訖，又欲辭去。琦曰：「先生不言則已，何便欲去？」孔明乃復坐。琦曰：「琦有一古書，請先生一觀。」乃引孔明登一小樓。孔明曰：「書在何處？」琦泣拜曰：「繼母不見容，琦命在旦夕，先生忍無一言相救乎？」,"While they ate and drank, Liu Qi repeated his first request: What was he to do since his stepmother disliked him.""It is not the sort of thing I can advise in,"" replied Zhuge Liang, as he rose for the second time to take leave.""Master, if you will not reply, that is well. But why incontinently leave me?""So the adviser once more seated himself, and Liu Qi said, ""There is an ancient writing I should like to show you.""And he led his visitor to a small upper room.""Where is the writing?"" said Zhuge Liang.Instead of answering Liu Qi wept, saying, ""My stepmother cannot bear me. My life is in danger. O Master, will you not say a word to save me?"""
孔明作色而起，便欲下樓，只見樓梯已撤去。琦告曰：「琦欲求教良策，先生恐有泄漏，不肯出言；今日上不至天，下不至地，出君之口，入琦之耳，可以賜教矣。」孔明曰：「『疏不間親』，亮何能為公子謀？」琦曰：「先生終不肯教琦乎？琦命固不保矣，請即死於先生之前。」乃掣劍欲自刎。孔明止之曰：「已有良計。」琦拜曰：「願即賜教。」孔明曰：「公子豈不聞申生、重耳之事乎？申生在內而亡，重耳在外而安。今黃祖新亡，江夏乏人守禦，公子何不上言，乞屯兵守江夏？則可以避禍矣。」,"Zhuge Liang flushed and rose to go away. But he found the ladder by which they had mounted had been removed.Again Liu Qi besought some advice, saying, ""Master, you fear lest it may get abroad! Is that why you are silent? Here we are between earth and sky, and what you say will come out of your mouth directly into my ear. No other soul can hear. Now can you tell me what to do?""""Sow not dissension among relatives,"" said Zhuge Liang. ""Is it possible for me to make any plan for you?""""Then is my life indeed in danger,"" said the young man. ""I will die at your feet.""So saying, Liu Qi pulled out a dagger and threatened to make an end of himself.Zhuge Liang checked him, saying, ""There is a way.""""I pray you tell me.""""You have heard of the old tale of the brothers Shen Sheng and Chong Er, have you not? Shen Sheng stayed at home and died; his brother Chong Er went away and lived in peace. Now that Huang Zu is gone and Jiangxia is weakly defended, why do you not ask to be sent there to guard it? Then you would be out of the way of harm."""
琦再拜謝教，乃命人取梯送孔明下樓。孔明辭別，回見玄德，具言其事，玄德大喜。次日，劉琦上言，欲守江夏。劉表猶豫未決，請玄德共議。玄德曰：「江夏重地，固非他人可守，正須公子自往。東南之事，兄父子當之；西北之事，備願當之。」表曰：「近聞曹操於鄴郡作玄武池以練水軍，必有南征之意，不可不防。」玄德曰：「備已知之，兄勿憂慮。」遂拜辭回新野。劉表令劉琦引兵三千往江夏鎮守。,"Liu Qi thanked him. Then he called to his people to restore the ladder, and he escorted Zhuge Liang down to the level ground.Zhuge Liang returned to Liu Bei and related the whole interview. The young man soon acted on the advice given him, but his father would not at first consent to let him go.To settle his doubts Liu Biao sent for Liu Bei, who said, ""Jiangxia is important, and your son is the most suitable man to defend it. You must let him go. The southeast will be defended by your son. The northwest I will look after.""""I hear that Cao Cao has been training a naval force, and I am afraid he has intentions against us. We must be on our guard.""""I know all about it. You need feel no anxiety,"" said Liu Bei.He took leave of his relative and went home while Liu Qi received command of three thousand soldiers and went to guard Jiangxia."
卻說曹操罷三公之職，自以丞相兼之，以毛玠為東曹掾；崔琰為西曹掾；司馬懿為文學掾。懿字仲達，河內溫人也：潁川太守司馬雋之孫，京兆尹司馬防之子，主簿司馬朗之弟也。自是文官大備，乃聚武將商議南征。夏侯惇進曰：「近聞劉備在新野，每日教演士卒，必為後患，可早圖之。」,"At this time Cao Cao suppressed the three highest officers of state and exercised their functions himself as the Prime Minister. He appointed as his general secretaries Mao Jie and Cui Yan, and as literary secretary Sima Yi. Sima Yi of Henei was grandson of Sima Juan, Governor of Yingchuan; son of Sima Fang, Governor of Jingzhao; and younger brother of Sima Lang, Secretary General."
操即命夏侯惇為都督；于禁、李典、夏侯蘭、韓浩為副將；領兵十萬，直抵博望城，以窺新野。荀彧諫曰：「劉備英雄，今更兼諸葛亮為軍師，不可輕敵。」惇曰：「劉備鼠輩耳，吾必擒之。」徐庶曰：「將軍勿輕視劉玄德。今玄德得諸葛亮為輔，如虎生翼矣。」操曰：「諸葛亮何人也？」庶曰：「亮字孔明，道號臥龍先生。有經天緯地之才，出鬼入神之計，真當世奇士，非可小覷。」,"Cao Cao then called his officers to a council to discuss an expedition against the south.Xiahou Dun opened the debate, saying, ""Liu Bei is drilling his army at Xinye, and is a source of danger. He should be destroyed.""Accordingly Xiahou Dun was appointed Commanding General, and four assistants —-Yu Jin, Li Dian, Xiahou Lan, and Han Hao —-were given him. With these he led one hundred thousand troops to Bowang, whence he could observe Xinye.Xun Yu was opposed to this and said, ""Liu Bei is a famous warrior, and he has lately taken to himself as his Directing Instructor Zhuge Liang. Caution is needed!""Xiahou Dun replied, ""Liu Bei is a mean rat! I will certainly take him prisoner.""""Do not despise him,"" said Xu Shu. ""Remember he has Zhuge Liang to help him, and so he is like a tiger who has grown wings."""
操曰：「比公若何？」庶曰：「庶安敢比亮？庶如螢火之光，亮乃皓月之明也。」夏侯惇曰：「元直之言謬矣。吾看諸葛亮如草芥耳，何足懼哉！吾若不一陣生擒劉備，活捉諸葛，願將首級獻與丞相。」操曰：「汝早報捷書，以慰吾心。」惇奮然辭曹操，引軍登程。,"Cao Cao said, ""Who is this Zhuge Liang?""""He has taken a Daoist cognomen of Sleeping Dragon. He is a perfect genius, god and devil combined, the greatest marvel of the age. Do not despise him.""""How does he stand as compared with you?"" asked Cao Cao.""There is no comparison. I am a mere glow-worm spark; he is the glory of the full moon,"" replied Xu Shu.""You are mistaken,"" replied Xiahou Dun. ""This Zhuge Liang of yours is of no account. Who would fear him? If I do not take him and his master prisoners in the first battle, then here is my head, a free gift to our lord, the Prime Minister.""""Hasten to comfort me with news of victory,"" said Cao Cao.Xiahou Dun hastened to depart."
卻說玄德自得孔明，以師禮待之。關、張二人不悅曰：「孔明年幼，有甚才學！兄長待之太過！又未見他真實效驗！」玄德曰：「吾得孔明，猶魚之得水也。兩弟勿復多言。」關、張見說，不言而退。一日，有人送犛牛尾至。玄德取尾親自結帽。孔明入見，正色曰：「明公無復有遠志，但事此而已耶？」玄德投帽於地而謝曰：「吾聊假此以忘憂耳。」孔明曰：「明公自度比曹操若何？」玄德曰：「不如也。」孔明曰：「明公之眾，不過數千人，萬一曹兵至，何以迎之？」玄德曰：「吾正愁此事，未得良策。」孔明曰：「可速招募民兵，亮自教之，可以待敵。」玄德遂招新野之民，得三千人。孔明朝夕教演陣法。忽報曹操差夏侯惇引兵十萬，殺奔新野來了。張飛聞知，謂雲長曰：「可著孔明前去迎敵便了。」,"The advent of Zhuge Liang and the extravagant deference shown him did not please Liu Bei's sworn brothers who grumbled, saying, ""He is very young, although he is clever and learned. Our brother really treats him too well. We have not seen any evidence of his wonderful skill.""Liu Bei replied, ""You do not know his worth. I have him as if the fish has got into the water again. Pray do not discuss this matter further, my brothers.""They withdrew, silent but dissatisfied.One day a man presented Liu Bei with a yak's tail, and he at once was trying to weave it into his cap as an ornament. Zhuge Liang came in and noticed it at once.""Then you have renounced all ambitions, my lord. You are just going to attend to this sort of thing,"" Zhuge Liang quietly remarked.Liu Bei snatched off his cap and flung it away, saying, ""I was only amusing myself with the thing.""""How do you think you stand compared with Cao Cao?"" asked Zhuge Liang.""Inferior.""""Yes. Your army is less than ten thousand, and the chances are ten thousand to one that he will attack. How can we meet him?""""I am greatly distressed about it, but I see no way.""""You might recruit, and I will train them. Then we might be able to oppose him.""So recruiting began and three thousand were enlisted. Zhuge Liang set about drilling them diligently.Soon they heard that Xiahou Dun was leading an army of one hundred thousand troops against them.When he heard it, Zhang Fei said to his brother, Guan Yu, ""We will get this Zhuge Liang to go and fight them."""
正說之間，玄德召二人入，謂曰：「夏侯惇引兵到來，如何迎敵？」張飛曰：「哥哥何不使『水』去？」玄德曰：「智賴孔明，勇須二弟，何可推諉？」關、張出，玄德請孔明商議。孔明曰：「但恐關、張二人，不肯聽吾號令。主公若欲亮行兵，乞假劍印。」玄德便以劍印付孔明，孔明遂聚集眾將聽令。張飛謂雲長曰：「且聽令去，看他如何調度。」,"Just at that moment they were summoned to their brother, who asked their advice.""Why not send the 'Water,' brother?"" said Zhang Fei.""For method I rely on Zhuge Liang; but for action I put my faith in you, my brothers. Are you going to fail me?""They went out, and Zhuge Liang was called.""I fear your brothers will not obey me,"" said Zhuge Liang.""Wherefore, if I am to direct the campaign, you must give me a seal of office and a sword of authority.""So Liu Bei gave him both. Armed with these ensigns of power, Zhuge Liang assembled the officers to receive their orders.""We will go just to see what he will do,"" said Zhang Fei to Guan Yu."
