chinese,english
趙範拗不過，只得應允。陳應領三千人馬出城迎敵，早望見趙雲領軍來到。陳應列成陣勢，飛馬綽叉而出。趙雲挺槍出馬，責罵陳應曰：「吾主劉玄德，乃劉景升之弟。今輔公子劉琦同領荊州，特來撫民。汝何故迎敵？」陳應罵曰：「我等只服曹丞相，豈順劉備！」趙雲大怒，挺槍驟馬，直取陳應，應撚叉來迎。兩馬相交，戰到四五合，陳應料敵不過，撥馬便走。趙雲追趕。陳應回顧趙雲馬來相近，用飛叉擲去，被趙雲接住，回擲陳應。應急躲過，雲馬早到，將陳應活捉過馬，擲於地下，喝軍士綁縛回寨。敗軍四散奔走。雲入寨叱陳應曰：「量汝安敢敵我！我今不殺汝，放汝回去；說與趙範，早來投降。」,"With his three thousand troops, Zhao Zilong took the road to Guiyang. The Governor, Zhao Fan, soon heard of his approach and hastily called his officers to take counsel. Two of them, Chen Ying and Bao Long, offered to meet the invaders and turn them back.These two warriors belonged to Guiyang and had made themselves famous as hunters. Chen Ying used a ""Flying Fork,"" and Bao Long could draw a bow with such force that he had been known to send an arrow through two tigers. So strong were they, as well as bold.They stood before Zhao Fan and said, ""We will lead the way against Liu Bei.""The Governor replied, ""I know that Liu Bei is of the imperial family, and Zhuge Liang is exceedingly resourceful. Guan Yu and Zhang Fei are very bold. But the commander of this force is Zhao Zilong who, on one occasion, faced a hundred legions of Cao Cao and never blenched. Our small force here cannot stand against such people. We shall have to yield.""""Let me go out to fight,"" said Chen Ying. ""If I cannot capture Zhao Zilong, then you can yield.""The Governor could not resist him and gave his consent. Then Chen Ying, with three thousand troops, went forth. Soon the two armies came within sight of each other. When Chen Ying's army was drawn up, he girded on his flying fork and rode to the front. Zhao Zilong gripped his spear and rode to meet him.Zhao Zilong began to rail at Chen Ying, saying, ""My master is the brother of Liu Biao to whom belonged this land. Now he is supporting his nephew, the heir and son of Liu Biao. Having taken Jingzhou, I am come to soothe and comfort the people here. Why then do you oppose me?""""We are supporters of the Prime Minister Cao Cao and are no followers of your master,"" was the reply.Zhao Zilong, waxing angry, firmly grasped his spear and rode forward. His opponent twirled the flying fork and advanced. The horses met, but after four or five encounters Chen Ying, realizing that there was no hope of victory, turned and fled. Zhao Zilong followed. Suddenly turning, Chen Ying got close to Zhao Zilong and flung the fork. Zhao Zilong deftly caught it and threw it back. Chen Ying dodged away, but Zhao Zilong soon caught him up, seized, dragged him out of the saddle, and threw him to the ground. Then Zhao Zilong called up his soldiers, and they bound the prisoner. Chen Ying was taken to the camp, while his troops scattered and fled.""I thought you would not dare a combat with me,"" said Zhao Zilong to the prisoner when they had returned to camp. ""However, I am not going to put you to death. You are free. But persuade your master to yield."""
陳應謝罪，抱頭鼠竄，回到城中，對趙範盡言其事。範曰：「我本欲降，汝強要戰，以致如此。」遂叱退陳應，齎捧印綬，引十數騎出城投大寨納降。雲出寨迎接，待以賓禮，置酒共飲，納了印綬。酒至數巡，範曰：「將軍姓趙，某亦姓趙。五百年前，合是一家。將軍乃真定人，，某亦真定人，又是同鄉。倘得不棄，結為兄弟，實為萬幸。」雲大喜，各敘年庚。雲與範同年。雲長範四個月，範遂拜雲為兄。二人同鄉，同年，又同姓，十分相得。至晚席散，範辭回城。,"Chen Ying asked pardon, put his hands over his head, and fled like a frightened rat. When he reached his city, he told the Governor all these things.""My original desire was to yield, but you insisted on fighting, and this is what it has brought you to.""So spoke the Governor. He bade Chen Ying begone and then prepared his letter of submission and put up his seal. With a small party, Zhao Fan went out of the city and wended his way to Zhao Zilong's camp. Zhao Zilong received him graciously, offered him wine, and then accepted the seal of office.After the wine had gone round several times, Zhao Fan became talkative, saying, ""General, your surname is the same as mine, and five centuries ago we were one family. You are from Changshan, and so am I. Moreover we are from the same village. If you do not mind, we might swear brotherhood. I should be very happy.""Zhao Zilong was pleased and they compared ages. They were of the same year. However, Zhao Zilong was the elder by four months, and so Zhao Fan made his bow as younger brother. The two men, having so many things in common, were very pleased with each other and seemed fitted to be close friends.At eventide the feast broke up, and the late Governor returned to his dwelling."
次日，範請雲入城安民。雲教軍士休動，只帶五十騎隨入城中。居民執香伏道而接。雲安民畢，趙範邀請入衙飲宴。酒至半酣，範復邀雲入後堂深處，洗盞更酌。雲飲微醉，範忽請一婦人，與雲把酒。子龍見婦人身穿縞素，，有傾國傾城之色，乃問範曰：「此何人也？」範曰：「家嫂樊氏也。」子龍改容敬之。樊氏把盞畢，範令就坐。雲辭謝。樊氏辭歸後堂。雲曰：「賢弟何必煩令嫂舉盃耶？」範笑曰：「中間有個緣故，乞兄勿阻。先兄棄世已三載，家嫂寡居，終非了局，弟常勸其改嫁。嫂曰：『若得三件事兼全之人，我方嫁之：第一要文武雙全，名聞天下；第二要相貌堂堂，威儀出眾；第三要與家兄同姓。』你道天下那得有這般湊巧的？今尊兄堂堂儀表，名震四海，又與家兄同姓，正兮家嫂所言。若不嫌家嫂貌陋，願備嫁資，與將軍為妻，結累世之親，何如？」,"Next day Zhao Fan requested Zhao Zilong to enter the city, where, after Zhao Zilong had assured the people of their safety, he went to a banquet at the state residence. When they had become mellow with wine, the Governor invited Zhao Zilong into the inner quarters, where wine was again served. When Zhao Zilong was a little intoxicated, his host bade a woman come forth and offer a cup of wine to the guest.The woman was dressed entirely in white silk, and her beauty was such as to overthrow cities and ruin states.""Who is she?"" asked Zhao Zilong.""My sister-in-law. She is of the Fan family.""Zhao Zilong at once changed his look and treated her with deference. When she had offered the cup, the host told her to be seated and join the party, but Zhao Zilong declined this addition to the evening, and the lady withdrew.""Why did you trouble your sister-in-law to present wine to me, brother?"" asked Zhao Zilong.""There is a reason,"" said the host smiling. ""I pray you let me tell you. My brother died three years ago and left her a widow. But this cannot be regarded as the end of the story. I have often advised her to marry again, but she said she would only do so if three conditions were satisfied in one man's person. The suitor must be famous for literary grace and warlike exploits, secondly, handsome and highly esteemed and, thirdly, of the same name as our own. Now where in all the world was such a combination likely to be found? Yet here are you, brother, dignified, handsome, and prepossessing, a man whose name is known all over the wide world and of the desired name. You exactly fulfill my sister's ambitions. If you do not find her too plain, I should like her to marry you and I will provide a dowry. What think you of such an alliance, such a bond of relationship?"""
雲聞言大怒而起，厲聲曰：「吾既與汝結為兄弟，汝嫂即吾嫂也，豈可作此亂人倫之事乎！」趙範羞慚滿面，答曰：「我好意相待，如何這般無禮！」遂目視左右，有相害之意。雲已覺，一拳打倒趙範，逕出府門，上馬出城去了。,"But Zhao Zilong rose in anger, shouting, ""As I have just sworn brotherhood with you, is not your sister-in-law my sister-in-law? How could you think of bringing such confusion into the relationship?""Shame suffused Zhao Fan's face, and he said, ""I only thought of being kind to you. Why are you so very rude to me?""Zhao Fan looked right and left to his attendants with murder in his eye. Zhao Zilong raised his fist and knocked him down.Then he strode out of the place, mounted, and rode out of the city."
範急喚陳應，鮑隆商議。應曰：「這人發怒去了，只索與他廝殺。」範曰：「但恐贏他不得。」鮑隆曰：「我兩個詐降到他軍中，太守卻引兵來搦戰，我二人就陣上擒之。」陳應曰：「必須帶些人馬。」龍曰：「五百騎足矣。」,"Zhao Fan at once called in his two generals.Chen Ying said, ""He has gone away in a rage, which means that we shall have to fight him.""""I greatly fear you will lose,"" said Zhao Fan.""We will pretend to be deserters,"" said Bao Long, ""and so get among his soldiers. When you challenge him, we will suddenly catch him.""""We shall have to take some others with us,"" said Chen Ying.""Five hundred troops will be ample,"" said Bao Long."
當夜二人引五百軍逕投趙雲寨來投降。雲已心知其詐，遂教喚入。二將到帳下說：「趙範欲用美人計賺將軍，只等將軍醉了，扶入後堂謀殺，將頭去曹丞相處獻功，如此不仁。某二人見將軍怒出，必連累於某，因此投降。」趙雲佯喜，置酒與二人痛飲。二人大醉，雲乃縛於帳中，擒其手下人問之，果是詐降。雲喚五百軍人，各賜酒食，傳令曰：「要害我者，陳應，鮑龍也；不干眾人之事。汝等聽吾行計，皆有重賞。」眾軍拜謝，將降將陳，鮑二人，當時斬了；卻教五百軍引路，雲引一千軍在後，連夜到桂陽城下叫門。,"So in the night the two men and their followers ran over to Zhao Zilong's camp to desert.Zhao Zilong understood the trick they would play, but he called them in, and they said, ""When Zhao Fan tempted you with that fair lady, he wanted to make you drunk and get you into the private apartments so that he might murder you and send your head to Cao Cao. Yes, he was as wicked as that even. We saw you go away in anger, and we thought that would mean grave trouble for us, and so we have deserted.""Zhao Zilong listened with simulated joy, and he had wine served to the two men, and pressed them to drink so that they were quite overcome. When this was done, he had both bound with cords, called up their followers, and asked them whether this was real or pretended desertion, and they told him the truth.Then he gave the soldiers wine and said, ""Those who wanted to harm me are your leaders and not you. If you do as I tell you, you shall be well rewarded.""The soldiers threw themselves to the ground and promised obedience. Thereupon the two leaders —-Chen Ying and Bao Long —-were beheaded. Their five hundred troops were made to lead the way and act as screen for a whole thousand of horsemen, and the party set out at full speed for Guiyang. When they got there, they summoned the gate."
城上聽時，說陳、鮑二將軍殺了趙雲回軍，請太守商議事務。城上將火照看，果是自家軍馬。趙範急忙出城，雲喝左右捉下遂入城安撫百姓。已定，飛報玄德。玄德與孔明親赴桂陽。雲迎接入城，推趙範於階下。孔明問之，範備言以嫂許嫁之事。孔明謂雲曰：「此亦美事，公何如此？」雲曰：「趙範既與某結為兄弟，今若娶其嫂，惹人唾罵，一也；其婦再嫁，使失大節，二也；趙範初降，其心難測，三也。主公新定江漢，枕席未安，雲安敢以一婦人而廢主公之大事？」,"They said that they had slain Zhao Zilong and had got back. And they wished to speak with the Governor.Those on the wall lighted flares and inspected those at the gate. Surely enough they wore the uniforms of their own people, and Zhao Fan went out to them. He was immediately seized and made prisoner. Then Zhao Zilong entered the city, restored order, and sent off swift messengers to Liu Bei who at once, with his adviser, came to Guiyang.When they had taken their seats, the late Governor was brought in and placed at the foot of the steps. In response to Zhuge Liang's questions, Zhao Fan related the story of the proposed marriage.Said Zhuge Liang to Zhao Zilong, ""But this seems a fine project. Why did you receive the proposal so roughly?""Zhao Zilong said, ""Zhao Fan and I had just sworn brotherhood, and so marriage with his sister-in-law would have called down on my head universal blame. That is one reason. Another is that I should have made his sister fail to keep her dutiful chastity. And thirdly, I did not know whether I might trust such a proposal from one who had just yielded to force. My lord, your position as a recent victor was one of danger, and could I risk the failure of your plans for my sake?"""
玄德曰：「今日大事已定，與汝娶之，若何？」雲曰：「天下女子不少，但恐名譽不立，何患無妻子乎？」玄德曰：「子龍真丈夫也！」遂釋趙範，仍令為桂陽太守，重賞趙雲。,"Liu Bei said, ""But now that the plan has been carried out, and we are victors, would you care to marry her?""""All my fear is for the building of a reputation. Family can come later.""""You are indeed right honorable,"" said Liu Bei.Zhao Fan was released and restored to the governorship. Zhao Zilong was conspicuously rewarded."
張飛大叫曰：「偏子龍幹得功，偏我是無用之人！只撥三千軍與我去取武陵郡，活捉太守金旋來獻！」孔明大喜曰：「翼德要去不妨，但要依一件事。」正是：軍師決勝多奇策，將士爭先立戰功。未知孔明說出那一件事來，且看下文分解。,"But Zhang Fei was angry and disappointed.""So Zhao Zilong gets all the praise, and I am worth nothing,"" cried he. ""Just give me three thousand soldiers, and I will take Wuling and bring you the Governor.""This pleased Zhuge Liang, who said, ""There is no reason why you should not go, but I will only require one condition of you.""Wondrous, the plans of the general, so doth he conquer in battle;Soldiers keenly competing gain renown in the fighting. The condition that Zhuge Liang made will appear in the next chapter."
