chinese,english
天在山中，大畜；君子以多識前言往行，以畜其德。,"(The trigram representing) a mountain, and in the midst of it that (representing) heaven, form Da Xu. The superior man, in accordance with this, stores largely in his memory the words and deeds of former men, to subserve the accumulation of his virtue."
有厲利已，不犯災也。,'He is in a position of peril; it will be advantageous for him to stop his advance:' - he should not rashly expose himself to calamity.
輿說輹，中无尤也。,"'(He is as) a carriage from which the strap under it has been removed:' - being in the central position, he will incur no blame."
利有攸往，上合志也。,'There will be advantage in whatever direction he may advance:' - (the subject of) the topmost line is of the same mind with him.
六四元吉，有喜也。,"'The great good fortune indicated by the fourth six, (divided),' shows that there is occasion for joy."
六五之吉，有慶也。,"'The good fortune indicated by the fifth six, (divided),' shows that there is occasion for congratulation."
何天之衢，道大行也。,'In command of the firmament of heaven:' - the way is grandly open for movement.
